3,"April 1, 2018"," Pros: play on different sized boards and undo; Cons: weird bug. Periodically, the board advances 2 steps. When it does, the tiles move in a direction unintended. Uninstalling."
1,"April 24, 2018"," Game as a normal 2048 game with some features until you play for more 
minutes and stumble upon one of the worst type of glitches. Every single 
time the game loads and ad, a movement is done automatically, basically 
ruining your game if you have went up to high numbers. The one undo can't 
help it...Full ReviewGame as a normal 2048 game with some features until you play for more 
minutes and stumble upon one of the worst type of glitches. Every single 
time the game loads and ad, a movement is done automatically, basically 
ruining your game if you have went up to high numbers. The one undo can't 
help it if you are playing it fast. Wouldn't recommend this game to anybody."
2,"March 14, 2018", Good for a short time. Once you learn the strategy it is just repetitive and dull.
5,"April 28, 2018"," Love it I played one game of 5×5 for more then a month. It let me through a 
lot of stress."
3,"January 18, 2018"," When the game ends it's very abrupt - the board disappears to be covered by an ad and load music blares - very unpleasant. I hate the color scheme - this would be much funner if could choose - Caribbean blues, shades of green, Valentine reds and pinks..."
1,"April 20, 2018", Unable to play past 1048576 in the 8x8 board! Kindly fix and revert.
2,"February 20, 2018"," A couple of years ago I completed a perfect game. Meaning I had the maximum sized tiles on every place on the board. It took about a week in that game to get there. I got this yesterday and was up to 8192 in my big tile, close to a 16384. This morning it was gone and asked if I wanted to start a new...Full ReviewA couple of years ago I completed a perfect game. Meaning I had the maximum sized tiles on every place on the board. It took about a week in that game to get there. I got this yesterday and was up to 8192 in my big tile, close to a 16384. This morning it was gone and asked if I wanted to start a new game. DELETE!"
4,"February 28, 2018", It's a good game.. liked it.. The game goes infinite never ending once you get the 2048 tile.. it's been more than a month I have not completed the 6x6 board....
1,"March 22, 2018"," It shows me unwanted notifications, that I can't turn off, except of blocking app notifications altogether."
2,"February 20, 2018", The maker modified the game to give 4s in the critical time so that game ends and ad comes. Probably justified by revenue making angle. But otherwise nice game
1,"January 21, 2018"," This version of the game has a glitch in the app where whenever an ad refreshes it lags the game and causes it to glitch out and makes random moves for you. Not impressed, just another money hungry knockoff"
2,"February 25, 2018", Omg load your ads asynchronously. It keeps lagging the game and ruining my moves.
3,"March 9, 2018", It hangs after it reaches 8192+4096. You need to update it. Please remove the bug
2,"February 21, 2018"," Wish I could say I love it , I do like this game but whenever I finish a round the game won't let me restart no matter what I do"
1,"March 26, 2018"," the app crashes at any point losing all advance since the last run. also, as others said, it has ruined me dozens of plays because it makes wrong swipes. seriously, this is unusable."
5,"March 21, 2018", Absolutely love this  game!  It is quite addictive!  I love trying to beat my own scores! This is not only a good time killer it is a great way to keep the mind busy! Recommend? DEFINITELY!!!
5,"April 16, 2018"," Maybe not the most exciting, but it makes your mind work."
5,"June 24, 2018"," Date 15/06/2018 MHN Line W/C % Time/Lab/MFM/DD 2200/8.5/10.6/0.9073 
2300/5.6/6.9/- 2400/4.0/5.6/0.9072 0100/4.1/7.8/- 0200/3.4/7.5/0.9089 
0300/2.8/7.2/- 0400/2.2/6.9/0.9093 0500/2.0/6.4/- N/S:- 4.1% 
_________________________ Date: 15/06/2018 KNK W/C- 0.06% Dispatch - m3 MHN 
LAB/MFM - 4.2/ Train ...Full ReviewDate 15/06/2018 MHN Line W/C % Time/Lab/MFM/DD 2200/8.5/10.6/0.9073 
2300/5.6/6.9/- 2400/4.0/5.6/0.9072 0100/4.1/7.8/- 0200/3.4/7.5/0.9089 
0300/2.8/7.2/- 0400/2.2/6.9/0.9093 0500/2.0/6.4/- N/S:- 4.1% 
_________________________ Date: 15/06/2018 KNK W/C- 0.06% Dispatch - m3 MHN 
LAB/MFM - 4.2/ Train inlet/ outlet - 16.6/6.2 Demulsifier : SA-54 Dose ( in 
ppm) : 85-80 used : 06 Received : 00 Balance : 51 T-103 Pro@ 2130 hrs, 
14/06 T-104 Feed@0345 hrs,16/06 T-105 Id@2330 hrs, 14/06 T-106 Id@0330 hrs, 
16/06 T-107 u/m 1415 hrs, 19/06/17 T-108 R 0345hrs, 16/06 MHS COMP DD:0.9062"
5,"February 25, 2018", Great fun.  I know I can stop quickly and come back with no problem.  An easy but strategic game.
5,"February 4, 2018", I was looking for a very simple yet challenging game and I found it. 2048 is very addictive and so easy to play once you get the hang of it. I would add the option of a timer to see how quick you could reach 2048. That would make it more challenging in my opinion.
5,"March 21, 2018"," Awesome you need to get it cause fun, cool , relaxing it's awesome like so so awesome I was happy to find this game on the Google. Play store"
5,"May 2, 2018", Addictive game.. time passes on and you never notice it.. very good
4,"February 24, 2018", Totally addicted to this game.. Really good one for time pass
5,"April 29, 2018"," Getting addicted. Got the clue from my son, don't swipe left"
3,"January 7, 2018"," The game is very fun, but the ux is super glitchy. Back button, reset button often don't work."
5,"February 12, 2018"," The game is simple but addictive.. I play it everyday to beat my previous record.. I also like the fact that there are many options to play like tiny, normal, big and huge.."
3,"March 22, 2018", What is the the notifications?  I did not ask for them or there is an option to turn them off.   Uninstalled after years of enjoying.
5,"February 22, 2018"," Extremely addictive game. You are bound to get immersed, once you start play. Loved it totally"
5,"March 26, 2018"," So addictive! Love this game. Anyone who likes puzzle games, logic and strategy games will like this!"
5,"May 27, 2018", I love this game. I am addicted and there is no coming back❤️
5,"January 22, 2018", I get going and have trouble stopping.   My son got me started on it.
5,"March 2, 2018", Dhananjaya Germanic shamanic healing and recovery and recovery and to lagaya be grumpy old and new media marketing logo ki khabar Na doo to lagaya to lagaya be grumpy tu follow us on the phone and new media and recovery and to be a good day to day phone and recovery and new husband to lagaya tha to ...Full ReviewDhananjaya Germanic shamanic healing and recovery and recovery and to lagaya be grumpy old and new media marketing logo ki khabar Na doo to lagaya to lagaya be grumpy tu follow us on the phone and new media and recovery and to be a good day to day phone and recovery and new husband to lagaya tha to lagaya to be grumpy cat is Krishan Kumar Singh on hela ta pare down and to the phone with you and new phone with you and your family a good morning to see you then to be a good day to lagaya be grumpy tu as le temps to lagaya tha phone number for you phone me on the phone ku and new husband Nick Gordon I am not able and new media phone call from the morning and new phone ku to lagaya be grumpy tu follow us Facebook Twitter Instagram YouTube and new husband phone number for the phone call with you and your family are madarchod ek bar in the tu meri zindagi hai phone number and the phone and tu hi hai tu as UN and new phone and new phone and new husband phone ku call me at your earliest convenience so we will be in the morning to
5,"March 31, 2018"," It's cool, but it wouldn't let me play in peace till I reviewed it ugh"
4,"May 21, 2018"," 3*3 block game couldn't be finish. I play it last but it was stuck for a 
no., I have a screenshot of game."
1,"April 29, 2018"," No need to be clever. Just touch the screen then get higher scores. No 
challenge. Waste of time"
1,"March 16, 2018", The worst game of 2048 It changes the sequence if you are near to beat it
5,"March 4, 2018", Really fun game very easy to make in my honest opinion but is very addicting once you get the hang of it.
1,"January 19, 2018"," Great game, BUT after one game it just froze up on the Game Over screen... Uninstall!"
5,"February 12, 2018", The tiny stage is not possible.....at last when 1024 is done....then give the chance of block no 8 to come....I wasted my time on the tiny stage.....or else this game should get 5 stars ..if anyone completed the tiny stage....then let me know
1,"April 13, 2018", I don't do loud intrusive adverts on a trivial game.
5,"January 24, 2018", An absolute hypnotizer. You just can't stop playing it.
5,"February 18, 2018", Smooth controls and simple graphics allow me to focus on actually playing (and winning) a game. Awesome!
5,"January 22, 2018", This game helps in taking quick decisions in real lyf....only by giving your valuable time  just a little
2,"April 12, 2018"," Doesn't save the state of a game persistently: When you restart your phone, you lose the game you were playing."
5,"January 18, 2018", A fun game for when you're bored and want something that's just the right amount of stimulating
5,"April 15, 2018"," I enjoy the game. It keeps you focused making sure you move the right 
numbers."
2,"March 15, 2018", Game popped up with a notification urging me to play it. Time to uninstall.
1,"March 22, 2018"," Suddenly started spamming with push notifications every day, uninstalling"
5,"February 1, 2018"," This is a really great little game, made better by the addition of new modes."
5,"February 7, 2018"," A straightforward puzzle game, great for killing a few minutes without pressuring you for time."
4,"March 22, 2018"," Extremely addictive can't stop playing it, I'm trying to get 5million almost there 4,695,084"
3,"April 20, 2018", I think the people that made this game should kill themselves
5,"May 3, 2018", Very addicted I uselly uninstall this then again install
1,"April 28, 2018"," close your eyes and repeat right up left down, after while open your eyes 
you will find that you won the game"
1,"March 21, 2018"," Great game, but they send reengagement notifications. Do not waste my time trying to get me to use your app"
5,"January 31, 2018", Never get bored with this. Been playing this since forever. ❤
1,"February 14, 2018", A really bad Game never seen
5,"February 14, 2018"," I like puzzles. This is a good one. No frills, use your brain, kinda puzzle. Still waiting for my confetti gun salute for scoring 32,768."
1,"March 22, 2018"," ""2048 time!"" to uninstall. Unsolicited notifications are not ok."
5,"May 1, 2018"," Worst game , I didn't ever played like this stupid games."
5,"January 19, 2018", Well its not a first person shooter but its pretty entertaining
1,"March 15, 2018", Was great. Now its full of insisting ads.
2,"March 21, 2018"," My GOD but this app is ADPOCALYPSE! Also really sneaky: you have to re-end your game in order to start a new one. Otherwise, pressing the restart option opens you up to a loop of MORE ads. Also don't like this version where your points are according to the tile you combine.  I'll just stick to the F...Full ReviewMy GOD but this app is ADPOCALYPSE! Also really sneaky: you have to re-end your game in order to start a new one. Otherwise, pressing the restart option opens you up to a loop of MORE ads. Also don't like this version where your points are according to the tile you combine.  I'll just stick to the FB messenger version of this game."
4,"March 18, 2018"," The game is great, very relaxing, it's just kind of annoying that it ends at 1048576, when there are possibilities to play further."
3,"April 15, 2018"," Flawed with ads, plus the leader board is bogus"
5,"February 24, 2018"," A very simple, yet complex game that is incredibly relaxing."
1,"March 22, 2018"," Uninstalled because I've started getting push notifications. ""2048 Time!"" Not anymore!"
5,"April 3, 2018", Becomes addictive very quickly. Great game for procrastinating.
1,"March 21, 2018", Why you sending me notifications? Lame
2,"January 10, 2018", Plays audio from ads even when phone is muted
5,"February 6, 2018"," I'm addicted, my fav game!"
5,"February 7, 2018", Does what it says on the tin and does it well. Simple and infuriating.
5,"March 4, 2018", Challenging.......I'm literally addicted to this game
4,"March 21, 2018"," Se removessem o botão de voltar a jogada, seria melhor. Fica muito fácil tendo este disponível."
5,"April 7, 2018", وقفوا الاعلانات شويه لما ينتهي الدور وخصوصا الاعلانات بالفيديو بتضايقني جدا
5,"February 4, 2018", If no add very nice
3,"February 3, 2018", It is ok when it works it glitches alot
5,"March 3, 2018", Awesome! An addiction for me!
1,"April 27, 2018", That ad delays were terrible.
1,"March 22, 2018"," Basic implementation of a basic game, just fine until it started spitting out notifications to play it. 1 star just for that."
2,"March 22, 2018", Started spamming with notifications. Uninstalled
4,"January 5, 2018", Its really a great way to pass time...if u r bored u can play this game😆
4,"May 18, 2018"," Attention...... simply move tiles in clock wise order blindly for 8x8, you 
can reach the maximum"
3,"January 28, 2018"," The game very good. But, it has an full screen advertising."
5,"January 15, 2018", Super app to kill time
5,"June 19, 2018"," That moment is awesome when you discover that 4096 is black colored😀.Game 
is fantastic.My max score~51270;)"
5,"December 30, 2017", It is a good and sooo cool game
1,"April 23, 2018"," No instructions anywhere that I could find so I had no idea how to play. 
Deleted!"
4,"April 26, 2018"," Great game! But please make it so that you can press the back button more 
than just once!"
3,"February 16, 2018", I think it's boring
5,"January 19, 2018", This game is just amazing. It's a bit like math and I could be found playing this game for hours on end.  This app is amazing.
3,"March 1, 2018", I literally got 2928 as a score but still the game is called 2048
5,"May 4, 2018"," It's amazing, time consuming, addictive..... I love it"
5,"February 6, 2018"," A great, easy, addicting game for anyone"
5,"February 27, 2018", Nice way to kill boredom!!
5,"February 14, 2018", Great game. Not sure why people are complaining about ads when they can be easily prevented. It's called turning off your WiFi
5,"February 19, 2018"," On 4X4 puzzles, I am still trying to get to 2048. On the larger puzzles, I have managed to reach 4096."
5,"March 22, 2018", So addictive.....helps pass away time on long journeys
5,"January 26, 2018", Хорошая цифровая складывалка. Но ресурс телефона съедает быстро.
1,"March 15, 2018", Do not send me random push notifications to play your game.
4,"April 29, 2018"," Love this game. One question. In the 8X8 grid, why does the game end when I 
make a 1,048,576 tile?"
5,"February 3, 2018", Very addictive. Good example. I've seen no glitches.
1,"February 18, 2018", There's no tutorial or instructions. How the hell do I play this game?
5,"April 9, 2018", This game relaxing
5,"April 5, 2018", A very challenging game and a good time killer...
5,"April 29, 2018", I am hooked! Sound would be nice but not needed. Great to pass time. Thanks.
5,"January 25, 2018", I will do anithing to have this game in my phone
4,"March 14, 2018", Great games adverts are a pain . The joys of free games
5,"April 2, 2018", perfect. release stress
5,"May 15, 2018"," A pint sized game filled with fun. Can keep playing again and again and 
again. Best 2048 out there."
1,"March 14, 2018", Do NOT bug people with notifications to play your game. EVER.
5,"January 15, 2018", Play this game alone either for inner peace or for nice sleep.
5,"March 8, 2018", Good for wasting and killing time
3,"January 8, 2018", I love the game but I hate the ads
4,"January 21, 2018", No I do not want to write a review
5,"March 8, 2018", I used to play this game whenever I want to relax my mind...
4,"February 26, 2018", A game if you have time to spent.
5,"March 15, 2018", very helpful when we're bored since it's pretty addictive
2,"March 25, 2018", All good but plays adverts with sound turned on automatically. Uninstalled
5,"January 1, 2018"," Challenging, but easy at the same time. Keeps my attention so I like it."
5,"April 5, 2018", Interesting and a very frequently used when get bored!!
5,"January 26, 2018"," amazing game  my high score is 2,62,144😎"
5,"February 10, 2018", Awesome small size game.. Out of imagination how much interesting this is..in this time this is just awesome 😘
5,"February 20, 2018", I got 16000+ when i play this haha
5,"March 23, 2018"," Great game, having to think through your next move gets your brain a workout"
5,"April 8, 2018"," Just quite simply, unputdownable!! Brilliant game. Just what I have been looking for..."
4,"January 23, 2018"," Its good, after sometime it gets boring"
4,"February 16, 2018", Jeremy and the other hand is a good thing I have to be at
5,"January 13, 2018", It's addictive and my wife has a higher score but not for long.
5,"February 24, 2018", Very addictive good brain teaser.
5,"April 9, 2018"," The easier you think the easier you fail :p , Nice game. :)"
5,"March 20, 2018", I just like it as a game to play. Thank you.
5,"February 27, 2018"," Does what it should, fun and challenging."
5,"April 21, 2018", Can't stop when started.....
5,"January 8, 2018", Hard to get a new game stsrted
5,"March 28, 2018", Exlent very time pass game
5,"April 19, 2018"," I enjoy it very much . It is where I can unwind after a busy day at the 
office."
5,"May 26, 2018", Awesomeeeeeeeeee No game can replace it.
5,"January 28, 2018", Very addicting.. great concept game
4,"January 24, 2018", It's great way to learn a slice puzzles it's a nice distraction and addictive game😊
5,"January 19, 2018", Fun game to pass time. Gives me something to do between classes
5,"February 12, 2018", Amazing way to kill time even when offline.
5,"March 14, 2018"," Pretty great time waster, really addicting"
5,"April 1, 2018", I'd like to play without ads
5,"April 21, 2018", I have made the highest - 2^17
5,"March 14, 2018", Wao what a great mind game full of fun. It is so interesting and addictive game
5,"March 4, 2018", Its a bit addictive or else it is fantastic
5,"April 22, 2018", Hours of fun that you can put down at any time. Love it!
5,"January 22, 2018", Addictive - By far one of my favorite number-strategy games
5,"March 3, 2018", Very good game but colours are faint
4,"February 10, 2018", Very engaging and challenging.. perfect to give your brain some exercise!
5,"April 25, 2018", Nic game very simple concept hence easy to play and good puzzle
5,"January 2, 2018", Simple and original 😉
5,"March 3, 2018", Fun game that makes me think. Easy to learn but tough to master.
4,"April 5, 2018", No new updates are available
5,"April 8, 2018", I reached the highest score
5,"January 31, 2018", It's not liked........     It's loved!!!!!I love it a lot! It's awesome
1,"April 6, 2018", ads in the middle of a game? uninstalled.
5,"January 21, 2018", This game is very much useful for maths an development for brains too.
5,"February 21, 2018", It needs some music
5,"March 3, 2018", Easy to play and provides a great way to pass time on a plane or bus.
5,"March 4, 2018", Shugcyhi fci yg fiducial
5,"March 18, 2018", There should be less ads
5,"April 13, 2018", This would be prefect for math
5,"April 14, 2018", Time traveling app. You can time travel to the end of work in no time.
5,"April 25, 2018", Tell us what you think
4,"May 11, 2018", It majes you think
5,"January 16, 2018", Great for wasting time!!!
5,"February 23, 2018", Nice! Hacked leaderboard though
5,"March 8, 2018", What is the High Score in 5x5?
5,"February 3, 2018", Great time killing game
5,"February 2, 2018"," It's addictive, I 😍 it !!!"
5,"January 8, 2018", Uses it to pass the time.
3,"February 17, 2018", Too much advertisements.
5,"January 14, 2018", My oldest brother got me into this game and I love it
4,"January 13, 2018", This is a very determined game u nknow wht i mean rght
5,"April 21, 2018", I WON!!
5,"May 19, 2018", Not so good...
5,"March 11, 2018", addicted hahaha 🤣
5,"February 26, 2018", ITS Soo GOOD BECAUSE ITS FUN AND A GOOD TIME KILLER
5,"March 13, 2018", This game is simply awesome and a lot addictive.. I love it .
5,"January 18, 2018", It is great game... love it
5,"February 1, 2018", I spend too much time playing this addictive  game.
5,"April 23, 2018", I think nothing 😂
5,"May 28, 2018", I love the game but lately it won't stay open
4,"January 18, 2018", It's a nice brain exercising game.. Anyone can do it
5,"March 5, 2018", It doesn't bore
5,"February 13, 2018", I love the game a lot
5,"April 25, 2018", This is a great way to pass time while waiting at appointments..
5,"April 24, 2018", Totally addicting!
5,"May 2, 2018", This is addicting!
5,"January 20, 2018", Game is great and very addicted
5,"January 20, 2018", Awesome way to pass time and keep your brain busy
5,"February 24, 2018", Absolutely Addictive !!!!!  It seems so easy but it's actually very hard
4,"April 3, 2018", I think it needs a help function to explain how it all works
5,"April 26, 2018", I love it its a great way to compete with your friends
5,"January 21, 2018", I like it a lot
5,"February 18, 2018", Great time waster!!
5,"April 16, 2018", First 2 was a challenge. Can't win. XD but i LOVE THIS.
4,"January 8, 2018", I like this game
4,"January 18, 2018", To many ads
5,"January 29, 2018", Wish it had a menu
5,"February 1, 2018"," perfect, sometimes advertising"
4,"February 15, 2018", It is a must timepass
5,"February 17, 2018", future tasting game
4,"March 2, 2018", I like this game
5,"March 18, 2018", its just awsm
2,"March 21, 2018", Lots og ADs
1,"April 15, 2018", Lost my records
4,"April 23, 2018", Too many ads
5,"June 25, 2018", I loveeeeeeeeeee this game
5,"March 10, 2018", Great-entertaining app.  Lots of challenge and fun!
5,"April 6, 2018", I love this game and I pretty much play it everyday and it's sooooo addicting!!!!!
5,"January 30, 2018", Best time killer.
4,"February 8, 2018", It's a gud offline game that everybody can play easily....
5,"May 14, 2018", It's a good game for kids to know how to do plus
5,"February 8, 2018", Yeahh!!
5,"April 17, 2018", Such a simple concept can be so entertaining! Love it!
4,"April 22, 2018", Less ads please! Or give an option for no ads?
5,"January 29, 2018", I've always loved games like this plus it is really addictive!!!!
5,"April 21, 2018", I like this game so so so so much The best number game in the 🌎
4,"January 19, 2018", It's strangely addicting...
5,"April 4, 2018", Weirdly addicting.
5,"March 14, 2018", Addictive This game is to toaddictive. Plus it is so good.
5,"April 22, 2018", Can't express in words. ..
5,"January 17, 2018", This is a great and superb puzzle. I just loved it.
5,"April 11, 2018", Best multiplying game ever Best mind exercise  Nice game
4,"January 25, 2018"," It's a very good, simple and easy game"
5,"February 19, 2018", Good to kill time.
4,"March 11, 2018", Nyc game.. gud fr relaxtion fell love with game
5,"February 6, 2018", Additive!!!
5,"February 26, 2018"," Nice puzzle like game, very entertaining"
5,"March 21, 2018"," It's so addictive, but I love it."
5,"April 17, 2018", Verry good game. Helping us in concentration
5,"April 18, 2018", It is funny.
5,"April 22, 2018", Good game to improve mathematic skill. Wkwk
5,"April 24, 2018", It's aoessom
4,"January 18, 2018", It's a great game that helps me relax
5,"February 11, 2018", Ti's dopeth
5,"April 1, 2018", Mind relaxing game. Such a good App
5,"April 26, 2018", Such an addictive game. Absolutely love it!
4,"January 22, 2018", Great addictive game but the ads suck
5,"January 19, 2018", I think this game helps me relaxes
5,"February 18, 2018", I Ronny is was amazing it is a really good game
5,"March 19, 2018", This is  very interesting game to play i like it
4,"March 24, 2018", It's omay
5,"April 19, 2018", My high score is 400000 and I loved it
5,"March 20, 2018", Very addictive. Don't want to stop playing it.
5,"February 4, 2018", Awesome game adds suck  but good game
5,"April 19, 2018"," Great game, hard to put down!"
5,"January 3, 2018", Dangerously addictive
5,"January 17, 2018", Addictive game.. I enjoy it so much
4,"February 6, 2018", Very interesting game for mathematics lovers.
5,"February 22, 2018"," Couldn't put it down, so addictive"
4,"February 14, 2018", It's ok
5,"February 26, 2018", Very Addictive Game I have Ever played...💜💜
3,"April 19, 2018", It's ok
5,"April 18, 2018", I win in this game in 10min.2048😄😄😄💪💪💪💪
1,"January 20, 2018", toooooooooo many ads.....
5,"January 5, 2018", very happy playing game 2048 😀
5,"January 10, 2018", Great simple game
5,"February 2, 2018", Very nice game
4,"April 29, 2018", Very good game fun and addictive.
5,"January 17, 2018", A simple but classic game.
5,"March 28, 2018", I like maths that's why I love game
5,"January 24, 2018", It's very fun ad very addictive
5,"January 19, 2018", its really good maths game
5,"January 7, 2018", Perfect game with too many ads
5,"February 14, 2018", Good strategic game Really loved it
5,"February 16, 2018", Fun way to teach maths to kids
5,"March 3, 2018", An interesting mind blowing game
5,"March 3, 2018", Good time pass and tention relive
4,"March 11, 2018", Well brAin training and good challenging
