4,"July 17, 2018"," I love this addicting game! However I dislike that there was NO option for 
a tutorial (I downloaded it based on reviews then had to use Google to 
figure out what I was doing) and sometimes the controls skip after I swipe, 
which results in the tiles moving in a way I'm not too sure I instigated. 
...Full ReviewI love this addicting game! However I dislike that there was NO option for 
a tutorial (I downloaded it based on reviews then had to use Google to 
figure out what I was doing) and sometimes the controls skip after I swipe, 
which results in the tiles moving in a way I'm not too sure I instigated. 
Would Also be really cool if there were a more social aspect, such as total 
high scores or among friends, or even ways to competitively play."
5,"July 4, 2018"," It is incredibly addicting! I usually get bored of a game in a week or so, 
but I've been playing this for months and cant get enough. It is perfect 
because you can just pick it up and play anytime. I have gotten so close to 
2048 at least a dozen times, but it's incredibly hard to do."
3,"July 4, 2018"," This is a great game, great time passer but on Android I've consistently 
had a problem with it randomly making moves on its own ultimately making me 
lose all my progress. I'm done, I got so far this time and all that 
progress was lost, I can't bring myself to keep playing this game if that's 
wha...Full ReviewThis is a great game, great time passer but on Android I've consistently 
had a problem with it randomly making moves on its own ultimately making me 
lose all my progress. I'm done, I got so far this time and all that 
progress was lost, I can't bring myself to keep playing this game if that's 
what's going to happen everytime I make this much progress."
5,"July 6, 2018"," Great fun game. Lots of time to waste here. Easy to play, you'll keep 
coming back to it and you can fulfill that 'need to play something but I've 
only got a few seconds' bug."
5,"July 2, 2018"," Needs a 0.25 second cooldown between swipes to prevent accidental double 
swiping. Other than that minor issue, this is the best mobile game. Period."
2,"July 11, 2018"," While the game is great and everything.. Its perpetually crashing, 
sometimes I even lose progress on the game that I'm playing.. Hope this can 
be fixed. Thank you."
5,"July 16, 2018"," We need to stop games like these. SAID NO ONE EVER. this game is so 
addicting! I can't stop!! love it 10/5 stars. :)"
3,"July 7, 2018"," Great game, but sometimes the game will double swipe randomly, maybe 
because it's too sensitive to some of the touches? Makes it more difficult 
to win!"
5,"July 8, 2018"," Simple, fun, and challenging. Can get addictive. They have different levels 
for once you master the original goal of vetting 2048. However once you 
achieve 2048 you can keep going to see what's the largest combo you can 
make. Highly recommend!"
5,"July 14, 2018"," Straight forward and to the point. I've spent hours getting lost in trying 
to achieve that elusive number... As well as it's larger iterations."
4,"July 2, 2018"," Just don't go too fast, it glitches which can be really annoying, 
especially if you are in free play"
5,"July 8, 2018"," I love this number puzzle game! Its very easy to learn and there are 
different size game board u can choose from so once u master one bard u can 
try the next! So much fun and a great time killer!"
5,"July 2, 2018"," After a sum time by playing this game the eyes get tired , you should make 
the game's background black ,, please make an update about it"
5,"July 14, 2018"," Probably one of the best 2048 games available, as you can alter the grid 
size. A bigger grid (5x5 or more) significantly increases your ability to 
gain a good score"
5,"July 4, 2018"," 2048 is a no-nonsense game that's right to the point and can provide for 
countless hours of recreation. It is by far my favorite app on my phone, as 
I have spent countless hours in waiting rooms, classrooms, restrooms, and 
car rides just amusing the hell out of myself with this game. great game. ...Full Review2048 is a no-nonsense game that's right to the point and can provide for 
countless hours of recreation. It is by far my favorite app on my phone, as 
I have spent countless hours in waiting rooms, classrooms, restrooms, and 
car rides just amusing the hell out of myself with this game. great game. 
Very fun to start over and over again"
5,"July 12, 2018"," Good brain teaser and one of the best ways to time pass anywhere... Mainly 
in boring lectures and meetings 😂"
5,"July 5, 2018"," Good, mindless, addictive game. I should say I don't like it because it 
keeps me from doing things I need to do lol"
3,"July 9, 2018"," It's a good game and addicting. However it will sometimes make moves by 
itself and I can't undo it making me lose the order I had it in."
5,"July 5, 2018"," You combine randomly placed twos and fours to create higher numbers and 
combine them until you get to the total 2048. afterwards you can keep going 
until you've reached numbers in multi billions"
1,"July 18, 2018"," Bugs where it either double swipes or flips the entire board happen way too 
often, also there's way too many ads for such a simple game."
3,"July 17, 2018"," It would be great if we would have check points. In case we make any 
mistake we would be able to start the game again from the check point"
5,"July 12, 2018"," I doubt if there is any one who have made this much high score. I have 
scored 4431796. And score in single box is 262144."
4,"July 17, 2018"," This game was a little hard to grasp at first, but once I got the hang of 
it it was fun to play, and a good thing to fidget with while listening to 
things like speeches."
5,"July 3, 2018"," If I didn't spend so much time playing this game, I could probably figure 
out how much time I've spent playing this game."
5,"July 8, 2018"," Just kills your Precious time!! I have been playing it for continous 3 
hours. Just how how addictive can this game be?? Loved it."
5,"July 6, 2018"," Addictive, always a new high score to beat. Low battery usage. Can play in 
airplane mode, or if you don't have a signal or Wi-Fi. Responsive with no 
real issues."
5,"July 10, 2018", Hell addictive!!! I didn't realise I played 2 hrs straight :p
2,"July 15, 2018"," This version kept glitching out and registering multiple swipes, making me 
lose."
5,"July 12, 2018"," Distracts me from my anxiety; a good way to focus on something other than 
whats going on in my head honestly. I use it often to help cope"
5,"July 3, 2018"," This is an addictng game to play because of its simplicity. I am a fan of 
puzzle games and this one is great because it can be played whenever you 
have a spare moment. I highly recommend this game."
5,"July 5, 2018"," I use for overthinking. It's help me a lot for concentration, for focusing 
..."
5,"July 17, 2018"," This is an amazing Game for when you are chilling out on the couch and it 
calms your mind after something bad or upsetting"
2,"July 6, 2018"," Freezes on galaxy s9+ after ""do you want to play again"" and ""do you want to 
keep playing"""
5,"July 16, 2018", When I stress I always play this it made me forget the moment
3,"July 14, 2018"," It's fun and does what it's supposed to, but if you're going to have an 
option to spend 0.99$ and remove ads, it better actually REMOVE THE ADS."
1,"July 16, 2018", Change the game's name to 4096 bcoz I have made it.
5,"July 5, 2018"," Has undo but on, has different sized boards, doesn't have autosolver, 3.14 
out of pi stars"
3,"July 12, 2018"," This particular app doesn't have the automatic play feature that allows the 
game to continue in whatever direction you choose which saves on finger 
swipes."
5,"July 13, 2018", Awesome. Time consuming and addictive
5,"July 12, 2018", It helps me with my anxiety and panic attacks
5,"July 10, 2018"," Fun game, simple mechanics make it easy to pick up and learn but is still 
challenging and makes you think about your moves."
4,"July 4, 2018", Cool game but the ads are HELLA annoying
5,"July 10, 2018"," Loved this game, really gets you thinking"
5,"July 18, 2018", Took me 3 days to manage to get to 2048 and now idk what to do with my life
5,"July 12, 2018"," Fun game every once in a while nothing annoying and cool new board sizes, 
bigger is easier"
4,"July 1, 2018", This review thing is stupid af
5,"July 16, 2018"," Its super addicting and I love that you can go past 2048 it's an amazing 
game simple but effective.👍👍"
5,"July 12, 2018"," Really fun, I like the biggest grid best because you can get higher scores"
5,"July 5, 2018"," I really like it, especially when I have to wait for long periods of time."
5,"July 7, 2018", Awesome game to let your mind numb out to and can master it if you'd like
5,"July 8, 2018", Really addicting can't stop!
5,"July 7, 2018"," Nice, mentally relaxing game that can be played at a number of levels. The 
bigher boards for relaxation and smaller boards for relaxation and skill 
building."
1,"July 15, 2018", This math is to hard I am 22 and it us still way to hard 1+1=145 see
5,"July 10, 2018"," Kept me occupied for hours, thinking im like 15m in and its already been an 
hour"
5,"July 10, 2018"," Sweet little puzzle , fast pace if your smart 😄"
5,"July 11, 2018"," You can play above 2048, I think its enless because I got it at 32768."
4,"July 10, 2018"," I've played this game for years. Its simple and fun and its still perfect 
on my new Galaxy S9."
5,"July 13, 2018"," I remember back in 2014 when this was such a craze. It's still as addictive 
and relevant today. Simple, fun and challenging."
5,"July 11, 2018"," It is amazingly addictive. I am still playing the first game that I 
started. So far, too good"
5,"July 11, 2018", I can't stop playing
5,"July 18, 2018", I just wish i can choose to save my current game when I exit the app
5,"July 6, 2018"," Addictive enough that I'm not neglecting my children, but it is a routine 
now to add to my totals."
5,"July 5, 2018", Simple game that helps waste time
5,"July 11, 2018", The time I enjoyed wasting here is not wasted time. 😉
5,"July 6, 2018", I think you must make the graphic 3 d
5,"July 6, 2018"," Been playing for an year, still play a dozen times daily."
5,"July 5, 2018", I'm addicted to this game
5,"July 5, 2018"," Hooked. Loads up quick, simple, great game to play on a quick smoke break 
during work, help clear the mind"
5,"July 15, 2018"," I enjoy it, but I haven't been able to beat the 3x3 or 4x4 versions yet..."
4,"July 3, 2018"," I enjoy the game, however, sometimes accidental movements happen."
5,"July 6, 2018", I'm addicted hahaha
5,"July 5, 2018"," Fun and makes you think just enough to keep you entertained without being 
too hard"
5,"July 16, 2018", It's a great way to pass the time when you're bored.
5,"July 10, 2018", Attention to the number nerds!! Addicting game for real! Great job guys!!
4,"July 14, 2018", Great if you need to waste some time
5,"July 17, 2018", It is awesome game as whenever i m bored i play this game.
5,"July 2, 2018", Tiny7-EleventhesametimeasaresultofthewildisfireandIwillbesorryagainforthenursinghomeandGardenofthewildisfireandIwillbesorryagainforthenursinghomeandGardenofthewildisfireandIwillbesorryagainforthenursinghomeandGardenofthewildisfireandIwillbesorryagainforthe
5,"July 3, 2018", Love games that stimulate me mentally and require the player to be tentative
5,"July 3, 2018", I spend way too time on this game
4,"July 4, 2018", It keeps you busy when your board
4,"July 5, 2018", In 16 squares my score is 32768
5,"July 3, 2018"," I like this game and this game make me reflex,"
5,"July 3, 2018"," Everything is perfect in this. Wherever you are, whatever you doing, it 
won't ruin your circle"
5,"July 11, 2018"," Good fun game, controls are a little touchy."
4,"July 15, 2018", It's a good game to play when you're bored.
5,"July 17, 2018", This game is so addictive. Great way to pass the time without getting bored.
5,"July 17, 2018", Super fun pass time also it works with your mind to fined the best answers
5,"July 5, 2018", Should have 3d games too
5,"July 6, 2018", Perfect for when you need to kill a minute or 20.
5,"July 8, 2018", ~Awesome game that I could play when I'm bored..
5,"July 14, 2018"," I think it is great. I got to see the 4096 tile. I always win!!!!! Please 
install this beauty. I LOVE you 2048!!"
5,"July 6, 2018", Great but can get addictive Be careful
5,"July 7, 2018", This game is super addicting and a great time killer. 100/10
5,"July 13, 2018", Addictive. Perfect thing to do to.pass time.
5,"July 1, 2018"," Love this game, very addictive"
5,"July 4, 2018", keeps my mind busy
5,"July 16, 2018", Light app with few ads.
1,"July 5, 2018", bad game ever
5,"July 13, 2018", Very strategic game that gets your mind worked up and focused.
4,"July 8, 2018", Good to kill a few minutes offline
4,"July 9, 2018", Kills time. Simple easy to play.
5,"July 11, 2018"," It is a very fun game and is very addictive. Really like and enjoy the 
concept and is very fun to play."
5,"July 8, 2018"," I personally believe that this game is fun addictive, and easy to play."
5,"July 3, 2018", I love the game because it has me thinking whenever i play it
4,"July 6, 2018", An option to have a dark background for night play would be good
5,"July 14, 2018", Fun when nothing to do and keep yours Braun active
5,"July 6, 2018"," Totally in love with this game, I love the way it makes you think."
5,"July 3, 2018"," It is fun, easy,and addictive"
5,"July 13, 2018", Amazing game. I learned for the value of all the powers of 2 from this
5,"July 18, 2018"," Muito bom, recomendo"
5,"July 6, 2018", They forced me to do this 😁😂😭🐣
5,"July 7, 2018", Live the game!
4,"July 15, 2018", Fan little app.
5,"July 6, 2018"," Ees gud, reel gud"
5,"July 13, 2018", How to play this game ?
5,"July 5, 2018", Becomes little slownintermittently
5,"July 7, 2018", Need improvement in control
5,"July 13, 2018", Sehr gutes gedultsspiel
1,"July 16, 2018", Too many ads
5,"July 17, 2018", Yup its a game
5,"July 4, 2018", Bam!!!
5,"July 10, 2018", Stable app. Minimal ads. Bunch of different game modes. Good stuff.
5,"July 12, 2018", It's fun and addictive. Great for plane flights!
5,"July 2, 2018", Very addictive. Background can be changed.
5,"July 14, 2018", Great for boring meetings
5,"July 8, 2018"," Sooooooo good it's challenging yet easy at the same time!!! Highly 
recommended!!!! Good time killer to!"
5,"July 10, 2018", Fun and challenging. Great way to pass the time!
5,"July 2, 2018", Thus is teh best game ever helps with math
4,"July 8, 2018", Very fun game makes your brain think
5,"July 10, 2018", Perfect app to lose some time if needed
5,"July 15, 2018", It was great I like how you have to swipe
5,"July 5, 2018", Enjoyable. It's the game I keep going back to.
5,"July 11, 2018", Very addictive game. Enjoy it thoroughly. Highly recommended
5,"July 5, 2018", Addicting game.
4,"July 17, 2018", Its a good game but to many ads!
5,"July 7, 2018", The best 2048 app out there!
5,"July 9, 2018", I love it. Easy to use. Not may hangs in the application.
5,"July 13, 2018", It's addicting
5,"July 3, 2018", It's okay
5,"July 6, 2018", Its really fun and adictive! Awsome game!
5,"July 14, 2018", This game is addictive and helps me think.
4,"July 3, 2018", Infinity game just keep moving forward
5,"July 9, 2018", Great game to keep your thumbs busy
5,"July 10, 2018", Nice one can back last move
5,"July 14, 2018", Rlly fun and I got an epic score
5,"July 6, 2018", Addicting !
4,"July 5, 2018", One of my favourite time passers!
5,"July 8, 2018", It's challenging and it keeps you engaged.
5,"July 5, 2018", I'M hooked.
5,"July 12, 2018"," This game is so addicting, I love it!!!"
5,"July 17, 2018", Challenging game but so fun!
5,"July 4, 2018", Backspace option is amazing. Need this for iPhone
5,"July 10, 2018", Its addicting..
5,"July 7, 2018", Amazing for time killing
5,"July 11, 2018"," Amazing game, induces brain application"
5,"July 18, 2018"," Fun and my record is 65,536 on a single block"
5,"July 7, 2018", This is one of my favourite games.
5,"July 10, 2018"," Super addicting, I love this game"
5,"July 13, 2018", Great game for a bus or tube journey.
5,"July 15, 2018", Simple done right! Great game!
5,"July 16, 2018", So great for clearing your head.
5,"July 4, 2018"," Good, if you're not an Idiot."
5,"July 6, 2018", Very nice to play... very addictive also
5,"July 5, 2018", Easy way to exercise my brain
5,"July 7, 2018", I want my life back
5,"July 9, 2018", Lots of ad s but good
5,"July 14, 2018", Simple game yet complex strategy
5,"July 14, 2018", Awesome to play while passing the time
5,"July 3, 2018", Maths and stuff
5,"July 3, 2018", Tactical math
5,"July 4, 2018", Choice game
5,"July 7, 2018", Very addicting
5,"July 15, 2018", Great way to pass the time!
5,"July 12, 2018", Time killer
5,"July 16, 2018", Passes the time
5,"July 9, 2018", A good way to pass one's time...
5,"July 15, 2018", Very fun and addictive game!!
5,"July 4, 2018", Addicted!
5,"July 7, 2018"," Double Wow, very addictive."
4,"July 9, 2018", Fun! Really good game!
5,"July 14, 2018", Careful. It can become addicting.
5,"July 3, 2018", This game is stress relieving.
5,"July 4, 2018", Works good on multiple devices.
5,"July 12, 2018"," Great app, simple and addictive"
5,"July 11, 2018", I love this game it's the best
5,"July 5, 2018", I like that it remembers whawhere I was.
5,"July 8, 2018", Great game to pass time.
5,"July 12, 2018", Fun and makes you think.
5,"July 12, 2018", Do try. Unusual and cool
5,"July 18, 2018", Great addictive number game.
5,"July 15, 2018"," Fun game, very addictive.👍🏾"
5,"July 16, 2018", Simply best time passing game ...
5,"July 5, 2018", Great time killer :D
5,"July 8, 2018", Fun when bored
5,"July 16, 2018"," Challenging, engaging, sportive and addictive"
5,"July 15, 2018"," Simple, complex and addictive."
5,"July 5, 2018", Fun simple game!
5,"July 8, 2018", Super addictive! Love it
5,"July 16, 2018", So much fun ☺️
5,"July 12, 2018", Love it! Always a challenge
4,"July 4, 2018", Good choise for time killer
5,"July 4, 2018", Good for distraction and low stress
5,"July 4, 2018", Im really enjoy this game
5,"July 3, 2018", Good game to sharpen mind
5,"July 6, 2018", Best time pass game
5,"July 8, 2018", Really fun pass time
5,"July 10, 2018", Makes my brain usefull
5,"July 15, 2018", Great game for passing time
5,"July 15, 2018", great game to past time
4,"July 16, 2018", Its pretty good for a game
5,"July 18, 2018", Great app to pass the time
5,"July 18, 2018", It is very challenging and cool
5,"July 5, 2018", I love this game!!
5,"July 4, 2018", Addicting. Love it so much.
5,"July 2, 2018", great for past time! :)
5,"July 7, 2018", The best game puzzle game
5,"July 8, 2018", IT'S FUN-TASTIC!
5,"July 8, 2018", Addicting. Love this game
5,"July 15, 2018", Beautiful. Just beautiful
5,"July 12, 2018", Fun. Makes you think.
5,"July 5, 2018"," Smooth, relaxing game"
5,"July 7, 2018"," Simple, yet addictive"
5,"July 6, 2018"," Cool game, love it"
5,"July 9, 2018", Coolest. Game every
5,"July 12, 2018", Addicting. Luv it!
5,"July 12, 2018", It's simply amazing
5,"July 16, 2018", Fun time killer.
5,"July 6, 2018"," Simple, light, addictive."
5,"July 6, 2018", It's cool yo
5,"July 10, 2018", Highly addictive. Highly recommend.
5,"July 3, 2018"," Simple, clean, satisfying"
5,"July 4, 2018", Very fun!
5,"July 6, 2018", Really fun!
5,"July 18, 2018", Excellent game!
5,"July 5, 2018", Love Numbers!!
5,"July 5, 2018", Good time killer
5,"July 5, 2018", It is a fun game
5,"July 4, 2018", Great wee game
5,"July 5, 2018", Awesome time killer
5,"July 4, 2018", Super fun and challenging
5,"July 4, 2018", Simple addictive game
5,"July 5, 2018", It is damn good
5,"July 6, 2018", I love this game
5,"July 4, 2018", Challenging yet calming
5,"July 4, 2018", Great time killer
5,"July 5, 2018", Good for passing time
5,"July 5, 2018", Very entertaining game
5,"July 6, 2018", Best mind game
5,"July 7, 2018", Good to pass time by
5,"July 9, 2018", This game is best
5,"July 9, 2018", Good time waister
5,"July 10, 2018", Classic simple fun
5,"July 10, 2018", This game is awesome
5,"July 15, 2018", Great and easy to play
5,"July 11, 2018", Will change it life
5,"July 15, 2018", Fun game to play
5,"July 12, 2018", I love this game
5,"July 14, 2018", Great fun game
5,"July 15, 2018", Great version of the game
5,"July 13, 2018", Very good app
5,"July 15, 2018", Elegant and super fun
5,"July 17, 2018", Jst awesome to play
5,"July 15, 2018", Very entertaining & addicting
5,"July 9, 2018", Weirdly satisfying.
5,"July 3, 2018", Addicting
4,"July 3, 2018", Gay
5,"July 4, 2018", You
5,"July 4, 2018", GG
5,"July 6, 2018", Addicting
5,"July 6, 2018", Soooo addictive.
5,"July 8, 2018", Like
4,"July 9, 2018", Ok
5,"July 13, 2018", Kyoot
5,"July 14, 2018", Loved it.... wonderful game...👍👍keep it up...
5,"July 13, 2018", Mantaaaap
1,"July 12, 2018", Bakwaas
5,"July 11, 2018", Lol
5,"July 14, 2018", vgoood
5,"July 12, 2018", Sip
5,"July 16, 2018", Lejta
5,"July 7, 2018", Addictive game.
5,"July 9, 2018", Very addictive.
5,"July 3, 2018", Lots of fun.
5,"July 3, 2018", It's amazing
5,"July 3, 2018", Great game.
5,"July 15, 2018", It's superb
5,"July 8, 2018", Very addictive!!!!
5,"July 12, 2018", It's great
5,"July 11, 2018", 🌟🌟🌟🌟🌟
5,"July 17, 2018", It's cool
5,"July 4, 2018", 👌👌👌👌
5,"July 10, 2018", Great!
5,"July 12, 2018", Great!
5,"July 3, 2018", Awesome!
5,"July 9, 2018", Very addictive...
5,"July 18, 2018", Amazing!
5,"July 17, 2018", Addictive!
5,"July 18, 2018", Addictive!!
5,"July 5, 2018", 👍
5,"July 5, 2018", 💚
4,"July 10, 2018", 👌
5,"July 15, 2018", best game
5,"July 5, 2018", Cool game
5,"July 5, 2018", Fun and entertaining
5,"July 6, 2018", Awesome game
5,"July 3, 2018", Excellent wow
5,"July 6, 2018", Very nice
5,"July 4, 2018", cool and good
5,"July 4, 2018", Good games
5,"July 6, 2018", simple fun
5,"July 7, 2018", Awesome game
0,"July 7, 2018", Very addictive
5,"July 6, 2018", So addictive
5,"July 7, 2018", I love it
5,"July 8, 2018", Very addictive
5,"July 9, 2018", Very fun
5,"July 8, 2018", I loved it
5,"July 9, 2018", Skill game
5,"July 7, 2018", 5 star
5,"July 8, 2018", Excellent game
4,"July 8, 2018", Obsessed
5,"July 16, 2018", Addicted
5,"July 3, 2018", Addictive!!!!!
5,"July 6, 2018", Addictive.
5,"July 6, 2018", Awesome.
5,"July 10, 2018", Love it.
5,"July 12, 2018", Great 🎮
5,"July 11, 2018", Fun.
5,"July 1, 2018", Fun
5,"July 5, 2018", Love it
4,"July 1, 2018", Good
5,"July 6, 2018", Good
5,"July 3, 2018", Awesome
5,"July 2, 2018", Love it
5,"July 4, 2018", Cool
5,"July 4, 2018", Kewl
5,"July 3, 2018", Good
5,"July 2, 2018", Nice
5,"July 6, 2018", Addictive
5,"July 4, 2018", Addictive
5,"July 4, 2018", Nice
5,"July 5, 2018", AMAZING
5,"July 5, 2018", Nice
5,"July 7, 2018", Addictive
5,"July 6, 2018", Fun
5,"July 6, 2018", Good
5,"July 6, 2018", Good
5,"July 7, 2018", Addictive
5,"July 8, 2018", Love it
5,"July 7, 2018", Good
5,"July 8, 2018", Superb
4,"July 9, 2018", Nice
5,"July 8, 2018", Love it
5,"July 9, 2018", Lovely
5,"July 9, 2018", Interesting
5,"July 9, 2018", Good
5,"July 14, 2018", Great
5,"July 14, 2018", Creative
5,"July 15, 2018", Good
5,"July 13, 2018", Superb
5,"July 11, 2018", Addictive
5,"July 12, 2018", Good
5,"July 14, 2018", ADDICTIVE
5,"July 14, 2018", Awesome
5,"July 16, 2018", Addictive
5,"July 12, 2018", Cool
5,"July 13, 2018", Good
5,"July 11, 2018", Great
5,"July 11, 2018", Good
5,"July 14, 2018", Perfect
4,"July 14, 2018", cool
5,"July 17, 2018", Love
5,"July 17, 2018", Good
5,"July 17, 2018", Awesome
5,"July 17, 2018", Fun
5,"July 18, 2018", Love
5,"July 18, 2018", Good
4,"May 29, 2018"," I like the simple design and the starburst colours, but it gets a little 
boring. Consider adding themes and challenges the way some other classic 
games have done. Otherwise, the app itself is great. No bugs, no crashes."
3,"May 28, 2018"," It keeps shutting down now, can't open the app. Otherwise a great game. My 
mom's is also shutting down so it's not just my phone. Fix and I'll update."
4,"June 16, 2018"," I love this game super addictive. I have it on multiple devices. The only 
issue is when I play it on my phone it'll freeze up for a second and then 
it looks like my board has moved 2 or 3 times"
1,"June 16, 2018"," Nice game.  Fast and easy to play.  However, every time a game ends you are forced to watch an advertisement.  Every time is simply obnoxious.  I might pay for the game if it were less pushy with the ads... Uninstalled.  :("
3,"June 30, 2018"," It's a great game but the ""Tap to conntinue button doesn't work. It gets 
boring only playing to 2048 and having to restart the game. Please fix and 
then it will be 5 star."
