5,"July 11, 2018"," Just what I needed and its even better because I can do all my editing 
straight from my phone now instead of bringing out the dusty old computer"
3,"July 17, 2018"," Great editing app, but ads have gone out of hand. Price is also way beyond 
reasonable. Monthly subscription!!?? This is not Photoshop guys."
1,"July 11, 2018"," too many adds!!! so frustrating...abd ciuldnt save my edited pics without 
making me get the gold membership!"
3,"July 10, 2018"," I hate how the eyes changed from before. You cant edit any animal photos 
with that eye frame ..."
4,"July 13, 2018"," Love this app and I use it all the time! However, I think you should make 
the stickers non-WiFi as everytime my WiFi is down I can never access 
stickers. But still good"
5,"July 12, 2018"," Pls bring back the blending effects for the lens flare... its useful Like 
ovelay... and i suggest to have a more tools for logo making like logo 
shapes"
2,"July 9, 2018"," Earlier this app was amazing... But now m surprise to see that the best 
feature of this app ""cut out "" is not working in Samsung galaxy note 8..."
4,"July 9, 2018"," Just a few minor things from 5 stars. The best android app for photo 
editing 👌"
1,"July 16, 2018"," Used to love app but it look like they hid the free stickers behind a 
paywall now. 2 years ago I did the pirate stickers on my nephew wanted to 
do the same on my niece who now did a pic that could use it. Looks like ill 
have to search for another free option"
1,"July 9, 2018"," Very very very worst app..it takes tooo much time ..and stickers are 
notvery good and i cant download stickers..effects are not gd also..waste 
of time."
2,"July 6, 2018"," I intalled it for Portrait mode but Portrait mode disappears frequently 
even we have good internet. It doesn't come back, it come back when it 
want..."
1,"July 13, 2018"," Piece of junk. Everything is subscription and super ad heavy. So much for 
what I already paid for. AVOID"
5,"July 10, 2018"," Iske jeshe koi aap nani lekin sahi se koi use nahi karta jo janta he uske 
liye to super hai"
1,"July 16, 2018"," My edits were turning unclear after saving so I emailed picsart and you 
people said that changing the quality of the pictures would help, now the 
quality of my picsart image is set on 8mp and still my edits are unclear!!"
1,"July 14, 2018"," Worst! app because the features like editing background's of photos mostly 
not working properly so improve that do something for a great photo editing 
app experience"
1,"July 13, 2018"," It won't even let me use the free trial. Or anything. It just wants me to 
confirm my form of payment and refuses to let me get further than that. If 
there is ever a time I have enough money to pay for a photo editing app, it 
will not be this one."
3,"July 15, 2018"," When I add blur or something on photos the photo turns into a gif and thats 
really annoying"
5,"July 14, 2018", The app not only good but also better than any other
1,"July 12, 2018"," I subscribed yesterday thinking I'd be paying a few bucks a month and the 
yearly total was taken from my bank acct which put me in the negative. I 
cancelled the subscription today and it says it will cancel next year with 
no refund. I'm already having a hard time with money and this made things 
...Full ReviewI subscribed yesterday thinking I'd be paying a few bucks a month and the 
yearly total was taken from my bank acct which put me in the negative. I 
cancelled the subscription today and it says it will cancel next year with 
no refund. I'm already having a hard time with money and this made things 
much harder for me. Please issue a refund for me."
5,"July 9, 2018"," Omg this app is amazing and so i think you should install this...it 
changes....YOUR LIFE XD"
1,"July 14, 2018"," I HATE THIS APP SO MUCH!!!!! I MADE A REALLY COOL EDIT, THEN IT DELETED IT 
ALL!!!!!!!! DO NOT INSTALLL!"
5,"July 9, 2018"," Mujhe picsart ka new varsion chahiye install kiya bt nhi ho raha he protait 
cut me mujhe problam aa rahi he plz help..."
2,"July 10, 2018", Every time I try to check mark the edit I did the app just crashes
3,"July 12, 2018"," I use to like earlier version, the latest update carries too many ads, has 
locked almost all effects and useful features on the pretext of paying up."
5,"July 11, 2018"," Pics art is very famous editing app it have to launch potarit mode like 
iphone then any android phone click multi portrait photos"
5,"July 17, 2018", Full useful but I add. In very. Bad version.
1,"July 16, 2018"," If you were to remove the intrusive begging for Gold, I'd give it 2 stars. 
But it's just generally crappy."
4,"July 16, 2018"," The only drawback is that I cannot save photos after editing in their 
original quality. The quality of the photos decreases a little bit."
1,"July 7, 2018"," It keeps telling me that it was a Error and won't even save to my gallery 
on my phone..ugh. And won't even let me share my pictures.."
5,"July 11, 2018"," Mai abhi sahi se chala nahi pata koi chalane ka idea btao ki hm bhi editing 
kr lw"
1,"July 14, 2018"," Idk if it was an update or something, but now I can't even log in OR make a 
new account. It says loading for a second then it just stops loading and im 
still at the log in page. App is totally unusable and I deleted Snapchat 
for this app just for it to mess up. Its a shame how much phone storage ...Full ReviewIdk if it was an update or something, but now I can't even log in OR make a 
new account. It says loading for a second then it just stops loading and im 
still at the log in page. App is totally unusable and I deleted Snapchat 
for this app just for it to mess up. Its a shame how much phone storage 
picsart takes up when all you do on it is mess around with filters and 
editing tools"
2,"July 16, 2018"," I like this app. But when i save the photo after edit, the 5 mb photo will 
be 800 kb.i hate this.why is this happening."
5,"July 16, 2018"," This IS NOT FREE. I subscribed to what I thought was just the free trial. 
But when my trial ended it took $10.99 from my bank account without asking 
or double checking that I wanted to go beyond the trial and when I 
contacted them all I got was an email saying they don't do refunds and all 
I cou...Full ReviewThis IS NOT FREE. I subscribed to what I thought was just the free trial. 
But when my trial ended it took $10.99 from my bank account without asking 
or double checking that I wanted to go beyond the trial and when I 
contacted them all I got was an email saying they don't do refunds and all 
I could do was to cancel my subscription. I'M BEYOND UPSET. I don't have a 
job so my dad gave me some money to buy myself food and then the app 
instantly took my money so I didn't get to eat. This is horrible."
1,"July 11, 2018"," Made an AMA on Reddit with obviously fake accounts answering it. Very 
dishonest"
1,"July 13, 2018"," Tava editando a capa para meu canal e de repente ele começa a dar as dicas 
iniciais do app e simplesmente perdi meu trabalho todo"
1,"July 14, 2018", Waste app ever in world not working properly waste like.
1,"July 15, 2018"," You are continuously showing new filters which I'm not willing to buy and 
thus making irritating"
3,"July 15, 2018"," I like it, but when I finish editing the app always changes the quality of 
the photo from 1080p to 360p."
1,"July 13, 2018", One of the worst experience. My phone is hang when I installed this app.
5,"July 14, 2018"," Best aap for edit photo..Really loved it..it contains many filters and many 
useful settings which help you to make ur pic awesome..thanks man..😙😙"
2,"July 8, 2018"," It's not letting me use stickers or filters or anything! It keeps loading 
like it's about to but it won't"
4,"July 17, 2018"," i like it but once im done editing, the quality of my edit isn't good. fix 
this pls."
2,"July 16, 2018"," How do you batch process gif files or how do you batch process multiple 
photos within effects , so you can create a cool animated gif?"
1,"July 17, 2018", chepest app I have ever used ! Tho ✊
1,"July 17, 2018"," If there were 0 starts I think you could get one because you put up a lame 
update out here that's filled with ads with every click! And when you try 
and put up a text on a blank canvas it comes out blur! I used to use this 
app to create memes but now its just trash! Then you bring up the paying 
...Full ReviewIf there were 0 starts I think you could get one because you put up a lame 
update out here that's filled with ads with every click! And when you try 
and put up a text on a blank canvas it comes out blur! I used to use this 
app to create memes but now its just trash! Then you bring up the paying 
for services thing every 30 sec surely if someone wants to purchase that 
useless premium thing they would tell you themselves."
3,"July 16, 2018", It's so hard to make anything but they fix or try to fix your problems
1,"July 16, 2018"," Bad experience Poor quality Slow working Don't proper working All 
purchasing item"
2,"July 17, 2018"," Oof. Welp fix the bug please. I kept of pressing lens flare and it won't do 
such a thing. I'm making a meme btw."
1,"July 8, 2018"," If you loved PicsArt and are thinking about purchasing this app do not do 
it it's not the same they will make you add filters to your original 
artwork before you can add any words or text"
3,"July 10, 2018"," It's very useful! I can make YouTube Logos & Banners with it! It is very 
useful! Please do make more useful apps! Thank you!"
1,"July 14, 2018"," i love this app but why if i use sticker always stocking on Loading please 
fix it and i give star"
5,"July 16, 2018"," Thinks by far then best photog editing approve seen. I make memes for an 
Amino and I needed an app yo make them with sink found this and its so easy 
to do it with."
5,"July 8, 2018"," It is a very good app but you need to add some gaming backgrounds in the 
app."
1,"July 17, 2018"," Hate having to make an account for everything. Especially something as 
small as a photo editor."
5,"July 10, 2018"," thank you picArt for making such an amazing app. the free version of this 
also have tons of features and layouts etc. if you want to purchase you can 
and enjoy all the components"
2,"July 11, 2018"," It won't let me use a knife picture I downloaded to make a kitchen photo an 
it made me pissed!"
5,"July 15, 2018"," really it is a better app than another one.I am using this app since last 
year.its all things are good"
1,"July 11, 2018"," Oque antes era gratuito, após a atualização passou a ser pago. Picsart 
gasta dinheiro para destruir o APP e depois quer nós paguemos pela péssima 
decisão deles."
5,"July 9, 2018"," I love this app. It's fast & easy. I've made some great edits with it. 5 
stars."
1,"July 12, 2018"," You were giving a option on blur in which it recognise automatically and 
saves time but why you removed that ??? Updated also plz fix it i then i 
will directly move to 5 stars"
2,"July 10, 2018"," inconvenience ads, sorry 2 stars enough."
5,"July 11, 2018", I am very lucky because i have picsart
3,"July 6, 2018"," It leaves these strange faded lines in my picture after I have finished 
editing my photo. What's up with that ???"
5,"July 16, 2018"," Picsart is best app for photo making and editing. I suggest to picsart team 
make a app for video editing name ""VidsArt""."
5,"July 10, 2018", I loved this app but there are so many glitches it's irritating!
3,"July 15, 2018", I'm having a lot of trouble with saving and getting the stickers to download
2,"July 18, 2018"," Lỗi nhiều, quảng cáo nhiều trong khi phí thì quá đắt đối với người sử dụng 
bình thường. Trước xài tạm đc giờ thì thua."
1,"July 10, 2018"," Requires sign up before letting me into the app. I see no reason to need 
credentials. Uninstall."
3,"July 12, 2018", Not show automatically cut option in my app...
5,"July 18, 2018"," I love this app but add like makeup stuff so if someone has no face off 
makeup then picsart can do it!😉"
1,"July 11, 2018", Fake reddit AmA lost me as a user
2,"July 17, 2018", When i changed my icon the picture is getting low quality
4,"July 13, 2018"," Yup, well swell for trolling my friends"
1,"July 17, 2018", It hangs alot of times and the output resolution is low.
3,"July 10, 2018", Almost perfect! Too many ads now though!
5,"July 11, 2018", Awesome! But can you make a feature so that you can find pictures on here.
2,"July 16, 2018"," Constant, intrusive ads have rendered this app unusable."
5,"July 16, 2018", Mind billowing world no 1 best application mobile application
4,"July 16, 2018"," Its an awesome app. I would have rated five, if the collage images made 
using this app didn't lose the quality. Kindly fix this asap."
5,"July 9, 2018"," App is very good for editing. Love it. Keep on doing progress. Thank you 
very much."
5,"July 14, 2018", Beat me Best picasrt sabase best jisne bhi banaya Ho thenqs
1,"July 11, 2018"," I cant log into it... Neither through Google nor Facebook works. Help me 
please"
1,"July 11, 2018"," Felt the need to influence their Reddit AMA unapologetically with fake 
accounts with false comments and praise."
5,"July 10, 2018", I use for my youtube thumbnails and its the best editor i ever had
5,"July 16, 2018"," I just hate the new update of it last time i downloaded it, it was great 
But now i cant use it Bcoz again and again it's asking to allow permissions 
and iam allowing permissions again nd again But cant make a single 
edit😠😠😠😠😠😠😠😠😠😠😠😠"
4,"July 15, 2018", Superrr...fantabulos... But background eraser is not so good...
3,"July 15, 2018"," Good and convenient photo editing app.There are various themes, 
effects,font styles and 3D Magics.I recommended to use this app for pic 
editing."
2,"July 13, 2018"," Updated review. It seems since the last update it's slower loading and 
opening when using anything."
4,"July 16, 2018"," While saving my edited photos,the photo quality become bad"
3,"July 9, 2018", Good app but auto background change not available this app
4,"July 10, 2018", Plz upgrade new features Hindi font pic art team thanks u
5,"July 15, 2018"," Amasing app, I really wana appreciate d makers, I love editing pictures 
since only computwrs had wid a little of options, how evr in pi s art u 
have a complete range of ideas nd Optio s to support my dreams of d most, 
sorry bt o juz hav one complain, I hav been using pics art for years bt 2 
year...Full ReviewAmasing app, I really wana appreciate d makers, I love editing pictures 
since only computwrs had wid a little of options, how evr in pi s art u 
have a complete range of ideas nd Optio s to support my dreams of d most, 
sorry bt o juz hav one complain, I hav been using pics art for years bt 2 
years ago dere was diz facility of skin tan/shade/colour which is still 
dere bt not same as now, only option is to change d shade of d colour bt 
not mani. Fair or dark, juz colours, however I also know v can stil do d 
magic by bieng in one colour nd juz lessening d opacity or increasing, I 
REQUEST U TO PLZ GET D PREVIOUS OPTION FOR MAKIN SKIN FAIR OR DARK ND NOT 
JUZ D COLOUR OF SKIN, COLOR FOR D SKIN IS A BRIGHT IDEA BT ADD D ONE MAKIN 
FAIR ND DARK TOO. THANX, WAITING ANXIOUSLY,"
3,"July 11, 2018"," I just don't like all the ads because you have to click on stuff over & 
over to finish your project."
5,"July 17, 2018"," i want this app but if you save sa picture you cant edit again and have a 
little pixel or blur if you edited"
5,"July 15, 2018"," Unbelievable, Fantastic application using from last 4 years............. 
Update additional video editing features......"
5,"July 15, 2018", Ads are disturbing otherwise good app
2,"July 12, 2018", Its too much advertisement 😡😡😡😡 irritating so...
5,"July 9, 2018", Nice app to edit photo. I like very much😍😍😍😍
1,"July 15, 2018"," Since the update, it keeps crashing."
1,"July 10, 2018", IT SUCKS IT IS SO SLOW
5,"July 14, 2018", Superb! Can you add Gradient Colour features for Texts and Shapes.??
5,"July 15, 2018", it's very osam for edit. but sometimes it's have been hang of my phone
1,"July 11, 2018", Mera blur ka option sahi se kam nhi kr rha
2,"July 14, 2018", Ive paid for a month and the app wont let me use anything still
1,"July 16, 2018", Text doesnt work anymore
3,"July 18, 2018", Where did the glitch fx disappear?
1,"July 16, 2018", The new version is have mistakes
4,"July 17, 2018", Assamese text editor is not good
4,"July 13, 2018", I think it is good for change photos to our wish
5,"July 9, 2018", It is an excellent app for editing photographs in mobile.....
5,"July 16, 2018"," Make vector FX Make dslr blur options Make light room FX Make sumge HDR 
scale Make search option like toolwiz More...."
4,"July 13, 2018", Thanks iused it to make E and sell roblox t shirt
5,"July 15, 2018"," PicsArt is definitely an amazing app, I can draw easily, the tools are easy 
to use, everything is amazing, definitely using it to create my artwork."
4,"July 10, 2018", It's a very nice photo editor
2,"July 15, 2018"," Good app only one issue you basically have to pay for everything when there 
are other apps.100% free"
4,"July 9, 2018", Please work on pic qulity maintenance
1,"July 11, 2018"," Quando edito mi fa le foto sfocate,pure se sono HD risolvete:(("
1,"July 10, 2018", Very slowly and hangable aap ye aap bhaut hang Marta hai
5,"July 16, 2018"," Nice applicayion first i feel its wrost but i used it and found michivious 
things in it $ &i love that"
4,"July 17, 2018"," This is a best photo editing app for Android mobile mind blowing effects 
and more."
5,"July 10, 2018", Super editor can make anything u need
1,"July 9, 2018", Faltu app bar bar reset hota he faltu
1,"July 11, 2018", Stop doing fake AMAs
1,"July 14, 2018", Cb apps noob slow
5,"July 17, 2018"," This is a soo Nice app i say to my Friends i have a new photo eddit app 
they download it all ❤❤"
1,"July 12, 2018", Fake aap time wast
1,"July 7, 2018"," It won't let me use it, it keeps crashing before I can do anything."
4,"July 15, 2018", Grtt app I can make my photo anything whatever I want 😊😁
5,"July 17, 2018", Jo janega isko use krne uske liye ek no. H
5,"July 16, 2018"," I still use picsart i think 1 year so i think best photo editor in phones. 
Best means best best best"
5,"July 10, 2018", Loving the Beauty feature. It's FABULOUS!
5,"July 16, 2018"," Awesome Awesome Awesome It made me a professional Designer i really Love 
This...Thanks For This Application🙋❤"
4,"July 12, 2018"," I like this app, it made my photos great and I gathered a lot of likes and 
followers in Instagram"
5,"July 11, 2018", This app help me make my thumbnail for youtube👌👍
1,"July 17, 2018", SOOOOOOO SLOW! :(
5,"July 16, 2018"," Endless creative possiblities! I love this app there is nothing else like 
it out there."
5,"July 11, 2018", Really I like this photo editor very much
2,"July 16, 2018", My PicsArt apk is not working portrait option
4,"July 13, 2018", When we use PicsArt the clarity of the image is damaged
4,"July 14, 2018"," I just love editing and the app provides almost tools to make your pic 
better"
5,"July 18, 2018", This App Is Got Everything I Need to Make my Edits!!!!
5,"July 17, 2018", फोटो एडिटिंग में बहुत आसान एवं सुविधाजनक ।
4,"July 18, 2018"," its good,but i can't edit the picture properly 😞"
5,"July 12, 2018", I think very use full app
5,"July 17, 2018", Bole to kadak app he la jawab
3,"July 12, 2018"," Plz remove Ads.... Plz. Plz.. Plz.. .this app is very nice bu ads 😡😡😡 
are not good. ..plz remove ads.."
5,"July 9, 2018", Osm aaap bhot bikkat
3,"July 13, 2018", Kabhi kabhi photo ki quality bogas ho jati he ....... But reason
5,"July 15, 2018", This Apk is very nice Mind bowling Bhai mera to Dill khus hogayaa..
5,"July 16, 2018", Osm editor Ive ever seen
5,"July 14, 2018"," This app is very simple app for photos editing. This app is best for 
Android photo editing app. I any photo edite in this app. In this app easy 
to edite photo."
5,"July 16, 2018", Great app for wasting time. Ayy lmao
5,"July 14, 2018", Best app but it takes large space and after edit a pic the pixel is dead
1,"July 14, 2018"," It was nice... But now days that started payments for simple work... And 
that are trying cheet"
5,"July 17, 2018", I have never seen this before
5,"July 17, 2018", Almost All Features u need
5,"July 14, 2018", Please add 3D font features
1,"July 12, 2018"," I want a refurnd , please help me .. ASAP"
1,"July 14, 2018", only ads ..do not download this application
5,"July 10, 2018", Love you picsArt very sample photo editing love you and use this apk frndzzz
3,"July 17, 2018"," Thats nice app but it can reduse image quality after editing.....otherwise 
this is nice app."
5,"July 11, 2018", An awesome app. Now I can do my professional work on my phone.
5,"July 10, 2018", Very nice app I recommend this app everyone.....
1,"July 14, 2018", Why is it refusing to cut pictures..this sucks
1,"July 17, 2018", Won't allow me to cancel the subscription?!
4,"July 16, 2018", I can't use fx filterz
5,"July 11, 2018", This app is very interesting and spellbound
5,"July 12, 2018", vdhbzgn u know what im sayin
5,"July 12, 2018", Very very best app in the world
1,"July 15, 2018", Very bad app
5,"July 11, 2018", I Need Sakura Cheap Please. 🌸
5,"July 17, 2018", It's function like Photoshop
5,"July 14, 2018", One of the best photo editing apps ..easy to use and good quality result....
3,"July 11, 2018", Pls add the more filter
5,"July 10, 2018", Mst app download now
5,"July 15, 2018", I like it because you can make your own cartoon!
1,"July 15, 2018", No free trial here
5,"July 10, 2018", Very very nyc app
5,"July 15, 2018"," Awesome app,,, here u got different ideas to make your picture lovely ..."
5,"July 15, 2018", Hi I m bijay
3,"July 11, 2018", Sometimes gt error
1,"July 18, 2018", Bekar not usable
1,"July 8, 2018", Very bad of editing
5,"July 15, 2018", Super app for me!!
5,"July 16, 2018", Amazing app. As long as you know how to edit its perfect
5,"July 14, 2018", I think this is the best app untill forever to make pic Awesome...👌
2,"July 15, 2018", I want special creation but app does not work the special
4,"July 16, 2018", This app is NYC but cusoutw new feature not working
3,"July 14, 2018", STOP DELETING MY WORK! Other than that I love it.
5,"July 9, 2018", I just this app.
5,"July 10, 2018"," It's a fabulous app I like collages of this app very much and this is the 
best app"
1,"July 15, 2018", Bkl kya bhangar sticker quality he. It's lossing it's picture quality.
5,"July 16, 2018", Osm app in editor's
5,"July 14, 2018", Thanks thank you for giving pics art ok it's over
3,"July 13, 2018", Always crashes.
5,"July 12, 2018", Artists rejoice!
5,"July 17, 2018", I don't feel so good.
1,"July 11, 2018", AMA disaster.
5,"July 13, 2018", I love you PicsArt
5,"July 16, 2018", It's a very good app Best photo editing app in Google play store 👌👌👌👌
4,"July 17, 2018", It's best pic editing app Simple and lovely app for pic Edith editing
4,"July 17, 2018", GooD App Nice App Love IT Soooo Muc'H Thank You
5,"July 15, 2018", I've tried all kinds of photo editors and this one by far is the BEST!!!!
5,"July 16, 2018", Very good and I hope you are well and enjoying the sunshine
4,"July 11, 2018", I like it cuz of it's complete functions for edit pics.
5,"July 15, 2018", Very usefull for editing photos giving animations I love it
5,"July 17, 2018", No. 1 editing app in the world. 👌😍😍
1,"July 13, 2018", Too many ads
1,"July 16, 2018", Nyc edit apps
1,"July 6, 2018", Ads at every turn
1,"July 12, 2018", To many ads
5,"July 13, 2018", its just awsam
4,"July 16, 2018", I like this app
1,"July 17, 2018", You need to pay for this
5,"July 17, 2018", നല്ല ആപ്പ് ആണ്
4,"July 17, 2018", It is ok for editing
5,"July 17, 2018", Prince ishavar Desai
5,"July 15, 2018", Excilent app....for editing image
5,"July 16, 2018", This app is the best a new app marathi please pick art please
5,"July 14, 2018"," Good apk, recomended for u for editing your foto"
5,"July 9, 2018", it's very nice app
5,"July 10, 2018", It's a really good app for people new to editing
5,"July 10, 2018", It's good app
5,"July 15, 2018", 🚫 this message was deleted
5,"July 10, 2018", What a apps very good 100 out 100 for editing.
5,"July 12, 2018", Very nice but auto edit not here
5,"July 16, 2018", This is the best photo editing app of all time
5,"July 12, 2018", It is good but for buying the stickers it requires money
5,"July 11, 2018", This is the best app in the world dor make logo
5,"July 12, 2018", Best photo making app I have used
5,"July 17, 2018", Thts the best editing app i would prefer evry1
5,"July 11, 2018", Great h lekin kbhi text copy nhi hote ...
1,"July 17, 2018", This app is amazing! 10/10! Absolutely love it.
3,"July 7, 2018", Mah bst look photo app...Lv dis shine
5,"July 17, 2018", Love it helps with my downloaded Instagram edits 😄
5,"July 13, 2018"," Best apps for Android users 😍,, best editing apps for me 😍"
5,"July 10, 2018", One of the best editing app for intrested editores.
4,"July 12, 2018", Wowsome!
5,"July 13, 2018", osam osam Osam just osam
5,"July 4, 2018", Its a very very very good app Please downlaod this appp
5,"July 16, 2018", Best editing app in play store is #picsart ..
2,"July 12, 2018", This was vey good app for pic editing
5,"July 14, 2018", In my opinion it the best Editing app
1,"July 15, 2018", Update version is sucks.. Older version was much better
