3,"July 3, 2018"," App has served me well for a long time, but ads are much more prevalent 
than ever, and the features dont seem to work as well as previously... the 
add photo feature undoubtedly has been ruined as once I accept the image 
position it completely distorts the places image... hoping things improve 
to...Full ReviewApp has served me well for a long time, but ads are much more prevalent 
than ever, and the features dont seem to work as well as previously... the 
add photo feature undoubtedly has been ruined as once I accept the image 
position it completely distorts the places image... hoping things improve 
to their former glory."
2,"June 30, 2018"," I want high resolution images to be saved, whenever i make posters by 
drawing or text, i used to go into drawings section n then save it but now 
this update sucks, i cant save it with high resolution even if im going 
into drawing sections or setting it to ms pixels to maximum"
5,"July 2, 2018"," Its so laggy. Please provide less ads for more better usage. (Edited : I 
just download it again and is not as laggy as before, thanks for the 
suggestion :) )"
5,"July 7, 2018"," I've been through many picture editor but they all have flaws! But then 
there is this application! easy to access, amazing filters! #SKANUP"
2,"June 30, 2018"," I hate this because when I first got it everything was all good and a 
amazing app, but then today whenever I save my photos to my device it saves 
blurry. So then all my hard work of editing was for nothing."
1,"July 2, 2018"," Please remove magic effects to destroy picture quality. I just use it to 
create memes. Quality matters. Not faces. And your reply was useless. I did 
it but doesn't work. It was already set to maximum"
4,"June 24, 2018"," It's also very useful for developers, creators and youtubers, like me! It's 
a professional photo editor. I love it! Add more functions and creator 
options please! I am a creator I have YouTube channel so make it more 
useful YouTubers.😋 But now it's not nice as I want, so 4 stars only!😋 
Keep it...Full ReviewIt's also very useful for developers, creators and youtubers, like me! It's 
a professional photo editor. I love it! Add more functions and creator 
options please! I am a creator I have YouTube channel so make it more 
useful YouTubers.😋 But now it's not nice as I want, so 4 stars only!😋 
Keep it up!!!!!💐💐💐💐💐 Plz reply *Developers*!! But I found that this 
app is getting more unstable with every update!😢"
5,"July 5, 2018"," Except few things,this app is a total Photoshop tool in ur smartphone. No 
words can describe the way it works. Truely amazing"
4,"July 7, 2018"," Well it's an overall great app but sometimes it shuts down all of a sudden 
and the picture you've been working on for so long is just lost. You need 
to fix the bugs which are doing this"
3,"July 1, 2018"," Everything is perfect but the app always gets crashed. Whenever I choose to 
add stroke to the text the app stops in the middle it stops responding & 
popup appears asking PicsArt isn't responding do you want to close it? 
Report wait close these are the options given by the pop-up. Currently 
using...Full ReviewEverything is perfect but the app always gets crashed. Whenever I choose to 
add stroke to the text the app stops in the middle it stops responding & 
popup appears asking PicsArt isn't responding do you want to close it? 
Report wait close these are the options given by the pop-up. Currently 
using PicsArt version 9.35.1 My device model Micromax canvas Xpress Q413"
3,"June 27, 2018"," Really good photo editing app and I've been using it for years. But more 
recently every time I use it for more than 15 minutes at a time it 
overheats my phone and freezes it completely."
1,"June 29, 2018"," Cutout ka option ni aa rha beautiy ka bhi ni aa rha hai ak bar home kiy par 
jane ke bad dubara cut ja rha hai fir suru se edit karna pad rha hai"
2,"July 8, 2018"," I can't login to my account.. Feedback has been ""something went wrong....."" 
and i have strong internet."
1,"July 6, 2018"," OMG. What did you guys do? I loved this app. Loved. This. App. But 
apparently there's been some sort of update and it took a good four minutes 
to load. When it did load it insisted on having an email address and after 
that it bombarded me with ads I believe 3 ads that I had to wait till they 
loa...Full ReviewOMG. What did you guys do? I loved this app. Loved. This. App. But 
apparently there's been some sort of update and it took a good four minutes 
to load. When it did load it insisted on having an email address and after 
that it bombarded me with ads I believe 3 ads that I had to wait till they 
loaded all the way before I can close them out. What have you done? Thank 
God Pixlr is still the same. Everyone, if you don't have PIXLR go get it. 
Its not exactly the same, but it's one of the best. Also Repix, Snapseed, 
and MeituPic. You guys had a good app--no, an awesome app. And you've blown 
it. BIG time. We should all be so fortunate to be able to create a 
kick-ass, one-of-a-kind app like this and in one greed filled instant, 
flush it down the toilet. You squandered what you had and I pity you. 
Uninstalling now, sadly. And I will be grieving this one for a long time. 
Dated the 6th of July 2018. R.I.P. PicsArt. You were great."
5,"June 30, 2018"," Loved this application overall, but from last update i am not able to view 
the edited pictures in my gallery but the pictures are their in the file 
manager. please resolve the issue ASAP."
1,"July 13, 2018"," It keeps lagging! I can't even open it or edit the picture! I love the 
features, the stickers, and many more but the only thing is it keeps 
lagging and make my phone lag too."
2,"July 1, 2018"," I use to love this app. I can deal with pop ups but everything you have to 
pay for. It use to give some free frames."
5,"June 27, 2018"," Very Slow...😒😒 I want fastest one... I have been using Picsart from 2014. 
I think it is best photo editor apps. But the update version run 
slower...😒😒"
3,"July 1, 2018"," Everything is well and fine except it some times lags whenever I open it 
without internet connection. Other than that it is one of best photo 
editing app. 😁"
1,"July 5, 2018"," Since the upgrade all it wants me to do is join the stupid Gold Club. Can't 
even buy packets without having to sign up. I was going to remove the 
upgrade but I can't (of course). I like this app but they are making it 
difficult to use it freely. Stickers and frames I've gotten for free before 
ar...Full ReviewSince the upgrade all it wants me to do is join the stupid Gold Club. Can't 
even buy packets without having to sign up. I was going to remove the 
upgrade but I can't (of course). I like this app but they are making it 
difficult to use it freely. Stickers and frames I've gotten for free before 
are suddenly gone from my collections and are showing with a price tag."
5,"July 7, 2018"," Really awesome and brilliant app but Portrait & PIP features are missing. 
So please please add the Portrait & PIP features. I think the Portrait & 
PIP features put extra feathers in the crown of this app and makes this app 
total complete. So, please guy's don't ignore my opinion & take necessary ...Full ReviewReally awesome and brilliant app but Portrait & PIP features are missing. 
So please please add the Portrait & PIP features. I think the Portrait & 
PIP features put extra feathers in the crown of this app and makes this app 
total complete. So, please guy's don't ignore my opinion & take necessary 
steps to solve it."
3,"July 5, 2018"," I love this app. But I remember when it was actually free. Im disappointed 
that after years of excellent quality app experience it has really 
decreased in quality and has many ads unless you buy premium which is 
expensive af"
2,"July 8, 2018"," Unfortunately, the app that I always loved, has started glitching so bad on 
my phone I cant deal with it! 10 minutes, and 4 retries later, all this app 
does these days is frustrate me!"
3,"July 7, 2018"," This thing used to be good few years back when there were no competitors, 
but now a days with the pace in the competition for apps like this one, 
this group of people are just not able to close the gap and bring new 
features that will bring new dimensions with mobile photography, The only 
one i ...Full ReviewThis thing used to be good few years back when there were no competitors, 
but now a days with the pace in the competition for apps like this one, 
this group of people are just not able to close the gap and bring new 
features that will bring new dimensions with mobile photography, The only 
one i know is that they are trying really hard to turn it into a social 
networking site- which I think is silly. What is this terrible and horrible 
camera that you came up with? Do you think Monkeys and donkeys will use 
this app? I used to love this app but we need more logical and more usefull 
features"
5,"July 7, 2018"," I gave this a star... I'm very excited to use it but whenever I make a 
account and sign in and then go to edit something it always says ""problem 
defected"" please help me PicsArt, I was really excited... Has anyone else 
had a issue??"
3,"July 2, 2018"," It's not even letting me create an account or login to my old account it 
was just working it keeps loading slow and it will be like something went 
wrong"
3,"July 2, 2018"," Looked promising..wouldn't save half my editing work and corrupted a file. 
Couldn't get out of the Draw function screen once saved amd completed."
1,"July 3, 2018"," It will not let me log in. Normally that would be a connection problem, but 
I can log into every other app I use."
3,"June 30, 2018"," I like this apps but these few days I can't cut the photos automatically 
like I used before. I feel sad but I hope u can help me to back what's I 
used before😊"
5,"July 5, 2018"," Previous version is best to edit photos.. manual Corp troublesome pl allow 
auto Corp"
4,"June 27, 2018"," Pic size is not more than 6 mp. Plz increse this at least 12 mp. We need 
high resolution pics for high detailing & zooming the image. By artist 
group users. Plz solve this."
1,"July 5, 2018"," My fav. Editing app...i love pics art... #but one big problem-- pic edit 
after #OOOPS Wt... ?😡😡"
5,"June 30, 2018"," I really like this app because this is really great to make awesome edits. 
And when I shared my edit to instagram people started liking it and 
following me! And I also did this! #picsart I wanted everyone to download 
this cos it is AMAZING!! ❤❤"
1,"July 8, 2018"," सर हम को ज्यादा इंग्लिश तो नहीं आती है और हमारी प्रॉब्लम ये है कि हम ने 
आपके इस app में 150 से ज्यादा फोटो को काटकर अलग सेव किया था my स्टिकर्स में 
पर वो सब कट कैसे गई पहले ये app इतनी अच्छी थी कि कोई परेशानी नहीं होती थी 
पर रोज़ उपडेट कर कर के इस को बकवास कर दिया गया हैplease help me know"
1,"July 4, 2018"," I have a hard time photoshoping my pictures and everytime I have more than 
3 pictures, it tells me to select background which I don't want to do."
5,"July 7, 2018"," Omg I just found out what Peter Parker used for AVENGERS: Infinity war. I'm 
so thankful....yet very sad."
2,"July 5, 2018"," Used to love this App. Now there are TOO MANY Ads! Please don't reply and 
say we can subscribe to get rid of the ads. If all companies would follow 
your logic, customers would have thousands of dollars on subscriptions to 
tons of apps and services. Subscription based model is DEFINITELY NOT 
some...Full ReviewUsed to love this App. Now there are TOO MANY Ads! Please don't reply and 
say we can subscribe to get rid of the ads. If all companies would follow 
your logic, customers would have thousands of dollars on subscriptions to 
tons of apps and services. Subscription based model is DEFINITELY NOT 
something customers want to pay for a mobile photo editing app. Will move 
on to another app."
1,"June 30, 2018"," I usually love this app. But lately it's cutting off the first letter when 
I try to put text on a picture."
5,"July 2, 2018"," AWESOME! its super cool to edit stuffs. especially if you want to make 
memes. although sometimes the app is slow. so be patient."
5,"June 27, 2018"," Wow! Just wow, this app is pro rating, it has never failed, the possibility 
is so much, this app, is worth every in app purchase, it awesome, thumbs up 
to the developer, keep the good work, though there is still lots of room 
for development, I hope you listened to your user, but overall, you dese...Full ReviewWow! Just wow, this app is pro rating, it has never failed, the possibility 
is so much, this app, is worth every in app purchase, it awesome, thumbs up 
to the developer, keep the good work, though there is still lots of room 
for development, I hope you listened to your user, but overall, you deserve 
the highest rating, AWESOME!! APP!!!, so fluent on my Galaxy s9, thanks for 
this."
4,"June 28, 2018"," Yep it's a good app to make pictures look great then before if you know how 
to use it. but it contains to many adds"
3,"July 3, 2018"," best app since day one dnt use any thing else just this to good to delete 
but now that i have upgraded it wont tell me re set it in my new phone say 
to pay for it again"
2,"June 28, 2018"," I started loving it after you added the portrait mode in this app. But in 
the latest update it's gone. Please get that feature added back to the app"
5,"June 30, 2018"," Love picsart my editor never try another one great for learning and create 
#photograph artistic and enter competions. New updates make it more fun. 
Creative tool for editing images."
2,"June 27, 2018"," I'm really love this app but some bugs are there and irritating that why 
I'm giving 2star"
3,"July 9, 2018"," Was the best until they updated it so much. Too many advertisements now . 
its a mess."
1,"July 9, 2018"," I never seen before like this worst app. All things in this paid no one for 
users"
1,"June 27, 2018"," i used to like this app but since the last update its almost unusable with 
the huge amount of ads they throw in it, the they have the nerve to ask 
your to buy their stupid ad removal service, in short, dont get this app, 
get something else"
4,"June 23, 2018"," I miss the old ones because there's no ads about the premium account. It 
disturbs me everytime if I want to save the pictures after I finish 
editing. I hope that the ads will appear only when users start to launch 
the app, not after the users have editing the pictures."
3,"June 28, 2018"," It has great editing tools but idk if its just me but when i want to use a 
sticker it wont happen and a purple replay icon shows up which does nothing"
4,"June 29, 2018"," A really great app full of fantastic features. Would have got 5/5 but keeps 
crashing."
2,"July 5, 2018"," Hi Picsart, first of all I like the feature you have, but what I cant 
understand is when I edit a photo which is originally a 1.10 MB after I 
edit or save it from Picsart, it would come out at 800 KB. Whats with the 
dropping quality?"
5,"June 30, 2018"," Good features + incredible experience with this app till the app is working 
very well even some time adds are annoying but accept of this all the 
filters and this app is helpful for me to make my look more good overall 
love it😙😘😘😘😘"
1,"July 3, 2018"," Siempre que estoy haciendo edits increíbles,en los cuales gasto mucho 
tiempo,simple salgo para alguna otra app y cuando vuelvo se me pierde todo 
- _- vaianse a la verrrergx"
2,"July 4, 2018"," Used to be very good. Now it crashes all the time and is full of 
advertisement. Am searching for an alternative."
2,"July 10, 2018"," I liked it at first but then I didn't like it can you please make it so you 
can save your photos so you don't have to start all over to edit your photo 
because when I was making something really cool it started to load forever 
then I removed it from the apps that I was playing then it didn't save...Full ReviewI liked it at first but then I didn't like it can you please make it so you 
can save your photos so you don't have to start all over to edit your photo 
because when I was making something really cool it started to load forever 
then I removed it from the apps that I was playing then it didn't save so 
yeah I don't like it that much"
5,"June 28, 2018"," THIS IS THE BEST PHOTO EDITING APP EVER! IT HAS SO MANY FREE FEATURES!!!! 
Don't listen to the comments that say it's bad."
4,"June 29, 2018"," मेरे हिसाब से ये अब तक का सबसे अच्छा फ़ोटो बनाने का एप है।मेरा नॉट 5 प्रो 
में ये बहुत ही अच्छा से फ़ोटो बना देता है।"
2,"June 28, 2018"," I'm highly disappointed. I had been working on a drawing for over 6 hours, 
only for it to be randomly deleted. I am livid to say the least. how can I 
recover deleted drawings!? this is the second time this has happened. 
really picsart??"
3,"July 12, 2018"," It's alright but they should really tone it down on the ads. Sometimes 
you'll get so many ads your phone will start to slow down of even crash :/"
5,"June 27, 2018"," I love this app very much. It is very useful app for me. I was very happy 
with this app. I thank the person who make him. Very very very thankful"
4,"June 26, 2018"," I like the app but when using discover stickers in editing they come of 
blurry. Also when resizing the sticker, please fix this issue in mobile 
devices."
2,"June 29, 2018"," The app glitches and goes back to gallery after clicking certain features. 
Then when you try the same feature with other images it works. Today is my 
first day downloading/using the app so I'm slightly diasapointed -_- . I 
also cleared my cache and uninstalled and reinstalled about 4 times like I...Full ReviewThe app glitches and goes back to gallery after clicking certain features. 
Then when you try the same feature with other images it works. Today is my 
first day downloading/using the app so I'm slightly diasapointed -_- . I 
also cleared my cache and uninstalled and reinstalled about 4 times like I 
was told and it still won't work. It Glitches and shut downs after clicking 
anything in the beautify section. I hate it"
4,"July 11, 2018"," Picart ka cut out option agar photoshop cs6 pen tool jaisa ho jaye to 
picart no1 photo editor ho jayega please picart developer itna kar do 
.........plesssssssssssss"
1,"June 25, 2018"," THE NEW UPDATE IS WORST NOW I CAN'T EVEN LOGIN TO MY ACCOUNT AND THE APP 
ALWAYS CRASHES EVERY SECOND I used to love this app but now I hate it"
1,"July 8, 2018"," I am so tired for continously clicking the stickers and magic fx but they 
won't appear ..i also requested @techsupportpicart but the request is failed"
2,"June 26, 2018"," Been using it for years now.. Since the last update... It just doesn't open 
up.. Have re installed it a hundred times but nothing.. I wrote a feedback 
but no reply.. Disappointed now"
1,"July 8, 2018"," Used to be good, now it's horrible due to constant and very intrusive adds 
to force you into buying gold. Protip: Run the app while in airplane mode 
to bypass the adds."
5,"June 29, 2018"," This best photo editior of android. I created a youtube channel *JAYANT 
CHAHAR * On this i uploads picsart editing tutorial."
5,"June 24, 2018"," This is the bestest app I've ever used. I recommend everyone to use it. See 
my blog at Instagram @deeksha_rawat1 for evidence."
3,"July 4, 2018"," App was working nice but i save my edits in gallery the words gone blur 
please tell me for this..."
3,"July 6, 2018"," Just redownload it on a new phone, sad to see so many ads but that's life I 
guess if you want free stuff! Good app with lots of great features"
5,"June 28, 2018"," The app is awesome but the app is stucking so many times that's why I am 
unable to edit pics fast pls suggest me how can I improve my app"
3,"July 5, 2018"," its exteemely good but keeps on crashing amd its the fifth time i am making 
the same thing because it crashes at some point and wont autosave my work"
2,"July 3, 2018"," I am unable to share collages to Facebook. Keeps telling me ""something went 
wrong. I have made sure no updates needed."
5,"July 8, 2018"," This is best app for editing in android but it should add some features 
like in snapseed This app is better than all apps but should improve 
because the edited image will be losses it naturallity"
5,"June 23, 2018"," Iii like this app because we can make our photo more beautiful & it is very 
good"
2,"July 1, 2018"," Used to love it but when I updated it its not good i am having a hard time 
editing the photos the cut out and the cropping i hate it its taking me a 
long time not like the time when i did not yet updated it"
1,"July 1, 2018"," Bakwas app hai... Hamesha mob hang hota hai.. And app not responding... 
Faltu app"
5,"July 2, 2018"," You are you not play and you speak Arabic To me anything plz can u make 
these hearts on is I love you are you are speak"
2,"July 2, 2018"," When I tried to add photo, it become blurry after i edited the photo :( why 
the photo become blurry? I tried many times but the results is still the 
same :("
4,"July 9, 2018"," Very cool photo app. Lots of cool ways to edit your pics. But...the ads are 
totally obnoxious."
1,"July 9, 2018"," Everytime I use this app it crashes, stops working, and won't reopen so I 
can't even save my work. I'm dissapointed."
3,"July 16, 2018"," Stickers become blur when i m Using them Why ? I m facing problem in 
editing pics."
3,"June 26, 2018"," It's a great photo editing app and it has so good tools for editing a photo 
but it reduces image quality"
3,"June 30, 2018"," This app is I think the best editing app I ever had but there's a problem 
that its camera feature is not working in my phone.......feeling too 
bad😢it shows that""oops looks like there was a problem.please describe the 
problem you encountered."""
2,"July 2, 2018"," I loved it but I don't know why but today when I tried to edit two pictures 
the results were really blurry..please fix this problem"
3,"July 8, 2018"," It not rendering high quality pixels size Basic functions are not offline. 
It needs data connection which was not as earlier version."
3,"July 4, 2018"," Dear developer I'm not able to save the image edited by picsart. Please can 
you solve this issue."
4,"July 1, 2018", I can do things with this app I didn't think was possible
1,"June 22, 2018"," Crashed on me 3x yesterday when i was 99% done now it keeps pixelizing my 
picture of me which is a sticker on here"
1,"July 3, 2018"," Even though it's full of ads, almost everything is premium and that premium 
page keeps popping.That is really annoying."
5,"July 1, 2018"," nice app but is the thumbnail picture necessary Spiderman didn't deserve 
that c'mon now smh"
4,"June 25, 2018"," This a good app for editing.All types of edit is done with the app But 
something it doesn't work properly and work slowly"
5,"July 13, 2018"," The image size getting low after editing images that's the only bad thing 
in this application"
4,"July 4, 2018"," 5 start to old version,guys just make the stickers offline pls it keeps 
irritating"
3,"July 1, 2018"," 😞this app is crashing my device ( redmi note 4 ) ....if I use it more than 
5-10 minutes... It's terminate itself ...and everytime of close ...my 
editing is just go in waste ..... 😞 Fix this please.. it wasn't with the 
older version ... I'm facing this problem from 1 month.... Tired now...not 
u...Full Review😞this app is crashing my device ( redmi note 4 ) ....if I use it more than 
5-10 minutes... It's terminate itself ...and everytime of close ...my 
editing is just go in waste ..... 😞 Fix this please.. it wasn't with the 
older version ... I'm facing this problem from 1 month.... Tired now...not 
using too much jst bcox of crashing... Still not solved this issue I'm 
going to use 2017 version of this Application 😠 it's really irritating me 
I edit cover 30 mins after its crashed ... Without save ...I have to edit 
again n again...fix this problem please my phone is Xiaomi Redmi note 4 ,os 
version is 7.0 .... And the app problem is after 2018 all versions.... 
almost 😠"
5,"June 29, 2018"," I never write reviews for apps but this one deserves my gratitude...is 
great, simple and with a lot of features. I had the premium version and it 
was amazing...probably will get it again"
5,"July 7, 2018"," The best editing app ever, even sometimes it was crushing on my phone and 
can't save pics without internet. I hope your fix that Please let us save 
picture that we edit even its offline."
5,"July 3, 2018"," They have remove the deniose option Not m not liking pics art new update Y 
u guys remove the deniose option And new beauty seting is worst Correction 
seetings are only good Unistall new update Worst updates"
5,"July 10, 2018"," Sss gud but pixcles of the pic will be broken when we edit that one only is 
the problem"
5,"July 1, 2018"," I love this app so much, and it is my recommended choice for making my 
profile pic edits, or my background edits. I make edits for people as well, 
and PicsArt just helps me to continue to do what I love doing. I highly 
recommend this app to anyone."
