5,"July 17, 2018", It is very easy to edit pic .. This is the best & easy to EDit the pics  ......   Requesting to u add more facilities.  Loved this app From ....@/&lt; 55
4,"July 17, 2018"," How do I subscribe to remove ads in the app?? As in make use of all the 
features in the app."
5,"July 17, 2018"," Beautiful, excellent, great, superb,marvelous,😘😘😘😘"
5,"July 18, 2018", I always use PicsArt to edit my photos....😎😎😎
4,"July 17, 2018", Awesome
5,"July 18, 2018", Awsome
1,"July 13, 2018"," I Just updated my application, deleted it and the re-installed it, and the 
fonts won't change !"
1,"July 14, 2018", This app lossing photo quality
5,"July 14, 2018"," I've recommended this to all my friends, so great! I've had this for a long 
time now and it's easy to use with a TON of ways to edit photos, and 
there's attention to detail in just how precise you can be. People often 
think I used Adobe Photoshop on my edited photos, but nope, it's Picsart. I 
sp...Full ReviewI've recommended this to all my friends, so great! I've had this for a long 
time now and it's easy to use with a TON of ways to edit photos, and 
there's attention to detail in just how precise you can be. People often 
think I used Adobe Photoshop on my edited photos, but nope, it's Picsart. I 
spent a long time downloading different photo editing apps and they didn't 
have much, but then I found this one and the search is over, it has 
everything. One thing that does bug me is that when trying to erase the 
background of a picture, you have to do it all manually. (For example, if 
there's a white background, you can't select the white background and 
delete it like in other apps. You have to erase it with your finger. I like 
the precision of manual erasing (And the ability to change the opacity and 
hardness for what you're erasing) but I'd love it if you could still have 
an auto select as well for a fast, easy edit.) Anyway, I can't really find 
much wrong with this app, just download it."
3,"July 15, 2018"," Used to love this app and tell everyone about it. Since they went through 
and charged the Premium pricing everything has gone down hill. I paid 2 
years ago for the No Ads. Now I would have to pay again for No Ads and a 
bunch of stickers, fonts, and other items I don't need because I already 
""pur...Full ReviewUsed to love this app and tell everyone about it. Since they went through 
and charged the Premium pricing everything has gone down hill. I paid 2 
years ago for the No Ads. Now I would have to pay again for No Ads and a 
bunch of stickers, fonts, and other items I don't need because I already 
""purchased"" what I wanted. This is a shame and a scam. I spent over $30.00 
buying items and some of them don't even work anymore as they can't be 
restored."
1,"July 14, 2018"," It was an amazing app but now all the content that was free requires a 
subscription. You cannot save images using certain filters. I have been 
using this app for years and I guess since it gained popularity they've 
decided to capitalize on it. There are numerous ads that interfere with the 
abili...Full ReviewIt was an amazing app but now all the content that was free requires a 
subscription. You cannot save images using certain filters. I have been 
using this app for years and I guess since it gained popularity they've 
decided to capitalize on it. There are numerous ads that interfere with the 
ability to use the app. I cant reccomend an app that has the same features 
that previously were free and now require a cost."
3,"July 14, 2018"," I've been using this app for years and its pretty decent. Its easier to use 
than some others. Features are good. BUT I'm not happy that so many things 
have to be paid for now. Stickers used to be the only thing one would be 
forced to pay for but bow...not as happy as I could be with this app."
3,"July 10, 2018"," It's an amazing app but the ads are getting intrusive. I know you want me 
to pay for the full version or get a subscription but come on. An ad when i 
boot it, and ad every time I start a project, and 3 ad's when i want to 
save anything. There are even ads at the top and bottom of the page while 
...Full ReviewIt's an amazing app but the ads are getting intrusive. I know you want me 
to pay for the full version or get a subscription but come on. An ad when i 
boot it, and ad every time I start a project, and 3 ad's when i want to 
save anything. There are even ads at the top and bottom of the page while 
i'm working. I miss the old version where you paid for features not to stop 
annoying ads"
4,"July 11, 2018"," I love this app to make charater edits but i just hate how laggy and/or 
glitchy it can be whenever i use it. I have to close down the app or exit 
it briefly continuously whenever i use it. As of late i've also been 
experiencing problems with stickers loading up (i can be waiting for like 
10 mins...Full ReviewI love this app to make charater edits but i just hate how laggy and/or 
glitchy it can be whenever i use it. I have to close down the app or exit 
it briefly continuously whenever i use it. As of late i've also been 
experiencing problems with stickers loading up (i can be waiting for like 
10 mins but they wont work). If this could be fixed that would be great."
3,"July 14, 2018"," This is the best photo app I have come across. I tried it offline and it 
was fantastic. I happened to open it when i was online and unfortunately, 
you apparently have to login to use it. I'm presuming I will be told that I 
will miss out on this and that if I don't create an account. I guess I wil...Full ReviewThis is the best photo app I have come across. I tried it offline and it 
was fantastic. I happened to open it when i was online and unfortunately, 
you apparently have to login to use it. I'm presuming I will be told that I 
will miss out on this and that if I don't create an account. I guess I will 
keep using it offline. I am not happy creating accounts just to use an app. 
I am happy to pay for apps to use offline."
3,"July 9, 2018"," I used to love this app but since all the updates the tools are not the 
same as they were in the older version, like the skin colour changing its 
not natural when using it the old version was not like that and face fixing 
etc looks so fake whereas with the older version it was amazing. Face 
fixi...Full ReviewI used to love this app but since all the updates the tools are not the 
same as they were in the older version, like the skin colour changing its 
not natural when using it the old version was not like that and face fixing 
etc looks so fake whereas with the older version it was amazing. Face 
fixing looks blurred and fake and as if youre painting it on and the older 
versions it didnt have the blur it looked natural and not painted on. Pls 
fix it"
4,"July 16, 2018"," alright so i love the app but i have one small suggestion in the hopes that 
I'm not the only one with this issue. a background that has a pattern or 
maybe a grey one like the one in the drawing panel would be great because 
if i'm doing something to a pic that has a black background i cannot see 
...Full Reviewalright so i love the app but i have one small suggestion in the hopes that 
I'm not the only one with this issue. a background that has a pattern or 
maybe a grey one like the one in the drawing panel would be great because 
if i'm doing something to a pic that has a black background i cannot see 
the borders of the actual pic and it's a mess"
1,"July 16, 2018"," Do NOT get the gold version of this. They advertise their product as 4 usd 
a month with the opportunity to cancel at any time and then charge you 50 
usd for the year and allow you to cancel after you have paid those 50 usd. 
They won't provide you a refund and google play isn't able to either. 
Pl...Full ReviewDo NOT get the gold version of this. They advertise their product as 4 usd 
a month with the opportunity to cancel at any time and then charge you 50 
usd for the year and allow you to cancel after you have paid those 50 usd. 
They won't provide you a refund and google play isn't able to either. 
Please be careful. The app otherwise is nice, however, this situation 
definitely made me uninstall. Bad customer service and 50 usd for an app??"
3,"July 11, 2018"," They need to find a way to save unfinished work. I lost the signal on my 
phone along with a picture I was working on for a hour. The Picsart from 
last year was more reliable, I never had a ""oops, there was a error"" 
message after losing my work."
2,"July 14, 2018"," until today the app was just fine when I used it and I use it a lot. when I 
went to use it today I would add a picture (or a few) and after I pressed 
the tick the added picture would become very pixelated. this hasn't 
happened before could you fix it please"
4,"July 12, 2018"," You have responded to me thank you ! I have gave you a five star anyway 
because I have in the past made so many pretty pictures. Oh my ugh ... 
where did the stamps go I used them alot I would pay even to have them 
back. Please go back to the old way on text I can't find my text and whats 
here is...Full ReviewYou have responded to me thank you ! I have gave you a five star anyway 
because I have in the past made so many pretty pictures. Oh my ugh ... 
where did the stamps go I used them alot I would pay even to have them 
back. Please go back to the old way on text I can't find my text and whats 
here is not as nice as the old way . I tryed to find my text I purchased 
but can not find them in whats mine section. I also miss the cool way the 
text was before when you could add color and blend this way is not better 
at all ugh again ! But I still love this app but makes it not as fun and 
much harder. Please, please pretty please give the stamps back !!! Also 
where do I find my user name can't find it ???"
2,"July 15, 2018"," This app use to be the best and I use to love it. Not anymore. It has a 
ridiculous amount of ads and since the last update, it's harder to use 
especially with all the ads popping up. I also bought many different fonts 
in the past and now I do not have them anymore. Very disappointed"
3,"July 17, 2018"," it's a pretty good app, but why does it always load? like i can't even see 
my own stickers, my wifi is very fast but it still keeps on loading. it 
also says that their server is busy, please fix it."
1,"July 12, 2018"," Each and every time I use this app the quality is down to 5 Megapixel when 
you save a picture and I HATE bad quality. If I forget to put it on 8 
Megapixel in settings, I have to start all over again pfffff. An ad pops up 
with every move you make. If you don't pay its not pleasant to use. This is ...Full ReviewEach and every time I use this app the quality is down to 5 Megapixel when 
you save a picture and I HATE bad quality. If I forget to put it on 8 
Megapixel in settings, I have to start all over again pfffff. An ad pops up 
with every move you make. If you don't pay its not pleasant to use. This is 
all and only about money and they want more and more and more..."
5,"July 13, 2018"," THIS APP IS GREATTT I really love this app and Im a user since 2016 But I 
really wish the developers Fix the bug, Crashes and lag problems.... But i 
do still really love this app"
1,"July 15, 2018"," I miss the old features. Were you could make your own background. You could 
make a letter then put it on a background and be able to apply anywhere on 
the screen. Then you could in large the letter or decrease it's size. You 
could make a name and keep it horizontal or curve it then you could inve...Full ReviewI miss the old features. Were you could make your own background. You could 
make a letter then put it on a background and be able to apply anywhere on 
the screen. Then you could in large the letter or decrease it's size. You 
could make a name and keep it horizontal or curve it then you could invert 
it the name. All that is gone! Useless to me now!"
1,"July 16, 2018"," This app used to be an awesome app but not anymore. Way too many ads and it 
won't let me save a change if I click ""no thanks"" on an ad. I've had this 
app for several years, uninstalling now."
1,"July 11, 2018"," This app used to be the go to, then it got popular and it went all down 
hill. You used to be able to use all the editing features available of 
course now you have to pay and because it's popular it's flooded with ads. 
Time to move on to another app."
3,"July 9, 2018"," I used to love PicsArt for content creating because it got things I need to 
do so. BUT, for the past few days, when I'm in the app for less than 15 
minutes, the app suddenly went gray screen saying there's a problem, and 
losing my work in progress with no saved draft in the process. This happens ...Full ReviewI used to love PicsArt for content creating because it got things I need to 
do so. BUT, for the past few days, when I'm in the app for less than 15 
minutes, the app suddenly went gray screen saying there's a problem, and 
losing my work in progress with no saved draft in the process. This happens 
for more than 5 times, and reinstalling won't work. Please fix this, 
because I hate to do my work in a rush, in fear of more sudden stops and 
crashes. Especially on an app I knew could do better. Thank you."
3,"July 17, 2018"," When I use the sticker, its in good quality but as soon as I save it, it 
becomes blurred. Is this natural or is it a bug? I hope you can fix it if 
it is. I can provide an example of an edit that becomes blurred when I save 
it. Other than that, its a good editing app. Lots of functions also. I jus...Full ReviewWhen I use the sticker, its in good quality but as soon as I save it, it 
becomes blurred. Is this natural or is it a bug? I hope you can fix it if 
it is. I can provide an example of an edit that becomes blurred when I save 
it. Other than that, its a good editing app. Lots of functions also. I just 
hope you can fix the blurred saving image."
5,"July 9, 2018"," I love this app.. But now it doesn't work every time i use the app it says 
no internet connection.. Plz bring this app back.. It was best to edit my 
photos but it won't work.. Instead it says no internet.. And doesn't show 
any thing.."
1,"July 11, 2018"," The picture quality reduces greatly after editing the image. It can save 
only upto 8 megapixel pictures . Everytime the picture resolution has to be 
checked upon. The filters make the picture are blurry. The highest picture 
quality I can set is 8 Mega pixel."
5,"July 12, 2018"," It's a good thing, I'm a professional in photo and video editing. It really 
makes our life easier as we(professionals) did not need to put our photos 
on PC and use photoshop. Thanks to the maker of this app."
3,"July 17, 2018"," The best photo editing app out there,however, I rarely use it bc of the 
situation with pricing for AD'S $50 way out of line, I come back to ck 
price one time it was dramatically decreased, I have issues w/ that. Also, 
my email changed, so I lost almost everything I spent over 100.00 in extra 
a i...Full ReviewThe best photo editing app out there,however, I rarely use it bc of the 
situation with pricing for AD'S $50 way out of line, I come back to ck 
price one time it was dramatically decreased, I have issues w/ that. Also, 
my email changed, so I lost almost everything I spent over 100.00 in extra 
a insane. Sorry guys, but the charges, are not helping this great app, 
created wonderfully,once upon time"
2,"July 13, 2018"," It's too slow. It takes an unbelievable amount of time to just start the 
app. It gets stuck when I try to edit pictures or just to draw. Way too slow"
2,"July 17, 2018"," Dear PicsArt, In this version "" The Cut Portrait Automatically"""" Feature is 
Not working And doesn't Show the icon in My Android 5.1 (Lenevo Vibe k5) 
Plz Slove the bug..😇 Overall The apk is So laggyy in 2Gb Ram Mobile Make 
More Smoothly.... Hope you will slove my Problem iam waiting for your repl...Full ReviewDear PicsArt, In this version "" The Cut Portrait Automatically"""" Feature is 
Not working And doesn't Show the icon in My Android 5.1 (Lenevo Vibe k5) 
Plz Slove the bug..😇 Overall The apk is So laggyy in 2Gb Ram Mobile Make 
More Smoothly.... Hope you will slove my Problem iam waiting for your reply"
1,"July 10, 2018"," Amazing app IF IT WORKED. All day I've been trying to log in. I tried to 
make a new account sign in with Google and Facebook and it won't let me in. 
I'm so frustrated"
4,"July 17, 2018"," I love this app, I've had issues with updates in the past but they've 
always been resolved. My only issue with the app now is that you no longer 
offer the ability to purchase individual features without signing up for 
the subscription service. Please bring back the ability to purchase 
individual...Full ReviewI love this app, I've had issues with updates in the past but they've 
always been resolved. My only issue with the app now is that you no longer 
offer the ability to purchase individual features without signing up for 
the subscription service. Please bring back the ability to purchase 
individual features."
5,"July 11, 2018"," I love it! The only issue I have with the app is that the lens flares don't 
really work well. Like they don't load. Other than that everything else in 
this app is 10/10! Would totally recommend to a friend!"
3,"July 13, 2018"," By the way the app is good....lots of things to do.....but original quality 
and size picture gets reduce.... so I think not a perfect one.....but it 
isok enough to edit at different level"
5,"July 8, 2018"," You can do quite a bit with this app, very playful. I use it all the time 
to edit or create. I've always loved this app, one app I am not without. 
It's a shame that now they've changed it to pay monthly to get any new 
features. I feel like I have lost some of my purchases but can't exactly 
pin p...Full ReviewYou can do quite a bit with this app, very playful. I use it all the time 
to edit or create. I've always loved this app, one app I am not without. 
It's a shame that now they've changed it to pay monthly to get any new 
features. I feel like I have lost some of my purchases but can't exactly 
pin point what. They've changed the naming of the fonts which I find hard 
to locate what font I'm looking for and then get lost. I also have problems 
with some of my stickers, some stickers being white are not visible on the 
white background, I think it would have been a good idea for the background 
to change colour depending on the colour of the stickers to make them 
visible."
1,"July 11, 2018"," For such a big app is filled with horrible ads that make you never want to 
use the app ever again and the only way to remove them is a subscription 
instead of just a one off payment to remove the ads."
1,"July 15, 2018"," I've been using this app since 2015. And it was all free except for the 
stickers but now we need to pay to use the filters? And other stuff? ;-; 
sad I loved this app but now its not free anymore. Imma use something else 
until this gets better again."
1,"July 11, 2018"," Used to love this app but it has since been ruined. way too many adds, not 
user friendly."
1,"July 17, 2018"," It was a really good app initially but then u guys started introducing 
intrusive ads that block saving of the pic without buying ur items. Its no 
longer a free software. False advertising!"
1,"July 16, 2018"," It was great until you started forcing us to buy your filters. I 
refuse...at more than $40.00, I will just buy photoshop"
3,"July 9, 2018"," Was my favourite app, really good quality until it stopped letting me add 
stickers and just buffered. Uninstalled and reinstalled but it won't let me 
log in"
4,"July 12, 2018"," I really like the app, but ever since the last update, all names of the 
filters have been removed and changed to some weird codes. I do not know 
which is which, and I cannot find the same filters since I remembered them 
by name"
1,"July 8, 2018"," Too many ads! I don't like it I've been using picsart for year but now when 
i updated it. It became too much ads too much annoyed"
1,"July 14, 2018"," No flexibility. Have to use only pre installed edits, can't freely create 
your own. Useless."
2,"July 11, 2018"," Great app for customizing images. However recently over the last few hours 
I can't save anything. It just freezes my screen."
5,"July 13, 2018"," I LOVE IT! You can make boring and plain pics into amazing looking ones! It 
looks profesional without even trying 👌"
2,"July 13, 2018"," Have This App Before But Now Since I Downloaded It Doesn't Have The Good 
Quality Of Editing And When I Edited It Won't Let Me Send To My Gallery Or 
Close Out Of It!"
2,"July 14, 2018"," The app is good, but it crashes regularly. I can literally any other app 
and they will run just fine, but the moment I load Picsart and try to edit 
an image, all it does is freeze up amd continuously go back to the main 
menu."
2,"July 14, 2018"," I used to LOVE this app; I used it for years actually. Sadly though, lately 
the last couple weeks of using it, they won't let me edit any photos unless 
I pay them/give them my bank account info. Honestly, I never thought I'd be 
rating this app 2 stars. I am just disappointed that all they seem to...Full ReviewI used to LOVE this app; I used it for years actually. Sadly though, lately 
the last couple weeks of using it, they won't let me edit any photos unless 
I pay them/give them my bank account info. Honestly, I never thought I'd be 
rating this app 2 stars. I am just disappointed that all they seem to care 
about now is making money. This app WAS great before they pressured me for 
my bank account info. Guess it's time to uninstall & find a new photo 
editing app who won't switch up on me & will actually stay true. Pretty 
dang disappointed in PicsArt lately.... Goodbye PicsArt. 👋😔"
5,"July 12, 2018"," Hey PicsArt Team Thanks A Lot For Creations This Tipes Of App Like This 
Technology World...✔ I Use This App 2 Years My Friends also use this..This 
Is amazing Beautiful App To EdiT Pictures And It's cool and so easy..:-) 
That's The Best App Round The Worldwide To EdiT Pictures..:-)"
5,"July 12, 2018"," What have you done? Where are all the fx? Why fix something that is not 
broken? This has been my go to app for years but I can't work with this😭"
1,"July 14, 2018"," I think it is dumb due you having to pay for most of the equipment to edit 
a picture. So 0/10 i would not use again"
1,"July 11, 2018"," WARNING: DON'T PAY FOR PREMIUM FEATURES UNLESS YOU WANT MONEY STOLEN FROM 
YOUR BANK ACCOUNT Loved the app so signed up for the subscription to unlock 
premium features. PicsArt debited three times the subscription fee (a total 
of $30 in one day) from my account without authorisation and then locke...Full ReviewWARNING: DON'T PAY FOR PREMIUM FEATURES UNLESS YOU WANT MONEY STOLEN FROM 
YOUR BANK ACCOUNT Loved the app so signed up for the subscription to unlock 
premium features. PicsArt debited three times the subscription fee (a total 
of $30 in one day) from my account without authorisation and then locked 
the premium features so I couldn't access them. I sent all the proof they 
asked for, including Google Play payment confirmations and bank statements. 
They admitted their app was to blame but basically said ""Too bad, we won't 
unlock the premium features or give you a refund"" and have kept my money 
without even giving me access to the features."
3,"July 18, 2018"," Used to be very good!!! Not so good now. Keeps asking to subscribe and pay 
for things which before used to be free. Off to the next app"
1,"July 13, 2018"," Using this app more than four years but now a day's, there is a lot of Ads 
coming in this app and some time it's so annoying that I decided to 
uninstall it."
2,"July 16, 2018"," Sad, from free apps it become money sucker apps. Used it since long time 
ago, when updated it become ""pay to use this, pay to use that""."
4,"July 10, 2018"," Love the app and everything about it only thing I'm disappointed with is 
the price for gold Version and wondered if this would ever drop or where 
could I find a money off code"
5,"July 16, 2018"," It keeps crashing on my phone for no reason Update: I just needed to 
uninstall and reinstall"
3,"July 11, 2018"," Well, this app is pretty much what everyone expected but all these ads are 
getting way too much annoying and the problem is that the app lags a lot. 
It almost crashed my mobile phone while I was trying to draw. I will be 
waiting for improvements."
1,"July 13, 2018"," There's no way I'd ""subscribe"" to this service based on the trial. Hey, 
Marketing Department - If you want paying subscribers, please add a popup 
add for each second this app is used. Yeah - that's how to make money. 
PicsArt's business acumen has deteriorated to the green-screen era. 
However, th...Full ReviewThere's no way I'd ""subscribe"" to this service based on the trial. Hey, 
Marketing Department - If you want paying subscribers, please add a popup 
add for each second this app is used. Yeah - that's how to make money. 
PicsArt's business acumen has deteriorated to the green-screen era. 
However, that version would be better since it would lack the million 
popups and hours wasted to complete an action. No one from this company has 
EVER refunded the $5.99 I shelled out for an ad-free app. This is the very 
least you could do to remain an HONEST merchant. If anyone knows of the 
next best simple photo-editing app, drop me a line. This one's extinct."
1,"July 16, 2018"," Pic cut feature is not properly cut down photo. Please fix it. And photos 
quality doesn't well."
