5,"September 8, 2015",Get this app It is soo cool no ads and it look like it reall I can fake like on a. Phone call to get my stuff out of things
1,"January 5, 2015",I know what to say here but... How this one million people use this thing that you can't even answer to fake call when it's freeze n stuck???))).. Funny people playing tech guru's on with Google :) I deleted this n all many other apps from new born Clowns who like to be rich n famous in Clowndale)))))... Good luck to new down loa...Full ReviewHow this one million people use this thing that you can't even answer to fake call when it's freeze n stuck???))).. Funny people playing tech guru's on with Google :) I deleted this n all many other apps from new born Clowns who like to be rich n famous in Clowndale)))))... Good luck to new down loaders!
3,"June 8, 2015","Not bad One thing I want to see fixed is the end call button actually functioning. If your ear accidentally touches the screen, the call automatically ends and you end up looking like an idiot."
1,"August 6, 2014",Complete b.s!!! Total waste of time.. donot work at all..dont knw y its rated 4 stars!!!
4,"February 10, 2016","Good app Work good, I like it. I only wish that once you press decline button it did show the fake call app."
5,"August 10, 2014",Glad I was stuck in a trap and needed a way out my brother recommend me to download this app and it helped me get away from the problem. Thanks for the app.
4,"January 18, 2015",Its Ok. Its very awesome because i tricked my brother 😂 but most of the time i keep having to change settings but other than that its good.
1,"April 20, 2015",voices come over speaker if in a paid version this would come out the ear piece then would give it 4 out of 5 but for now considering they don't even give you a limited number of tries with the ear piece option I have to put it at 3  edit  I must take my rating from 3 stars down to 1 as after the first time that it worked t...Full Reviewif in a paid version this would come out the ear piece then would give it 4 out of 5 but for now considering they don't even give you a limited number of tries with the ear piece option I have to put it at 3  edit  I must take my rating from 3 stars down to 1 as after the first time that it worked the last 5 times it hasn't
2,"January 9, 2015", Worked basically but could not shut off ring unless I hit the power button also couldn't turn off phone. Had to remove battery.
1,"June 4, 2016",Fake App Such a bad app I request you all please don't waste your MB for such a crap!!😠😠😠
1,"August 27, 2015","Doesn't work . No matter what time I schedule a call , always does the call 5 min. After I set it ."
2,"January 22, 2015","Glitchy Oversights make it kinda impractical.  Doesnt remember preferences so you have to set every little detail each time, which means ringtone selection which makes ringtone noise during setup.  Still the best fake caller ive tried so far but the compitition is awful.  anyway this is frustrating to use a...Full ReviewOversights make it kinda impractical.  Doesnt remember preferences so you have to set every little detail each time, which means ringtone selection which makes ringtone noise during setup.  Still the best fake caller ive tried so far but the compitition is awful.  anyway this is frustrating to use as a social bug-out because it cant be set up in realtime very well."
1,"August 24, 2017"," I wish I could have an option of rating the app with 0 stars. When we can't answer the call, what's the use of this app?!?! Google, please delete this app from the play store. Pissed off.😏😏"
3,"August 15, 2015", I would give it a higher rating if you did not have to set your setting each time you use it
1,"October 27, 2015",Rubbish Nothing beat the one my daughters father in law had and that got the people if I could get that one it will be thee only one
5,"December 23, 2015",I LOVE It Please add Samsung Galaxy Tab 3's calling screen soon. SM-T211
5,"July 28, 2014",Fake phone call Real good!!!
1,"October 25, 2014",Worst app ever This app doesn't even work. Every time I s3t a time for it to call I doesn't work
4,"April 28, 2015","Fun and useful,  but It would be better if you could upload a recording (such as an mp3 file) as well as record one."
3,"May 1, 2015",Its ok but..... They need to upgrade it cus wen yhu record its so soft and it turns off or dont  ring I wouldn't say its the best game yhu proly shouldn't waste yo time on this stupid game 😕😕😕
1,"November 16, 2014",A problem is that android on note four don't accept these applications Very disapointing
5,"October 10, 2014",Best prank ever I can fool anyondd any time
1,"May 24, 2015",😯 this app is for lonely people who can't get real people pr people without friends to call them
3,"August 28, 2014", I like it but I don't have a phone so it does not work on a tablet ! If l had a phone I would use all the time✳✴♥:-!
1,"September 7, 2014",doesnt work the install doesnt work it stopt with 82% so repair it
1,"August 9, 2014",Twon When It calls you nobody answererd
1,"August 21, 2014",Seriously Its a waste of wi fi nd fone memory
5,"October 26, 2014",Fake call Liked a lot
5,"June 27, 2015",It was awesome!!!!!! It can get you out of weird chats
1,"October 20, 2014",RUBBISH It dosnt work stop and dont donload it
5,"July 1, 2015",Its a fun at This ap is funn cuz u can prank people
1,"December 30, 2014","There others!! Like, PRANKDIAL #1 prank calling app!!😂📞lol"
5,"February 9, 2015",A some I can prank Andy one
3,"September 25, 2015",Dude I cant see that save button :(
5,"December 21, 2014",Love it So awesome cause i made a terrerist voice and scarred the poop of my little sis
5,"August 30, 2014",Awesome Fooled my annoying friends..grt app
4,"May 25, 2015", Its pretty good except for the fact that it adds your customed voices to your music playlist
5,"July 12, 2015",GREAT When I was with my friend we downloads this and when I walk by my brother we be act like we are talking to  someone on the phone
1,"May 24, 2015",App sucks I tried multiple times on a call none of them worked
1,"January 7, 2015",Doesn't work for me It didn't work
1,"August 9, 2014", Doesnt work
5,"January 2, 2015",Improvement We need full screen image of caller so update fast I'm waiting ..fast as u can
5,"August 28, 2014",Omg My daughter played a prank on me with this app a must app to get
2,"December 28, 2014",Stupid It don't work
5,"May 22, 2015",Awesome This app is fun I tricked my cousin and hew totally went out
5,"January 17, 2015",((Fake call Love it
3,"February 9, 2015","Almost Almost perfect, forgets settings when using widget. Widget takes up the slots."
5,"August 21, 2014",Farty I loved the Pete Kay fart one
1,"December 25, 2015", I don't understand it 😡
5,"January 25, 2015",LOL LOVE IT I FOLLED MY BROTHER IN CALLING 911
5,"January 29, 2016",Loved it My brother actually  fell for it
1,"February 16, 2015", People keep calling stupid
3,"September 14, 2015",IS OK But no one talks to you on the other end
4,"July 31, 2014",It takes to long to download But I like it tho
5,"July 14, 2015", Thos really works just you get called
4,"August 2, 2014",Good app I like it it was so fun
1,"August 4, 2014", Didnt work.
4,"October 8, 2015", WORKS GOOD ON MY SG5 PHONE. AND SEMPLE.  I ADDED POLICE SOUNDS APP.  FOR FUN. !!!.
5,"July 29, 2015",Best Prank In The World Talk about awesome pranks
4,"December 8, 2014",Cool Gets me out of trouble
5,"August 2, 2015",Cool I forgot I got the app and I got a call
5,"September 5, 2016","I like it Hey, it does what I want so I like it."
4,"November 24, 2014",Nice It was not that much of good
1,"July 28, 2014", Doesn't work.
5,"November 2, 2016", A cut above the rest l loved it its like a real call
1,"February 7, 2018", Very Bad app
5,"January 11, 2015",Omg app is so kool I'm kooljaythag on sound cloud Good
5,"August 29, 2014",Cool Its cool amazing i can fool anyone
5,"August 13, 2014",Unknown Works!
1,"January 23, 2015",Won't work Won't work
5,"July 7, 2015", Now dats a  app
1,"July 27, 2015",Sucked It won't work don't download this stupid app
5,"October 14, 2014", It works with a tsblet
5,"October 12, 2014", It was so funny
5,"October 8, 2015",Cool! I've had a blast fooling my friends!!!
5,"August 25, 2014",Best prank ever Love it love it love it love it love u should download it
1,"October 6, 2014",Hellp Its not werking or i do not understand the app
5,"October 25, 2014",Love So good got my friend real good
5,"August 5, 2014",I love it It so fun to use
3,"August 12, 2014", Some say 4 star some say 1
5,"August 14, 2014",Superb I like it its so gooooooood
5,"December 4, 2014",Awesome My momma thinks that I'm talking to someone!!!! Amazing!!!
1,"January 21, 2015", It did not like it and it's horrible
5,"September 16, 2014",Hhhhhhh Ohhhh
1,"March 13, 2015", It sucks
5,"May 20, 2017", Jitendra kumar
5,"August 6, 2014", Someone was telling a story for the 1000th time and I used it AWESOME APP!!!!!!
5,"January 7, 2015", This is so brilliant I love you
1,"November 18, 2014",Haaaa Kunna
1,"December 27, 2014", It suckes
1,"December 29, 2014", This  is Rubbish
1,"November 10, 2014", Not that great
3,"November 10, 2014", I can't awnser calls
4,"September 3, 2014", Nice app... U all should give it a try...
5,"September 21, 2014",Asia I love it a lot
5,"May 23, 2016",Loved it I love this app
3,"September 1, 2014",i like it but its i love it
1,"May 2, 2015",oh good for use sometimes
5,"May 3, 2015",Great Best app ever
5,"October 24, 2015",App Loved it awsome app
5,"April 14, 2015",Yes Not boring
1,"June 17, 2017", Sucks
1,"April 7, 2015", Sucks
5,"July 30, 2014", Exsalent
1,"September 15, 2015", SUCKS
5,"January 22, 2017", It's wonderful
1,"August 17, 2014",Sucks Sucks
5,"September 9, 2014",Ummmwh Goood
1,"August 12, 2014", I love it
1,"August 17, 2014", Dosent work
5,"August 28, 2014", Love it love it
5,"December 29, 2014",Yess Love it
1,"February 15, 2015", Stupid
1,"October 14, 2014", Terrible
5,"August 30, 2014",good very good
5,"September 14, 2014",4.5 Good
1,"November 22, 2015",Galaxy s6 edge: %#$%# This app is @#%&##&$+#-$-$-@-$-%-
5,"June 30, 2015", Cool
5,"August 30, 2014", Love it
5,"August 11, 2014", Love it
3,"October 28, 2014", Cool
5,"March 15, 2015", Awesome
5,"July 25, 2015", Awsome
5,"June 26, 2014",I loved it! This app may SEEM like it's useless... butttt it's actually really helpful to get out of any awkward situation.
5,"April 2, 2014","It works grat on my huawei p6 I tried several similar apps, but none of them was working properly, I couldnt answer my fake calls. This one works great for me."
5,"January 29, 2014","Best prank ever My friend new I dident have a phone I set it to a time and I was on the bed and my tabblet rang I said ""wait a minute I just have to find what were ringing""she was puzzled and pale it was sutch a good prank so not getting rid of it please have XXX"
5,"June 16, 2014","I love it I love it cause when you fake a call people would think its real,but it isn't. I will annoy my parents hahahaha so cool... so I really love it"
5,"July 26, 2014","Awesome Holy crap was so funny so I did this as a try then I gave it to my sis she answer and said hello three times then she end it and I said ""you just got pranked"" and that was so funny I laughed more than I laughed before omg you need to daload this app its awesome and I rate this 55555555 awesome creat...Full ReviewHoly crap was so funny so I did this as a try then I gave it to my sis she answer and said hello three times then she end it and I said ""you just got pranked"" and that was so funny I laughed more than I laughed before omg you need to daload this app its awesome and I rate this 55555555 awesome creative stars great job"
5,"March 8, 2014",Awesome I used it to prank my friend and she actually thought Zayn Malik from One Direction was calling her!
5,"April 13, 2014",Real good If it did not download on your phone that mean u have a slow phone come on people get a life
5,"July 9, 2014",Fake a call free It's so awsome love it soooooo much try it it's better than any other games
1,"May 13, 2014",Fake Call This app sucks doesn't even send a call.  I set it and it didn't work
1,"March 12, 2014",Soo useless I am trying to download it frm padt few hrs but itz always downloading.... Arghh..
1,"February 2, 2014",It sucks It took an whole day to download then it don't work that's some real bull
1,"May 3, 2014", Tried ti give it a zero but ! Awful app dont work
5,"July 6, 2014",AWESOME!! This app is the best for excuses. I did it to a lot of my friends and they totally fell for it. Love it!
5,"July 18, 2014",Excellent I needed a away to check my ring volume and connectivity because I missed an urgent call.  This is the only app available to do this. Thanks.
5,"July 3, 2014",point to be note unbeatable if default caller screen ( provided by manufacturer) will appear while receiving fake call .
5,"July 26, 2014",AWSSOME I got out of the most awkward situation lol
1,"January 29, 2014",Here's my summary It sucks not even my stupid 2 year old brother figured it out
4,"February 28, 2014",Nice app This is more halp app bt that is more help if u call pick up layout will work nlt work like realy.or its a awesome app
3,"July 2, 2014", Another call can come in while fake call active
1,"March 17, 2014",Horrible I hate it  it Cray Cray and I'm only 10
1,"July 22, 2014",Bad app :( I downloaded this app thinking dat it wud b cool but it was not cool at all it was the opposite...
1,"March 21, 2014",I don't like it It doesn't work
2,"January 26, 2014", Could be more best if the prank call could make some prank speaking  thing
5,"March 12, 2014",Ttt Yay this is fun I get plenty of people on April fools day every body should get it
5,"January 15, 2014",Great I love this app is so funny cool
5,"July 26, 2014",Fake! This app is fake.... Ha!
5,"January 18, 2014",Cool So i can trick my Mom ! hahaha LoL
5,"February 3, 2014",Leading boy I don't know....
4,"July 5, 2014", This better be good cuz if not i will give it a bad review
5,"May 25, 2014",Love it I just love prank calling people that I don't know
5,"July 1, 2014",Awesome This game is awesome I loved it it's so awesome I loved it it's awesome I LOVED IT HAHAHA but I do like it~It's awesome
5,"July 20, 2014",Prank call It is so cool get it
5,"January 7, 2014",Ohh Gr8  It amazing so we can fool people
5,"March 12, 2014",Vari nise The apps is a vari nise. Ja rama ja rama
5,"March 27, 2014",Best Best to prank or to annoy anyone haha between excellent app
2,"March 17, 2014",How it is This app help me prank  people but this is a nice app
1,"June 15, 2014", It made my tablet hang so boo
5,"April 22, 2014",WOW I played lots of tricks on my friends
5,"January 9, 2014",Love this I luv this app so much
1,"June 28, 2014",Love it!!!♡ It really cool... when I call my friends their like wtf is this lol
5,"March 2, 2014",I don't no what to say I wanna pack someone
5,"June 14, 2014",Loved. Best fake call app out there!
3,"July 2, 2014",Its ok Take to long to download
1,"April 23, 2014",Awesome Blah blah blah blah people
5,"January 14, 2014",Good Saved me from bad
5,"April 19, 2014",Jgkcjflgmuvhvv Love this app it rocks good ways to get out of school
5,"July 6, 2014",WORKS!!!!!! My friends fall 4 it haa
2,"May 9, 2014",grrrrr its not downloadin
1,"July 8, 2014", I hate this app
3,"June 2, 2014",Shadab Good but not best
4,"January 7, 2014", So good app. Like it
5,"March 29, 2014",I get to talk to others I get to talk to others
5,"January 31, 2014",it works it works right when you want it to
5,"July 1, 2014",cool apps guyes try this app to save frm pakkau people
4,"March 21, 2014",During fun pranks good It's fun and okay it could be better
5,"June 3, 2014",Excellent The best fake caller
5,"June 4, 2014", Awsome I prank my dad
5,"April 13, 2014",Heheh Funny app love it
1,"February 16, 2014",I hope this is good Wow this looks like a cool app
5,"July 26, 2014", It so fun to trick my friends and family with this app
5,"July 21, 2014", Amazimg app love it to cool I love to prank people
1,"May 26, 2014", Nobody said anything
5,"June 24, 2014", It really works
5,"April 19, 2014",#great I love this app its soooo fun.
3,"July 3, 2014",Ask... I lke des app
4,"June 7, 2014",So so good This is the best game ever
5,"February 15, 2014",Exceptional Perfect prank call app
5,"April 8, 2014",Samsung Note 3 What a great app.
4,"July 15, 2014",Thanks developers I really like this app
1,"May 25, 2014",Downloaded but Not installing it is stuck on 100
5,"July 25, 2014",Awesome This is the best app ever
5,"April 1, 2014", Hahaha ayos to ah haha nice app :-)
5,"June 23, 2014", The most fun game ever
5,"March 3, 2014",This is so funny It is cool
4,"June 12, 2014",Thanks For it
5,"July 8, 2014", like nothing
5,"March 16, 2014",He Super
5,"April 4, 2014",Omg Lol
5,"January 20, 2014",Ooyai Gud
5,"January 28, 2014",Yesssss This is a Godsend....thanks guys!
1,"April 27, 2014", Not good
5,"May 9, 2014",Nigga Nigga please
5,"April 27, 2014",Just to rate This is the best
5,"July 13, 2014", Is this actually a good app
4,"February 5, 2014",above average no coment
5,"January 12, 2014",Great I love this app
5,"January 24, 2014",Excellent I love it
5,"February 1, 2014",Owning This is cool
5,"January 30, 2014",App Good app
1,"February 8, 2014",Ha Soooo cool
5,"March 24, 2014",Excellent Thank you
5,"April 19, 2014", Good if i was gay
5,"June 10, 2014",Loved it Love this game
5,"February 4, 2014",Exelent Good apps
5,"May 7, 2014", Joyfrancy
1,"April 27, 2014", Forest
1,"April 9, 2014", Such
5,"March 29, 2014", Tjx
5,"June 16, 2014", Epic
2,"April 28, 2014", Ok
5,"June 27, 2014", Hellow
5,"January 27, 2014", Cooling
4,"January 18, 2014", is God's work
5,"March 2, 2014",Ok Ok
5,"July 26, 2014", I loved it 😘😘
5,"June 18, 2014", So cool
5,"February 3, 2014",Jd Cool
5,"June 26, 2014", Just love it
5,"March 18, 2014",Hih Cool
5,"January 23, 2014",Love Omg
5,"July 22, 2014",Good Coool
5,"February 5, 2014",Good Funny
3,"April 1, 2014", Its cool
5,"July 6, 2014",Love it Ganda
5,"March 30, 2014",Amazing Download
1,"April 18, 2014", Useless
5,"July 18, 2014", Wonderful
5,"July 17, 2014", Nice
5,"March 28, 2014", Best
4,"July 26, 2014", Good
5,"July 20, 2014", Love it
4,"June 12, 2014", Excellent
5,"April 12, 2014", Love it
3,"May 18, 2014", nice
3,"July 23, 2014", Cool
4,"June 16, 2014",Great Great
5,"May 22, 2014",Awesome 
5,"February 22, 2014",Female voice?? 
5,"March 11, 2014",Fake hhhhh 
5,"March 13, 2014",Cool 
4,"March 30, 2018", Can you improve this app from closing I love this app but it keeps stopping thanks
5,"January 4, 2014", Fool my friends every time
1,"January 5, 2014",Game sounds good from what I read Rate more stars or keep same when I try it out
3,"January 4, 2014",The app is good It's alright
3,"January 1, 2014",? Idk
5,"January 6, 2014",Awsome I love it
5,"January 5, 2014",Best Love it
5,"December 30, 2013",Does what It's supposed to do. Thanks for putting android 4.0 call screen.. looks like a legit call now.
4,"December 30, 2013",Cool Very good to get u out of tricky situations
1,"December 30, 2013",I love it because This is cool because you can really prank or trick people
5,"December 30, 2013",Life saver Got me out of a lecture by my mother!
5,"December 30, 2013", Great app and really funny
5,"December 30, 2013", Good
4,"September 7, 2012",Got me out of a tricky situation The only issue is that it uses the media audio output and not the ringer volume. But it did save my life last night!!
4,"February 12, 2013","Keeps closing... I loved this App until I received the ""Unfortunately, FaC Free has stopped working"" message. I loved this App so much and now I can't even open it. Please fix this problem, I've even tried uninstalling and it still does not work! This is disappointing. Otherwise, the App is fine but it doesn't matte...Full ReviewI loved this App until I received the ""Unfortunately, FaC Free has stopped working"" message. I loved this App so much and now I can't even open it. Please fix this problem, I've even tried uninstalling and it still does not work! This is disappointing. Otherwise, the App is fine but it doesn't matter because I can't even open it up."
2,"May 10, 2013",Would be better if... I think that it would be better if it made the screen go dark like my phone does on a real call. The iPhone app does it so I don't understand why the android app doesn't do it
1,"April 1, 2013",Virus! This app may seem cool but it crashed my phone! i had to do a factory reset! i now have anti virus siftware and it said it was a threat. also doesnt work as it says it does i rate zero stars very unimpressed!
1,"February 17, 2013",Crashes It crashes every time a call is expected. I'm going to have to delete it.
5,"December 1, 2012",Love ALL of the Fake-A(n)-         apps These apps rock! Keep up the good work! Oh and lol on fake-a-text it said F-A-T Free. Too funny.
4,"September 22, 2012",Roflmao!! The only problem with this is that I CANNOT stop laughing when I use this app! :D good job ppl
1,"August 9, 2013",VIRUS I swear I have an anti virus app and it alearted me straight away just telling you.
4,"October 11, 2012", Its great but you can only fake a call straight away. There should be a timer on it so it looks really realistic
1,"December 31, 2012",Rubish Kept saying unfortunelly fake a phone call has stopped working unistall defo  Ps dads account im a 15 year old girl
1,"August 9, 2013",The worst Couldn't be worse. Keeps shutting down when I press fake a call
1,"November 6, 2012",Dont work I downloaded this app it forecloses alot and it didnt even work on my samsung android phone smh this app deserves no stars
1,"February 24, 2013",Its horrible It keeps crashing and freezing 20 minutes I'll never get back in my life don't install uninstalling
1,"September 2, 2013",Rubbish A silly rubbish app whenever I try a fake call it goes onto the home screen and says fake call has stopped
5,"December 25, 2013", Soooooo cool n it saved me from this mean as girl she thinks that I'm her friend but I'm not n 1 day she asked can I come over n play and I said let me check with my mom n I used this n after the fake calling I said sorry u can't comae 2 my house n she accually fell 4 it!!!!!!!!!!!
4,"October 24, 2012",Awful date awesome app Great app! Got me out of a awful first date!
5,"October 12, 2012",Lolz You shoild make it so that we when were calling that we record we make the person say yes and we get to do anything we want
1,"December 27, 2013",Force closes Force closes every minute or two. Sometimes scheduled calls don't ring (screen prompt only)
1,"May 26, 2013",Bad app. Ever It says only stoppoed unexpectedly stop working kaasar don't dwnld it
1,"August 31, 2012",bad update After updating it is not working on my device. Everytime it show force to close
1,"February 4, 2013","Baaad Every time  schedule a fake call,it says 'unfouratluly FcD is not working,fix"
1,"March 26, 2013",Lame This app is so lame i don't even like it
1,"December 19, 2012",Does not work Samsung galaxy pro Gt-b7510
1,"March 18, 2013",Crashed This app kept crashing. I didn't get to use it once. Uninstalled unfortunately.
5,"August 31, 2012",Excellent Very very nice i even fool my friends i just cant stop laughing until now pls. Upgrade it put a voice changer thank you :)
1,"March 11, 2013",Dont know Horrible keot ssying unfortunately what ever this app is called has stopped working every time I went into the app
1,"July 29, 2013",Almost worthless Can not schedule a call. Full of ads. Fc alot. Ugly. Will look for another...
4,"December 25, 2013",I thought you were a little bit off It's kinda boring
1,"December 22, 2013",Worst Best of all I hate this so much dont get it
1,"July 30, 2013",Ok I had some problems it keep closing can some one help
1,"June 14, 2013",Useless All it ever does is crash crash crash. The developer should be disappointed in themselves
1,"March 16, 2013",Zero stars I have a Droid 4 and it doesn't work.  No sound.
1,"October 19, 2013",Downloads slowly and i juat gt my.phone dumb app Stupid thing Dang its boring
1,"December 13, 2013",I hate it When i get through with all the stuff it closes unexpectedly
1,"September 1, 2013",Watch out ADWARE THIS CAN U LOCATE YOUR LOCATION
5,"March 10, 2013",Hilarious Great for playing tricks on your friends! Looks just like a real call and uses your ringtone! Endless fun!
5,"August 24, 2013",Great app! Funny when in awkward situations.
5,"October 27, 2012",Nikky:)♥ I love this app I pretend I call the police and my little brother got scare
5,"April 20, 2013",Lol Love this ppl think I'm really someones calling me
1,"July 12, 2013",So stupid Don't get this app!! Its so slow!! Too many ads
2,"August 3, 2013",Bad I need to change my voice while calling
5,"September 19, 2013",Coool;-) It's a nice app because whenever someone make popcorn of my mind i just use this app to have a excuse...........So i will say it's a tricky app
3,"September 13, 2012",Nice app! Does what it says but 5 stars only if moveable to SD card.
5,"May 31, 2013",Excellent Easy to fool people! App works so good.Just nedds a few more graphics.
3,"September 4, 2012",Its average Ok i guess i prank my dad.
1,"February 11, 2013",Hate Worst app ever I hate it
1,"December 3, 2012",Game This game is horrible it keeps telling it stopped
5,"October 27, 2013",Great app It's a great app because if my mom talkin about something boring I can get away with it
2,"September 13, 2013",Bad It doesnt ring when the screen is locked!!
5,"October 13, 2012",Helpful App Its a great app. U can get out of anything!
