5,"February 1, 2011", All i hav to say is hahahahahahaha
1,"December 14, 2010", Force closes on xperia x10.
2,"January 10, 2011", No sd card installation.
0,"December 29, 2010", How do you uninstall
1,"February 26, 2011", You cant fake the number your calling from so whats the point
3,"September 5, 2010", Good app....needs to be able to have contact pic ...but still good
1,"October 20, 2010", Force closes!
1,"October 12, 2010", Wouldn't work
5,"June 11, 2011"," Cool, the best fake call in the market"
2,"September 24, 2010", concept is great but it doesn't work properly...moto droid
3,"August 31, 2011", Fake call me is better :)
5,"February 7, 2011", This app is awesome im am so going to use it
3,"February 18, 2011", Not too shabby
1,"September 11, 2011", I wouldnt recamend
1,"April 19, 2011", Put on SD card
4,"September 2, 2010"," I like it, it is very usefull. Works always. HTClegend"
4,"April 17, 2011", Could be better if it looked identical to a real call
3,"April 17, 2011", Nice but more improvement should be there. Thanks.
0,"January 10, 2011", This is great especially since it has a voice.
5,"November 28, 2010", Does what it says
5,"August 8, 2010", Its good but takez to much space
4,"June 30, 2011", It needs to have more voice recordings
3,"December 8, 2010", It needs more options but is fun
5,"September 17, 2010", Very handy at times. Great idea!
5,"April 21, 2011", 10/10
5,"August 28, 2011", really it works. . .
3,"November 21, 2010", The callers speak too fast.
5,"December 27, 2010", Class app best out there
1,"April 12, 2011", Its sucks
1,"November 14, 2010", It sucks
1,"January 19, 2011", Sucks forecloses
4,"August 31, 2010", Works like a charm....and its free!
5,"February 28, 2011", So far so good
5,"April 14, 2011", Works just fine on DROID
5,"August 28, 2011",Effin cool highly recommend it
3,"May 9, 2011", Ok.
1,"July 26, 2011", BOOOOO :((
5,"July 25, 2011", This app is awesome
5,"February 4, 2011", Cool 5stars
1,"June 26, 2011", Sucks
5,"May 22, 2011", Love it!
4,"January 3, 2011", Fun
4,"March 17, 2011", ;-)
4,"September 30, 2011", VERY USEFUL
5,"August 31, 2011", Very good
5,"July 3, 2011", Just awesome
1,"March 11, 2011", Dumb
5,"October 30, 2010", Sick
5,"April 9, 2011", Awesome
4,"March 13, 2011", Great
4,"August 2, 2011", Good
5,"February 8, 2011", Nice
5,"September 23, 2010", Awesome
5,"August 21, 2010", Brilliant
5,"August 9, 2010", Awesome
3,"March 28, 2011", Awsome
4,"February 15, 2011", Cool
5,"February 12, 2010", Absolutly brilliant. For years ive had to get friends to fake call me to get out of situations that suk. Now i do it myself. Thanks fake a call! G1
4,"November 2, 2010"," Hilarious. No problems yet but tricky interface.Lemme guess, ladies ""its my girlfriend-needs to talk. She just broke up with h3r bf. Sorry gotta go!"""
5,"February 11, 2010"," Easy to get away from boring coworkers or friends! Had my wife record a message, seems like she's yelling, works everytime!!!"
1,"March 16, 2010", Stupid waist of a download. Nothing like the HTC
3,"May 17, 2010", Cool app. Use it to make my wife jealous with all the fake chics calls!
5,"February 3, 2010", Omg this app is amazing! It saved me from the most awkward situation ever!!(:
5,"February 14, 2010", okay seriously this is a LIFESAVER in those uber-awkward moments! This is genius!
5,"February 7, 2010", This does not only get u out from a crappy reunion/meeting etc but its also useful to scare the crap out of people when recording voice &calling lol
4,"July 2, 2010", Siiiick. The voice option doesnt work too well though.-HTC Evo
5,"April 18, 2010"," When I get paid, I'm going to buy the full version, just to donate, this app is siiiick. It gets you out of alot of awkward situations."
3,"July 8, 2010"," It works ok, but the ring doesn't stop immediately upon pickup, and screen format is off for HTC magic."
5,"July 20, 2010", This app owns i just realized i can fake a voice....would pwn more if how you answer the phone looked more believable...believeable
5,"March 28, 2010", Stupidd but so worth it in d city wen pervs try talkin 2 u!
5,"February 1, 2010"," its hella good but wen i want people 2 hear the recorded voice it wont let me put it on speaker, cuz wen i press speaker the call just ends =("
5,"February 8, 2010", Great way to get away from unwanted situations. No more having to tell my friend to call me. LOL
2,"March 4, 2010", Didn't work on Motorola Droid. Incoming call screen looked fake
1,"March 9, 2010"," Looks different on the Cliq, different from normal calls. Could use image as well for the call, but it doesnt"
2,"April 25, 2010", Doesn't really work on HTC desire. The interface is completely different and doesn't have pick up or decline button.
1,"August 6, 2010", Its not all that gr8 the music kept playing when i answe the phone
3,"May 22, 2010", Would be better if the setup menu didn't come on screen once you answer the phone as it was a big give away.
1,"June 29, 2010", Stupid! Does even come up looking like the regular one! Unistalled! On moto droid!
5,"August 8, 2010", Helps me prank a lot. Of my family
3,"May 20, 2010", Scheduler does not work when phone is in 24hr mode
3,"July 18, 2010", Its okay i guess. A cool idea but when you look @ the screen kinda obvious its fake.
1,"March 10, 2010", Looks fake. Uninstalled! Motorola Droid
3,"April 24, 2010", It calls you way too early
5,"June 5, 2010", Works fantastic on Motorola Droid. Its nice way to leave a situation!
1,"July 16, 2010", VIRUS. My phone default settings changed immediately after installation. Still can't restore original settings. DO NOT INSTALL
3,"June 14, 2010", Works good but for some reason it kept playing my ringtone even when i stopped and closed it...had to uninstall
3,"April 4, 2010", Useful and works on nexus one. But the prerecorded voice continues talking until it ends or until u end it with task killer
1,"March 15, 2010", on droid fake call is incoming!
1,"February 21, 2010", I think its stupid.
5,"February 7, 2010"," Very fun and useful app to get out from an wanted situations, thx alot"
1,"April 2, 2010", It does not work
1,"February 18, 2010", Does not work on droid
5,"February 13, 2010", Good app and funny too. I already tried it out and it really does its job :)
5,"June 20, 2010", This is so cool. MUST HAVE for sure!!!! There will be times that you'll need this app. Trust me.
1,"February 20, 2010", This app would ring twice got me busted
5,"February 9, 2010", Should add barack obama voice summoning to the white house
1,"June 24, 2010", Forces close every time I answer . HTC desire
5,"June 13, 2010", Got me out of hanging with my sister at the mall
3,"May 19, 2010"," Would be nice if it matched htc sense ui, other than that pretty good"
1,"February 17, 2010", I cant open or uninstall...fix it. It worked great when it wasnt acting up
5,"February 18, 2010", Great for avoiding annoying people.
5,"May 3, 2010", Huge memory but WORTH IT
1,"April 1, 2010", Doesn't work.
5,"July 11, 2010", Must have for any single person who is dating!!!!!!
5,"March 23, 2010", Great. For other people to change call screen press the following. More settings>call screen 1.5/1.6/2.0/2.01.
5,"February 19, 2010", AWKWARD MOMENT SAVER
1,"April 3, 2010", Smh who made disz lol
5,"February 9, 2010", This one does what it says its supposed to. Lots of fun ahaha
4,"March 2, 2010", It would be cool if It got the ability to add contact pictures.
5,"May 12, 2010", I love this thing its so cool
5,"May 26, 2010", ...for those awkward moments...
5,"March 31, 2010", Lol really works . Droid eris_*.
5,"March 14, 2010", Good when u dont want to talk to some1
3,"April 23, 2010", Needs Sense lookalike.
5,"March 26, 2010"," Great app !!!!! Goood for getting away from people,when u need to,on my G1"
4,"April 7, 2010", This is soo fun i like it alot
1,"May 26, 2010", Doesn't work on Android 2.1 -HTC Incredible. Uninstalled.
5,"April 22, 2010", I love this app afta all da changes...
5,"July 12, 2010", Luv it...works good on da HTC hero !
4,"May 31, 2010"," Doez as it sayz, itz pretty kool"
5,"February 3, 2010", I love it works good with Droid
2,"March 3, 2010", Just ok
5,"March 6, 2010", Its asome
4,"July 28, 2010", Its ok
5,"March 13, 2010", This is really cool. And useful:)
3,"March 30, 2010", Looks fake
5,"February 15, 2010", Works nice with HTC tattoo
3,"September 1, 2010", Not bad at all !
5,"July 12, 2010", OMG!!! NEATEST IDEA EVER...LOL
5,"June 11, 2010", Awsome . Best Eva. Lol
5,"February 2, 2010", Its a cool app
5,"February 22, 2010", Excellent on Motor Droid
4,"February 5, 2010", Its ok....
5,"March 13, 2010"," Great, I love it...!"
1,"February 26, 2010", Ads
5,"February 27, 2010", Works
4,"February 15, 2010", Very cool.
5,"February 10, 2010", Perfect..Droid
5,"April 17, 2010", I love it
5,"February 3, 2010", Very clever
5,"February 4, 2010", Soo cool
4,"March 15, 2010", Koo... Not bad...
5,"February 11, 2010", Awsome
5,"August 6, 2010", Sweet
5,"May 15, 2010", Cool
4,"April 3, 2010", Kool
3,"February 3, 2010", Gr8
5,"January 31, 2010", great app! useful on those boring situations! lol. even makes a bf jealous. fun! :) but I wish it doesn't take up that much of space. :(
5,"October 17, 2010", This comes in very handy when i need an excuse. I love being able to set the name of caller and time of call. Great app to have.
4,"January 31, 2010", So it takes up only 4.3 MB of memory... why is everyone complaining it's a great app and the memory it takes up isn't even that much...
4,"January 31, 2010", Nice. Pretty good for getting out of a boring situation.
2,"January 31, 2010", It takes 4.3MB of memory! WOW! Uninstalled.
5,"January 31, 2010", Great app and very useful. Works great on Droid.
5,"February 1, 2010", Great but canu say what the updates are.
5,"February 1, 2010", The app. is good like
1,"August 8, 2014",Stupid Its a silly app. Instead of pranking someone else you call your self I recommend not to download this app
3,"January 19, 2010", *moto droid* looks really fake. Can get away with it when no one knows what real calls look like on ur phone plz fix that! But pretty convincing.
4,"April 9, 2009", Im not payin 99cents 2schedule my fake calls. my cuz is my fake caller when im on lousy dates. but this is handy 4when she isnt available lmao
5,"March 20, 2009", Change the icon so people dont know what were doing. That way we can keep it on the screen w/o burning it lol
2,"September 3, 2012",Get it frm htc The htc wildfire s hav d bst call faker ever made.... Its d most simple n awesome.... Try to match it up wit dem...
5,"May 17, 2013",Great This app is so awesome. It makes fake calls to play pranks on my friends. I don't see why many people wrote bad reviews.
1,"May 13, 2009", Why would you look cool by getting a call from obama? LAME. I would look stupid for trying to pretend... uninstall cause of that! :D
1,"July 24, 2014", Wast of your and your friends time boring. Dont download this game it's a bunch of rubish
4,"May 13, 2009"," Great app. One-touch option would be nice, making a call without looking. Suddenly get a phone call, and it look very natural. Add botton to dial scrn"
1,"August 13, 2014",FAAAQIN BS RUBBISH APP. Calls don't come as normal call screen. Doesn't even have option for that. Calls don't show up on call log
1,"August 18, 2014","Ools All of hated stars are true, so this app doesn't work! Work yourselves!"
5,"December 24, 2009", Love this! Made my bf mad w hen he thought another man was calling me ..lmao now he's acting right ;)
1,"February 3, 2013","Won't stay on. Every time I try to use this app, it always stops on me! People say it is so good, but mine sucked!"
1,"April 5, 2009", Free version only allows immediate call back.  Therefore useless.
1,"May 1, 2012",STUPID This is the stupidest prank call app I have ever downloaded. Made the call at 6:33 so it would ring at 6:34 waited and waited and wouldn't. Ring had to open app up and clock the start prank call button for it to work. UNINSTALLED
3,"December 6, 2013",ok ok its not bad. I am getting some problems because of this app.
5,"December 24, 2009"," 3 crucial situations gotten out of. Excellent excuse when your mom calls needing u 2 ""come immediately"" I'd give 6 stars if I could"
5,"November 24, 2009", Saved me and my wife from unwanted house guest. 5 stars.
5,"March 20, 2014",Thanks! I was able to get out of school twice this week using this app! But you also need to be a good liar Lol make sure you got your story planed out well xD
1,"December 27, 2013",Not good I woukd rate this app 0 if I could. You cant use it on bloody androids
5,"April 15, 2009", Nice!! I love it!! My friend freaked out cuz i called from his number over and over again and he called the cops for identity theft... LOL
2,"April 15, 2009", This is a cool app. The only problem is the ringtones play so low you can hardly hear it ring. And you cant set the time that it calls you.
1,"January 12, 2013",app work bt fake call not work in ics 4 fake call process activated bt when call in progress another incoming call does not show in waiting and it ringing start during fake call process.. plz fix this issue...
5,"May 17, 2009", Great app! Has gotten me out of uncomfortable situations
3,"April 10, 2009", Call Faker lets you set the time when you want that person to call. Its so much better and seems alot more real.
1,"April 20, 2010"," Enable it so we can insert a photo as before, and I will reinstall it and recommend it to everyone. Without the photo it is drab and useless."
5,"January 29, 2010", Works great. Can't wait til I need to use it to get bailed out of a situation. (MyTouch 1.6)
3,"May 22, 2009"," There isnt a proper way to end the ""phone call"" or to close the app. Kinda neat."
5,"May 16, 2015", This was so helpful. I told my sister about pranking my friends but my sister herself and my friends been fooled with this.
5,"March 25, 2009", This will get me out of a sticky situation one day... i can feel it.
3,"February 18, 2013",Fake a call I'm gonna try it but ikow what really works is fake a text too!
5,"November 16, 2009"," Maybe Just Put A Widget On The Front So People Cant See You Go Onto The Actuall App.. But Dont Make The App Obvious That Its A ""Fake Call"".. Thankss."
5,"March 27, 2009", Got into big problems with wife but it definetly wrks gud n does wat it says but will get u in a hell of trouble wit the wife or girl lmao
1,"December 26, 2013","Poor. Dont get it I hate it. It is so stuipid it wont work on my phone, it always says "" i'm sorry but this application wont work with this divace"" so bad app dont get"
1,"May 8, 2009"," Theres another free app calles Fake Caller, lets you set up scheduled times and it shows up as""call list"" under your app list. Dl that"
1,"July 27, 2014",Annoying I made a scheduled phone call now every night it wakes me up because it wont stop ringing. I deleted the app and everything but it wont stop! thankyou! -.-
5,"February 22, 2015",lol now thats something i would do but the only way i would is fake an im sick thing at school. i dont think i need it that much
5,"January 12, 2010", This app have my back i am a sailor and when i need 2 get out of somewere cuz is boaring i have my ship calling me lol!
1,"May 31, 2013",Rubbish time wasting Dnt install pop up ads and i ad an error 5 times hence why the app is free not worth it
5,"May 4, 2013",Funny biz This is so funny cause when I tricked my father that it was his mother I gave him the phone he thought his mother was really on the phone
1,"January 4, 2015","It corrupted my phone application After installing this, my phone app was corrupted. I was not able to make calls neither able to receive one. Had to repair it."
1,"May 10, 2014",Stupid I my god I answered but I herd nothing this is an annoying app I'm telling u don't download . its not worth it 😠
1,"November 29, 2013",It does let me make any calls Everytime I try to make  a call it goes black and says its not working
5,"January 5, 2013",Hahaha This is so funny. I pranked my cousins then they thought it was real and I only L.O.Ling my head off!
1,"September 21, 2013",Adware!!! This is adware! They can track ur home down so dont download this! And it is a virus
5,"December 28, 2012",Funny Me and my mate made a fake call prank on my other freind. We pretended it was justin b.  Oh the LOLZ
4,"March 14, 2012",Aweessoommee I wonder if I can make my sis believe Taylor Swift is calling? Loll. I love Taylor.
3,"January 12, 2010", Had 1 issue-call came in 6 minutes later than what I scheduled. Had to hear blah blah longer than expected..
5,"May 6, 2009"," This should be called ""Save-you-from-an-awkward-moment-call"" Awesome! Thanx! (Go away creepy guys!)"
1,"March 25, 2012",Didn't work You set the time for it to call but instead of calling an add comes up. Don't waist your time
5,"October 11, 2009", I think this is great it rings the whole time for me and its great when you gotta get away just pic up act like ur talkin then b like i gotta go sorry
4,"August 28, 2009", My older brother actually beleved that miley cyrus called him back ..wat an idiot.......it gets boring after a long while
1,"June 23, 2009"," If ur on a ""Fake Call"" ur phone will ring if u get a REAL CALL! Needs 2 be fixed."
2,"June 20, 2014",I hated it This app is cool 😎 but when it calls 📞 it doesn't talk!!!
5,"May 19, 2013",State farm Would would you like to be part of the State Farm ovation Center because we would love to have you as a customer at State Farm so please sign and up for State Farm right away please we will give you free car insurance for entire month
2,"January 18, 2010", Keeps ringing even tho you put the phone down.a little embarrasing wen ur pretending sum1s there!!
1,"December 8, 2012",Um.. I thought it would be great but whenever the time the call is ment to be it force closes fix it then i might download again
2,"April 19, 2009", It doesnt even play my ringtone it plays nothing at all. It jus pops up on the phone.Uninstalled!
1,"August 17, 2014",Atroshes It did not work for me at all.  When I changed everything to what I wonted it just wouldn't work. Piece of junk.
2,"October 6, 2015",Oh👿👿💔 Why! This sucks butt USOC duck IBGE DMSO slots DMSO USNR deco same dark Uzi fit issue Volvo condo coco click kb CMYK
5,"March 20, 2009", Does exactly what it says already used to get out of fight with girlfriend hahaha burn
5,"May 18, 2013", Its ok but after a while wen.I set a time to call it started yo day force close
5,"November 29, 2009", Doesnt work on cliq because no actual call or end button to look real haha
1,"February 16, 2015", People keep calling and we are deli ting th app and it still call were going to call the police
3,"April 28, 2009", Its ok i guess but it would be way better if u could program it 2 kall u at a certain time instead of having to buy the whole thing+betterifshowskalls
1,"October 14, 2014",Hate it Don't get this prank. It makes the call at a time that you did not put
1,"March 20, 2009", It just shows a picture of what looks like imcoming call. Ring does not work though.
1,"September 7, 2013",This is crap The app dosent work I am fed up of it get rid of it
3,"October 18, 2012","Possibly not the best app in its category Whilst a cool concept, the format of the call looks obviously fake as it doesn't match the ice cream sandwich operating system."
1,"November 9, 2012",Stupid The worst app that I saw! It's to be stupid... Making fake calls! Terrible app. I'm sorry
4,"January 28, 2010"," Funny, had a friend think his ex gf was calling me to hook up lol"
1,"April 29, 2013",Hate it In my tablet it says unfortunately fac has stopped ia agree richard
2,"March 29, 2013",Rubbish This app used to be excellent until app started suddenly crashing when trying to make fake call
4,"March 21, 2016",I needed to get out of the drug house one day... Perfect to get away if your cover is suddenly blown in the methlab  or any family event.
1,"March 25, 2009"," This app bytes,, u got to push the button to have it ring, a give away that the call's FAKEEE!"
3,"April 12, 2013","Average It kind of killed the effect when it was in the middle of a call and it said It stopped working, whaaaaat."
2,"July 30, 2009", It works dumb but def. Helps i had to fake a call from my mom.=] it worked
3,"January 21, 2010", Okay app. Better if it played out of phone earpiece rather than speaker - also would help to be able to set volume recording plays at.
1,"May 12, 2013",Crap Rubbish it kept saying fact phone has stopped working don't install
1,"February 4, 2013",Didn't work I could not get it to work I gave it one star but it didn't deserve any
3,"April 19, 2015",Fake call This app is ok but ggreat ifu needto play a prank
5,"July 19, 2015","OMG The absolute best!I pranked my sister so hard with writing Harry Styles,she freaked the hell out!"
1,"November 8, 2014",I HATED IT!!! Every time it called it would not work like I could not here anything
1,"June 22, 2009"," Stupid app to be honest, mite aswell change the names on your contacts and get them to call you"
5,"December 28, 2009"," Its funny im gonna be with friend and i scedul a call from ""usher"" and evry1 gits jealous"
1,"October 21, 2014",It does not work It dials the number and it rings but nothing happens after
2,"January 18, 2013",Does not work on tablets It is ok on my phone but it crashes on my tablet
4,"December 27, 2009", It would be better if the call fake voices didnt sound in the speaker!
1,"November 1, 2013","DON'T DOWNLOAD It's embedded with advertising, looks up your genuine contacts when it has no need to and shows AS A VIRUS on several blockers."
1,"March 19, 2013",Wtf It has a ad over the fake a call button I cant even.use it
1,"June 4, 2014",This app doesn't work You can't phone people but other people can phone you
1,"January 3, 2014",Terrible I tried multiple times to schedule a phone call and the call never came.
5,"October 20, 2009", This app is mad good.wen my girl start talking that crazy s**t i set the app thin act like my job need me
5,"April 23, 2009", Jazii- quess wt ppl?!! It ckame in HANDy!!!! I am in lub wit dis amp!!! No lol jk =€
3,"June 14, 2012",stupit when you down load it starts all over.like 3 times when I down loaded it
1,"April 18, 2009", Plain stupid. I hate it. Its pointless if u dnt buy the full version.
1,"October 4, 2013",Baaad Every time i try to call it says  fac free stooped working
1,"May 7, 2016",No working It is rubbish because it will not work   Also is boooorrrriiiinnnggg
1,"April 27, 2009", Naaah. REAL ppl dnt 2 much need this 1. More 4 a younger crowd.
5,"March 22, 2013",Exellent I really appreciate this app since it made my April fools very nicer and I wish we can take the adds out
1,"May 21, 2009", Free version completely worthless since you cant schedule a call.
3,"March 20, 2009", Needs more delay between click and actual call... otherwise very funny
1,"September 15, 2012","Stupid It forced closed, and it's stupid cuze it doesn't work."
5,"November 15, 2009"," This app is utterly, ultimately, completely and literaly save your life from those annoying people you really don't want to talk to. Thx"
1,"December 25, 2013",Boring doesnt even work It keeps saying error
4,"October 12, 2009"," Please make it say only ""call"" as the label. Thats super obvious!"
5,"December 21, 2009", I get a few coworkers all the time...CEO calls with job interviews
1,"February 11, 2015",Not even letting me use it The worst thing ever
5,"March 27, 2009", My wife almost killed me when i faked my ex calling
5,"March 20, 2009"," F'in priceless, only request is to add a delay once ""make call"" is hit(10 sec) and save entries....beautiful! Props!"
1,"February 16, 2015",Rip off It didn't prank call anyone
1,"December 7, 2014",GALAXY S3 First I thought it would a cool fake call  then I found out it was the borrinest fake call in my history its better on my iPhone deleting it
1,"January 20, 2010", Motodroid- horrible. Doesnt look like the call screen at all.
3,"January 18, 2010", Not a fan suggest getting only if you have 1.5 or 1.6
1,"January 21, 2010"," Makes ur fone ring, pointless, use alarm clock!uninstall"
1,"June 2, 2013",Fac rubbish crass half way though. wouldn't pay for it
4,"April 9, 2009", Does what it says. Pointless app unless trying to get out of something.
1,"June 24, 2014",Horrible It doesn't work that's all I have to say
1,"April 16, 2013",Poor UI inconsistent....call screen not same for Sony Xperia J
5,"April 13, 2009"," Funny as, i tricked ALL ma matess.
Tahh much! X"
4,"May 9, 2009"," Just wish it didnt ""call"" so quickly, kinda obvious."
5,"April 7, 2009", Lol got me out of meeting a stalker for lunch!
2,"May 12, 2009", it's co0l if it hung up maybe you wanna seem important it never hangs up so its good and bad i guess lol
5,"June 23, 2009"," Great app, it has saved me from a few long boring conversations, and impressed some coworkers by having the ceo call me for a promotion!"
4,"December 28, 2009"," Great, but you should be able to fake a call at any time with your phone in your pocket, by pressing the camera button or something."
5,"November 4, 2012",I don't know??? Its just loading now and I will get back in a few
2,"December 27, 2013",Barly works When I skedule a call fo a certain time It goes right awayand when I try to exit it wont let me I have ti restart the phone
3,"September 20, 2009", I wish i could put in a time for it to call b/c u have to go in ur phone and press call now also i wish it would end the ringtone after u answer it
4,"May 18, 2009"," ITS SOMETHING FUN. IVE GOT MY FAMILY. SAYIN OBAMA,LEBRON JAMES AND 50 CENTS ETC . I HAD FUN WITH IT. TRY IT"
