5,"April 10, 2009", brilliant. It works well its one off the best apps. Cant wait to use it. Just hope a real fone call doesnt come happen
1,"January 20, 2010", This aps sucks it keeps freezen my phone up
3,"December 25, 2009", best way to get out of an awkward situation and really fools anybody(:
1,"April 9, 2016",Hate it It wont it even let me answer the call
3,"December 31, 2009", Let me know when I can schedule multiple repeat calls.
1,"November 2, 2014",Bad game Hate so much it made me scream
2,"August 17, 2013",Dont work I reported 4 times not fair
1,"May 1, 2013",Dumb Really dumb Doesnt do anything really
3,"January 31, 2010"," The application uses a ton of memory space, unacceptable."
5,"April 21, 2009", Really helps to get away from people who get on my nerves!!!!!!! I love it
2,"August 12, 2012",Meh Didn't work with epic4g touch. Couldn't see typing
1,"February 18, 2013",Weak sauce Doesn't even appear in call log!
3,"August 20, 2009", Works well but you have to have your phone out to use it. A simple timer on the calls would make it much better
1,"September 28, 2014",Fake caller app It does not work that's why it's free
1,"December 24, 2014",I dose not even do anything do not download Stupid
1,"January 2, 2012", Needs more options and it freezes up my phone.
5,"December 23, 2009", Got me out of some situations lol. <3 it
1,"August 4, 2015",Stupid How does  it work i can't even call
1,"November 19, 2009", App says fake a call free..... blows da daam cover right there....
1,"October 19, 2014", It was so stupid I couldn' call anyone
5,"April 6, 2013",Love it I put an actors name on it then it rings when im playing with my friend i answer it and she believes its the real actor nice app
2,"July 6, 2009", Terrible free version. Would'nt incourage me to buy the full version.
5,"March 20, 2009", Thiss really sucks. It doesnt work
4,"June 17, 2013","Good but... Great app, I love it, but for some reason the volume is super low when u here your recording idk why plz fix."
4,"April 5, 2009", Niice! I like this gr8 way to get out of awkward situation!!
5,"December 20, 2009", Its really neat.. can't wait to use it but mine doesn't show any type of spinner I just tap to answer it .. oh well
1,"April 1, 2012",Crap If i cud give it 0 stars i would
1,"May 28, 2013",Sucks It stole my credit card number
1,"December 29, 2013",Hate it It can at least say words to make it more believable
1,"May 27, 2013",Bad app Virus! ! I looked on antivirus it said threat! ! Fix it
5,"March 21, 2009", I love it. Its cool how you can edit the name & ringtone. Can you change how the app looks so it'll be more low key? Thanx!!!
2,"July 1, 2009", fake call gets interrupted by real call! fix pronto!
3,"October 8, 2009"," Nice idea, only rang once tho"
3,"July 27, 2009"," Should be able to set a time like ""ring in 5 minutes"" or something so its not like u press a button and it rings right away :/"
4,"April 7, 2009", Got me outta some horrible dates lol !!
5,"January 3, 2010", This Is A Great App But Tha Calls Shuldd Show in Tha Call Logg That Would be Way Bettah
5,"March 30, 2009"," Saved me from several lectures and an ex ,that obsesses"
5,"April 7, 2009"," This is really good, especially to get out of boring situations :D"
5,"November 28, 2009", Got me out of some akward situations!
5,"August 17, 2009", This is to get. Out of certain convos lol
1,"October 9, 2014",Doesnt load. Got to 82% and froze
5,"October 14, 2012",Excuse Great excuse to get out the office pretends the doctor called
3,"November 28, 2009"," Stupid, hard to turn off when call starts"
1,"July 6, 2013",Useless It won't match native ui
1,"November 14, 2014",I don't get it I don't even know how to do the prank calls
4,"May 30, 2009", Love it at work..ASHTON KUTCHER calls me twice a day....thats how i leave so early and still get paid...
3,"April 9, 2015",Huh Did I call a real person  help meeeeee please do you know I don't wanna deal with 911 I'm only 8 years old. ;( ;( ;( ;(
1,"June 7, 2015",It doesn't work It always messing up
