1,"September 23, 2012",Galaxy y young Keeps on force closing... Waste..
1,"April 8, 2013",Samsung galaxy tab Wont work!
4,"October 4, 2012",pretty good Its fine .but I can only do it to my friends because my parents know I cant call people.
2,"October 5, 2012",Bad Mine won't even call
5,"August 7, 2013","Like it no !, Love it YES !!!! LOL ! Love it ! I use it to play jokes on my man and my family lol works every time :)"
1,"August 6, 2013",crap it didnt download or install
1,"February 2, 2013",Eh I think it would have been better but still I am a very good prankster and this is just junk.
5,"September 8, 2012",Fake a call free Cool game
1,"January 22, 2013",Waste of Time !! Don't Download
5,"January 5, 2013",Teia Baxter This is awesome i get out alot of situations
5,"July 16, 2013","Nice app Like this app, no real difficulties with it. Fun to use and trick my friends with. Would recommend it! :)"
5,"June 8, 2013",Thumbs Up i like this app very good for a free app. If u want my opinion begin download now......
5,"August 17, 2012",Love it This aps got me out of a lot of things even class once
1,"March 21, 2013",Virus Installed Norton a long time ago because it is awesome ... Anyways this is a virus that is why it asks for force close ! Dont install
1,"October 18, 2013",Boook Stinks       I hatw it
4,"December 27, 2013",Better This app is very important as me who wants to away from and also want to impress by fone ringtone or be  important man
5,"November 19, 2013",Can get me out of a hangout It is realy good and works
1,"October 23, 2013",No It doesn't let me call
5,"November 18, 2012",prank calling why I like to play this game is cause its fun
1,"February 4, 2013",Not good I hate it
1,"April 29, 2013",Useless Completely useless app
1,"February 2, 2013",Bad Do not get it
1,"March 29, 2013",S Did not work
5,"January 21, 2013",Helpful It realy helpful when u quit from lessons and say my dad is calling :D
1,"November 5, 2012",Anish Raj Samsung galaxy y is not support and flop
5,"December 19, 2013",Cool I pranked my mom I am pranking every body In my houes
1,"July 26, 2013",not cool this app suks i downloaded i dont like it
5,"August 21, 2013",Love it Best to Fool People And Get out of Awkard moments....
1,"January 27, 2013", It won't work
1,"August 29, 2012",Can operate Everytime force to close
5,"June 20, 2013",Sony Xperia U Perfect! Has everything one could ask for.
5,"June 3, 2013",Fake Wow its very good
1,"October 2, 2012", Do not download this it is a virus
4,"August 16, 2013",Prank are fun I love it and I hate it
5,"November 6, 2013", It's real funny!
5,"August 15, 2013", You all stupid
1,"November 1, 2013",Looks stupid Boring
1,"August 10, 2013",Poooooo Hate u
5,"June 5, 2013","Savior App Works as advertised, no complaints moto droid 4"
1,"October 11, 2013",Badd Not cool pple
5,"September 8, 2012",Lol I love this I done this to my mom making like police
2,"December 25, 2013",Rahil W ow
3,"July 24, 2013",cool its alright not great but alright
1,"August 26, 2013",Poor App is hell
5,"September 10, 2013",Raj Saini Niceeeeeeeeeeeeeeeeeeeeeeeeeeeeeeeeeeeeeeeeeeeeeeeeeeeeeeeeeeeeeeèeeeeeeeeeeeeeeeee
5,"January 23, 2013",Iphon 5 This is very us full and iphon 5 it very coll
4,"April 20, 2013",coool I can prank my dad now!!!!
4,"September 18, 2013",Condom Sexy app very sexy ladkiya are here
1,"December 21, 2013",It wont let me download this is bullcrap Lammmmmmmmmmm
4,"April 1, 2013",Love it. Really like this app. Good for pranking people
5,"February 22, 2013", I love this prank kall is amazing
5,"July 29, 2013",Great The app needs more graphics
5,"September 4, 2012",nice nice call faker
5,"November 12, 2012",great it's the best app ever thanks
5,"September 5, 2012",It needs.... UPGRADE
5,"September 6, 2012","Awesome It works great !"""
5,"September 17, 2013",Like it The best app ever
5,"November 9, 2012",Dict This app is so cool
5,"June 4, 2013", Very excellent job on designing this app
5,"August 29, 2013",Awesome Really good thank you
4,"September 1, 2012",Payall Hi
1,"September 14, 2012",Hiiii Hiiiii
5,"August 2, 2013",awesom jm
5,"September 19, 2013",Sanju Je7
5,"December 17, 2012",Gghh Het
5,"November 17, 2013",WHEEEEEEEEEEEEEE Poob
5,"December 9, 2013",9 r
5,"August 29, 2012",Allshhask Hhh
5,"October 18, 2013",Riza Hi
3,"October 19, 2013", I'm
1,"October 19, 2013",Horribal Shity
5,"August 12, 2013",Grr Terrible
1,"September 11, 2013",horrible this is is madness
2,"March 10, 2013",Not Good
5,"December 29, 2013", Thumbs up...this app is very good
1,"April 12, 2013",grrr... Not working waste of time
5,"November 30, 2012",Excellent app This app is hilarious!!!
3,"March 24, 2013",Good I love this app.
1,"August 1, 2013",No good No good
5,"April 26, 2013",Good Its pretty good
5,"December 19, 2013",Nice Must down load
3,"April 9, 2013",Miss call Nice to give a call
5,"November 24, 2013",Exellent app I love this app
4,"May 1, 2013",Excellent Hdhdjd dud
5,"January 20, 2013",X.cool This app rock'x
5,"January 15, 2013",(* Best app ever
3,"December 11, 2013",I love it ♥♥♥ 5 stars
5,"October 25, 2013",It is fun Hey
5,"July 28, 2013", It works great
5,"July 27, 2013",Anmol Nice app
5,"January 10, 2013",samsung s3 cool
5,"November 25, 2013",Excellent Btfu i love it
3,"July 20, 2013",Ali Nice application
5,"November 2, 2012",Good I love it
3,"April 28, 2013",Good Its perfect
5,"November 26, 2013",Amazing How cool
5,"November 27, 2013",Khoooooooooooooooool.................. Mast app
5,"December 15, 2013",Cool Yrh.its great
5,"March 6, 2013", Dope
1,"July 15, 2013", Poor
5,"June 5, 2013", Asome
5,"September 21, 2013",a d
5,"November 19, 2012", Add
5,"November 2, 2013", Sukes
4,"December 20, 2013",Nys Nys
5,"March 23, 2013",Ha Ha
5,"February 23, 2013", This is awesome!!!!!
5,"December 16, 2013",Sweat Awesome
4,"June 20, 2013", This is nice
5,"November 3, 2013", Not bad
5,"January 23, 2013", good application
5,"July 27, 2013",Manuel Perfect
5,"November 30, 2013",Tablet Cool
4,"August 21, 2013",Komal Superb
5,"July 24, 2013",Excellent Good
5,"September 3, 2013",Fun Jokes
5,"November 24, 2013", Hmm cool
5,"December 1, 2013",utzw Good
5,"August 12, 2013",Nice Yea
5,"August 19, 2013",Perfect!! Perfect!!
5,"September 11, 2012", Good
5,"December 29, 2013", Awesome
5,"July 21, 2013", Sexy
5,"July 17, 2013", Good
5,"November 6, 2012",Good Good
1,"August 13, 2012","CAN'T HEAR CALLS Sucks because it defaults to ""silent"" ringtone all the time and won't save changed ringtone selections. So if you can't HEAR your phone, what good is a faked call?"
5,"August 13, 2012",Xperia x10 Very usefull to get away from long conversations...
2,"August 15, 2012", Not really good
1,"August 15, 2012",No good No good
4,"August 17, 2012",Awesome Really helpful in certain difficult situations.
1,"April 8, 2012","WORTHLESS! This fake call app definitely sucks! You can schedule a certain time for a call to come thru, but it wont ever ring until you unlock your phone and exit out of the add first. So if your phone is in your pocket or whatever then its never gonna ring! That takes away the whole purpose and makes it comp...Full ReviewThis fake call app definitely sucks! You can schedule a certain time for a call to come thru, but it wont ever ring until you unlock your phone and exit out of the add first. So if your phone is in your pocket or whatever then its never gonna ring! That takes away the whole purpose and makes it completely pointless!!!!!"
4,"April 22, 2012","It's Okay.... I reallly liked this, I showed all of my friends but the only thing i hate about this is that when i want to set the timing for it to ring, the ad covers it. If this wasnt there then i think i would rate it 5 stars. I hope they can fix this."
1,"October 15, 2012","Something bad happens!!! After updating it is not working on my device... Program crashes, the phone restarts... And he was cool program!!!"
1,"April 20, 2012","Sucks big time Keeps freezin up and wont lemme get outta there, so i have to wait 5-10 minutes to make,it stop doin blanks! No offense but ya!"
5,"April 5, 2012",Haha It's pointless for me cuz I'm 11 but man is it funny when I customize hahaha
4,"July 11, 2012",Kool Now when my little sister crying for my phone I can fake call.
5,"June 16, 2012",Awsome I downloaded this app and it was really good cuz i faked the police were calling my phone and my brother freaked out BIG TIME
5,"May 13, 2012", I think this app is so fun u can also record Ur voice so u can say what ever u want!!!! I love this app
5,"July 9, 2012",Amazing !!!!!! I can get out of a bad situation with just a press of a button. Luv it. Keep it up.
1,"June 7, 2012",Lol this is stupid For sum reason I can't even get it open
5,"May 6, 2012",very nice my parents acutally think someonw is calling ne it gets me out of lots of stuff 5 stars
5,"June 6, 2012",Super Funny It really funny it make me laugh
1,"June 27, 2012",Very very bad Its really bad.so dont install it.
5,"April 26, 2012",Pranksters I pranked mi mom soo hard
1,"July 3, 2012",I don't even Has anyone really been far even as decided to use even go want to do look more like? I don't they have.
5,"April 4, 2012", Love the app it gets you out of tight sisuashins.get theAPP
1,"April 14, 2012", Sucks got in trouble for faking a call
5,"April 17, 2012",Funn! Watching my friends faces when i pretend to leave. Its PRICELESS!
2,"June 28, 2012",Swear Is this really.... F it it is horrible
5,"June 10, 2012","Great U can program it to say what u want it to say,and u can select how long u want it to go off!!"
5,"July 8, 2012",Great app I am getting addicted to this very cool
5,"June 15, 2012",Awesome! Best fake a call app around!
1,"May 27, 2012",About.how much it sicks It sucks !!
5,"July 18, 2012",Download it Tricked my mom
1,"July 1, 2012",Fake call It's fun to trick your friends but its alright
1,"July 10, 2012",Don't get this It doesn't start the call till u unlock ur phone..... Uninstalled!
2,"July 25, 2012", Not what  I rthought it would be
5,"August 23, 2012",Great app MY Phone isn't even activated but I pretend preety good because of this app :)
5,"April 6, 2012", It works I just wanted to call orhev people
1,"July 11, 2012",Wortless Dosent even work if u scedule a call it will do it when ever it wants then it will do it
1,"May 5, 2012",It sucks It keep force closing
5,"May 1, 2012",Fake a call free It is awsome
5,"May 3, 2012", It keeps force closing
1,"June 18, 2012",fake a call ok
3,"April 9, 2012", Goood nt bad
5,"June 11, 2012",I did it I did it all
5,"June 10, 2012",Ring tones that matter Nice a must have.
1,"April 14, 2012",... No time limit
5,"July 29, 2012","sexy it was awesome suprise for my bf lol...^,^"
5,"April 7, 2012",Awsom Nicw
5,"April 21, 2012",Best This is the greatest app ever
5,"July 26, 2012",Open Download
1,"April 14, 2012",Hd Noooookookkll
1,"June 16, 2012",Open 127
1,"May 22, 2012", It sucks
5,"June 15, 2012",Cool I didn't try it yet
5,"July 15, 2012",Galaxy Young No problem...great app...love it
5,"July 22, 2012",hahaha cool loveeee itttt !!!
5,"July 24, 2012",Good I love this!!!
5,"July 19, 2012",AWSOME !!! Sooooooooo cool
5,"June 15, 2012",Super Its perfect
5,"July 25, 2012",Very good Jftf
5,"July 18, 2012", This is soo cool
5,"April 4, 2012",Lmao Hilarious
5,"April 18, 2012", Works perfectly.
1,"April 24, 2012", Sucks
5,"May 1, 2012",Amazing Awesome
2,"June 30, 2012", H...... More
5,"April 20, 2012",Great Greatest
5,"April 17, 2012", AWESOME!!!!!
5,"June 3, 2012",Sweet Sweet
5,"April 9, 2012", Good
5,"July 30, 2012", Good
5,"July 9, 2012", Nice
3,"April 8, 2012", Niceee
5,"May 19, 2012",Love Love it
5,"June 17, 2012",B-) :-)
4,"February 27, 2012","best fake a call app. i've had different fake call apps but this one beats all with the in-call fake sound, even though it sounds through the speaker."
4,"March 24, 2012",Swagg I think this a good app.....:) But I know you can't t talk to the guy....but that's alright...because I trick my sister that i'm calling her mom or she calling me and she knows that shes in trouble...so this app is SWAGG
2,"March 1, 2012",Okay It would be really cool if it didn't go to speaker phone.  It actually is really annoying.
4,"March 18, 2012",Dnt know It aint dat bad but y mum told m to delete it cauae i wqs usin matws name
2,"February 29, 2012","Cool Could be better, caller screen is totally fake, But it got me outta class :D"
4,"March 13, 2012",Voice Play Best feature is the voice play back where it does seem like your talking to someone.
1,"March 1, 2012",Sucks Don't waste your time downloading this crap
5,"March 27, 2012","nice wow, my Archos 70IT, now ringing like an smartphone! Amazing experience."
1,"March 3, 2012", It not good so poor
1,"March 8, 2012",Sucks in galaxy y... Back does not work...horrible interface...
1,"March 26, 2012",Fcj Crap! Won't even download!
2,"March 13, 2012",lol wat is not doing good
5,"March 25, 2012",My rate I rate 5
5,"March 19, 2012",Cool This app is wikedddddd !!!!!!!
1,"March 26, 2012", Bug ..no option to exit
4,"April 2, 2012",Worked Hands up foh this app::::
1,"March 3, 2012",Sucks You can't even talk to the guy
3,"March 31, 2012", your face
5,"March 24, 2012","p cooll!!"""""
5,"April 4, 2012",Hi Hi Great app. Lots of fun.
5,"April 1, 2012",What? poop. :P
5,"March 28, 2012",Nice Its top most.
5,"March 21, 2012",Great app.. Niceone..
5,"April 1, 2012", Great game
5,"March 22, 2012", I love it
5,"April 4, 2012", Great App
2,"February 12, 2012","Sort of works... It works to fake the call, but then takes you to the app when you answer! Not only that, but it freezes your phone. When this is fixed it will have a lot more potential."
3,"February 27, 2012", Oh this is very embarrassing. When I use this application the phone can ringing if u receive a call .can you turn the phone mute when usng fake call?
1,"February 26, 2012",Shockingly bad Goes to speaker when you answer. Just a waste if time to download.
4,"February 9, 2012", Pretty good except sound source is too low. ...even I did not hear it from feet away
3,"February 21, 2012",okay like a nother boo and poor mixed its good buy can be better I can barly here it tho
1,"February 28, 2012",No caller image.. No caller image..  Also call screen looks completely fake..
5,"February 21, 2012", Awsome lovin' it!
1,"February 11, 2012", Bad!
4,"February 15, 2012", talk
4,"February 9, 2012",. Good craic
1,"February 10, 2012",UI pointless in ICS Unless there is a major update with customizable and user selectable call UIs this won't even fool my grandma!
1,"January 7, 2012", Call volume seams to be stuck on mimimum. So it wasnt heard by anyone in the room!
2,"January 20, 2012","Uninstalled I liked that app but not worth all the spam ""iphone winner"" ads popping up in my notification! I uninstalled it"
2,"November 29, 2011"," the one u guys created for Apple is better more customizable features ie adding pic, interaction on the action call screen when answer called."
1,"January 1, 2012",Not good at all To many ads. Not fun. Uninstalling
1,"December 26, 2011",The incoming call screen is not an android try ype Sucks uninstalling
3,"December 27, 2011",Needs ics call screen
4,"December 7, 2011",Samsung galaxy fit Works perfectly!
4,"December 16, 2011",Good :)
5,"April 25, 2013",Hà Fun to prank with
5,"March 22, 2012", حجط
5,"November 30, 2011", Great app
5,"January 27, 2012",Rate Awesome :)
4,"October 26, 2011",Great App One of my annoying band mates loves to talk to much. I use this app every time we have band practice. He still hasn't figured it out. Lol
2,"October 23, 2011","Scam. I was about to update until I saw the comments. It was fine for me, but then I heard about the ads and mailing system."
5,"October 24, 2011",Great. I don't get why everyones saying its a scam. That does not happen. Great app!
5,"November 29, 2011", Prefect app. Can't get better than this.
1,"November 18, 2011",UNHAPPY Fix force close when u press ringtone!!
4,"November 5, 2011",Feyg Don't know wat is this
5,"December 3, 2011", Good app. Easy to use. Gets you out of any situation.
5,"November 19, 2011",The This could not get any better! And its free!! Thanx n much aloha!!!!
3,"November 25, 2011"," No matter what time I schedule the cal for, it calls the second I press ""schedule call"""
4,"December 4, 2011", It's really good!Wish u cud add pics though.
5,"October 30, 2011",Easy to use Thx
5,"November 6, 2011",HAIDER Superior product
1,"October 23, 2011", Malicious. Unless you give them your mailing address it takes over your system and disables the home button so you can't get out of program
1,"September 18, 2011", Use ur alarm.... just set ur alarm and use ur ringtone as ur alarm sound... guess what? Free fake call for whatever time u want.. no app needed
1,"October 19, 2011","•••malware•••  NOT-free! Showing ads == NOT-free.  Abusive permissions: gps, contacts.. untrustworthy developer"
4,"September 9, 2011",ddd took me out many situations.
5,"October 18, 2011"," Good application that's more realistic and fun to use, it really world, would be better if disguised voices with custom settings where available."
1,"October 9, 2011",Wow It dosent answer me I want to be able to talk and have somone answer me wen I'm bored
3,"September 25, 2011", Good app. Only the ads blocking the scheduled call.
5,"September 18, 2011",Awesome Cross platform app. Does what it says. No issues.
5,"September 13, 2011",Love it Works every time!!
5,"October 11, 2011", Too cool
2,"February 8, 2011"," Needs a shortcut I should be able to create a shortcut on my home screen. I can't always predict when I want a fake phone call, but it would be easy to covertly tap an icon on the home screen when I do need one. I would give four stars, rather than two, if that feature were available."
5,"June 30, 2011", I absolutely LOVE this app. It allows me to get away from my annoying neighbors that always want to stop and talk :)
1,"September 9, 2010", App don't. Work. Waist. Of time u can't. Make a call. Stop working. Every. Time I trying. To call somebody. N to make ur phone. Slow Motorola droid 2
3,"December 23, 2010"," Found bugs. Crashes if u pick ur OWN contact number on list and fake call it. Wont end call when u hit ""end call"" if a recorded voice is used."
3,"July 26, 2011"," Very realistic, Good app! Would definitely of kept it but my phone slowed down drastically after installing. HTC Desire"
4,"June 1, 2011", All you need to do is slow down the voices... they speak so fast and never pause to let you talk and then it look fake.
2,"September 3, 2010"," An app this size MUST have app2sd card! No excuse! Add it for five stars. Until then, uninstalling"
5,"August 12, 2011",Great! It allowes me to get out of awkward situations like bad dates or funerals or parent teacher meetings :D keep up the good work!
5,"July 3, 2011", Love it... especially the bailout call... too bad i'm not in an english speaking country! :-)
5,"October 26, 2010"," Ilove this app! Its really good, everyone should have it if they want to get out of an awkward situation!xo"
2,"June 21, 2011", Sadly doesn't work on X10MP. Crashes IF a phone number can be found in the phone book.
5,"February 23, 2011", Hey i record my voices to pretend to be like a teacher.then said to my friend I'm busy right now please pick up the phone And then he thinks it's real
2,"October 7, 2010"," I got caught when I ""ended"" the call it took me to the set-up screen. Fix this! That was embarrassing!"
4,"August 27, 2010"," Just tested it and let me tell you, IT WILL HELP in the future. The problem is that the call screen looks a little fake so it could get suspicious."
4,"April 15, 2011"," was messing w/ a chick I just wanted to smash(and I did)but she caught feelings, and fake-a-call got me out of another boring a$$ booty call, thx dev."
3,"February 14, 2011", Good but pls support app2sd. Will be excellent if I can simply press a physical phone button or a homescreen widget to easily fake a call.
5,"May 27, 2011", Lov it. It really calls ur phone and its only down side of it it that its only goes 4 an sertent amout of time then quits.
4,"December 29, 2010"," Works great, please create a widget to make immediate calls. Also would be great if we can add contact photos and a more realistic Droid X UI."
1,"January 23, 2011", Want to rate zero forces close everytime terrible app don't install uninstalling HTC wildfire
1,"January 22, 2011", It shouldn't bring you to the app right after you've made the fake call cuz then it gives it away
5,"March 2, 2011", Luv this app works perfectly rlly fakes a call good believable as hell put on my homescreen and everything just drag and drop on home screen*optimus m
1,"August 21, 2010", It wont even pull up so that i can at least try the darn thing out
5,"April 2, 2011", saves me evrytime i need to get out a bad situationn.
5,"April 22, 2011"," Awesome, man. Though it needs to have more realistic screen. Non the less it is the best one on the market."
5,"February 10, 2011", I Did Get Away With Things. Lovee This App.!!'
5,"August 20, 2011", An application really helping me in many embarrassing situations
5,"November 30, 2010"," A good way to excuse from a bad date, a boring meeting and an annoying patients."
1,"April 11, 2011", It crashes alot and it doesn't make the call wtf is that? DON'T DOWNLOAD not worth it.
4,"January 23, 2011"," Its pretty cool, although my friend has the same phone, and the call thing where u can answer or decline isnt like the real one."
2,"August 31, 2011"," Lags, ends call after a long time and fails at calling at scheduled time...Galaxy S"
5,"October 27, 2010", Not letting me record a custom voice... plz fix
1,"January 26, 2011", Dis some bull n a waste of time my number kept poppin up
3,"August 5, 2011", This is okay not as good as most games or things I've tried
5,"October 31, 2010", Love this app! Great to get out of a bad date or any situation! EVO
0,"February 9, 2011", Does this app have charges like the other fake caller apps
4,"May 14, 2011"," Voices are obviously fake, and should come out of where calls do."
3,"September 14, 2010"," I use this app for an alarm, so i cant really speak to its intended purpose, but it doesn't seem like it would look very convincing?"
1,"January 3, 2011", Wayy too confusing for me. Plus it keeps calling me even when I exit out of the program!!! -devour
1,"March 18, 2011", Virus will screw u p your phone
1,"September 21, 2010", Didn't work on my moto droid
5,"April 27, 2011", This app is wonderful but on the update I think you should include the speaker phome option
5,"August 13, 2011",Love it!! Awesome :-D HTC Thunderbolt
5,"February 14, 2011", Works against friends who talk TOO much
5,"September 24, 2010", By far the best fake call app I've tried. Lets you record voices!
4,"February 16, 2011", Hilariously amusing.. wish you could use more than two minutes though and that there was no bloody advertisements.
5,"February 12, 2011", Apart from doing what it says it does and doing it well....It's a very quick to set alarm clock! A useful app.
5,"March 13, 2011", Its funny tricked my mom ha ha
5,"January 3, 2011", Really good and you can customize it however you want it.
5,"February 3, 2011"," Brilliant app, best one of this type I've seen so far. I like the way it can be customised!"
4,"December 13, 2010", Good. But pick ringtone should probably be silent.
1,"January 2, 2011", Doesn't work driod x 2.2
2,"April 7, 2011", Great idea ALWAYS FORCE CLOSES. Better on ipod.
4,"August 23, 2010", Brilliant to use when u dont want to talk to the person in front of u
0,"February 7, 2011", I'm really confused on how to use it
2,"August 3, 2011", Okay when it doesn't malfunction and shut down
5,"July 26, 2011", Its very good and very helpfull pls try it.
1,"December 26, 2010", Can't move to SD card.
0,"December 28, 2010", It's really cool. And it can be used at Christmas time especially for Santa claus. Mean but works. :)
4,"February 21, 2011", Really comes in handy when I want to leave a not do great situation
3,"February 21, 2011", This app isn't for calling other people like u may think
5,"June 27, 2011", Works perfectly. Best fake call ever.
2,"January 27, 2011", How do u even get it to call? Maybe I'd rate 4 stars then.
0,"January 5, 2011", Advance acCesS night red ysfedart Trabucar bb c/ vegg hacT yg c/
1,"September 2, 2011", Force closes even b4 can set a prank call Motorola charm
2,"June 21, 2011", It dora not ring when you schedule the faks call. Uninstall
1,"July 30, 2011", It sucks all u do is call ur self and that's it
0,"January 15, 2011", Force close after select from Contacts. -Droid 2.
4,"March 16, 2011", It was great but not what I was looking for.
3,"April 23, 2011", works ok.5mb+.move to sd needs to be an option...
5,"April 2, 2011", It rocks works no wou moms man!
1,"July 14, 2011", Doesn't work
2,"August 8, 2011", Dnt really kno hw to use it
3,"June 24, 2011", How do you get to the skript?!
1,"October 14, 2010", Force close on dx when I add contacts.
1,"July 24, 2011", Force close everytime! -Moto Droid 2
1,"July 5, 2011", The app keeps closing by itself
5,"August 27, 2011", it works! /htc desire s
5,"September 12, 2011", Kept my word. 5*
1,"February 11, 2011", Does not work with Droid 2. Force close after selecting contact.
1,"February 18, 2011", It says i have no contacts
5,"January 8, 2011", great samsung galaxy s
3,"June 4, 2011"," Can't use contacts on Galaxy Tab. Can't even see them. Otherwise, works fine."
5,"July 7, 2011", @naimah thats what its supposed to do.
3,"February 20, 2011"," Well,its OK I guess"
