5,"December 14, 2014","Please, make it multi window This is the best calculator for android. But I'd like to use it while taking notes and it is impossible to use it as a floating window. Even on rooted devices, changing dpi and all. The problem is that when reducing its size, the ""buttons"" get all cramped."
5,"June 19, 2014","Good calculator app. Simple & elegant I love using maths app on my phone. I filled out feedback form requesting 2 more functions, polar() and rec() functions. Hope these functions get included in your next app upgrade. Those 2 functions will bring for me alot more usability."
5,"June 26, 2014",Easily the best calculator Title says it :D if you need to do a little more than just simple calculations this is for you. Where can I donate?
5,"September 27, 2015","Best Calc app ever! I have tried a lot of math apps (for my engineering courses) and sincerely this is the most comfortable and complete. Lots of tips and tricks. Lots of hints and plus functions which make this app really friendly and ""funny"". Great job!"
5,"September 7, 2015", Perfect App. Easy to use. Very handy and well organized. Very useful output memory. I love it. I had a class pad 300. I was looking for an App like that but this is way easier and better than my old Classpad.
5,"August 7, 2014","Made with care With many features, good look and being free. One of the few calculators with expression support. Visible last results with easy editing. Gives great comfort compared to the regular calculators!"
5,"September 3, 2015",Excellent App and great appearance if you go into settings and choose iOS button overlays. Very nice intuitive calculator to use with VPAM type method of entry ( Say what you see basically ) - very impressed - can switch to engineering layout within settings also - Thanks for a great app ! Exceptional Calculator !
3,"May 7, 2014","Could be better It's very useful and well done, but it's lacking a basic critical functionality: the ability to copy/paste results and input (in fact it seems to be overriding it)"
4,"May 14, 2014",no graph? it's awesome! but if u add a graphic calculator it'll be excellent
5,"January 31, 2017", Does what it sets out to do. Being able to switch between simple (less clutter) and scientific mode is great
5,"May 3, 2014","Excellent calculator I've tried several calculator apps and this is by far the best and it is free with no ads. Also, it has a list of common physical constants stored in memory and you can add more if you wish."
5,"February 10, 2016",Excellent! Nicely done. Looks good and seems to have all of the features I might need from a calculator without unnecessarily invasive permissions or features.
5,"June 29, 2015","Top of the class I must have tried at least 7 or 8 scientific calculators and this one is by far the best, none of the others even came close. For it to be free and advert free is amazing. Well done."
2,"September 18, 2014",Small Buttons and Bad UI The input is not very accurate if it is not typed with great concentration. Dull UI.
4,"March 1, 2015","Really good but... I can't seem to do equations on this. That's something Id really like to see, but pretty damn amazing for the rest 👍"
5,"October 30, 2014","Downloaded five, use this one Despite the very British name, it's perfect for American engineering students like me who just want a capable, well designed, no frills scientific calculator with minimal ads or privacy permissions. Downloaded five scientific calculators to try them out; this is the one I use."
5,"July 25, 2016",Superb Much more accurate results for inverse trigonometric functions than my real scientific calculator. I would recommend to improve its UI and make the buttons larger.
5,"November 14, 2016","I love it After testing many apps I FINALLY find this one! It has the recall last expression function! The interface is classy, concise, display is large.Good work!"
5,"January 8, 2018"," Aplikasi ini sangat membantu saya dalam pekerjaan. Gratis dan tanpa iklan. Kemana saya bisa mendonasikan uang saya untuk pengembangan aplikasi ini? Terima kasih banyak, dan sukses"
5,"November 12, 2014",The best! This is the best one or the you can get which focuses on the propose it is made for! Simple but with all the functions you expect from a scientific calculator app... love it!!!!!
5,"November 6, 2014",Among the best Saved me so much effort when I got to work with lists of numbers
5,"March 22, 2015",Perfect Awesome app ! Perfect for students and when I'm bored I type stuff using the letters ! It's so helpful ! An easy 5* !
1,"January 7, 2015",Hate it If only there was zero stars
5,"April 10, 2017", I like it simply because you require no added permissions plus it works for hip pocket solutions on the fly
5,"February 19, 2015","Sita Ram Chhonkar Good application , I always use."
5,"December 18, 2014","Show as fraction function!!! ...or as decimal.. Awesome, if only I could use this app for my medical entrance exam..."
5,"July 7, 2014","Best Scientific Calculator Really, It's the best scientific calculator that I have ever used."
4,"August 13, 2014", Strictement interdit dans la cours d'une ecole ou un csmpus.
5,"August 26, 2014",Newton All time best download from play store. Too classic to be for free. I give it 5x5 star.
5,"July 5, 2015",Awesome No need to buy the hand scientific calculator
5,"April 13, 2014", Very good app contain all function
2,"April 19, 2015", The rad won't change into degree
5,"May 27, 2015",BEST SO FAR This rocks far better than other. It's awesome!!!
4,"April 16, 2016",Good Would be great if long pressing would function like the 2nd button
5,"June 13, 2014","Great app! No unnecessary permissions, such as reading phone contacts."
5,"October 16, 2016", Just what I want from a scientific calculator
4,"September 12, 2015"," I think this is good, first time to use it. Let me explore further."
4,"June 29, 2016",Small buttons Good calc but i want a larger buttons and polar form in degrees.
5,"April 24, 2014",Nice free apss Decimal and grouping number should also available in input
5,"June 14, 2014",A first rate technicians assistant Just what the Dr ordered.
5,"January 27, 2018",Outstanding scientific calculator I installed a lot of scientific calculator recently and this one is the best
5,"January 13, 2016", The best calculator app I have seen ever
5,"September 4, 2014",The best I don't use any calculator any more this is the best
5,"May 10, 2014",Shfahat khan It is really nice and very easy in using
5,"February 9, 2017",Holdz A Hi Grade!! All along GreatlY helpful
5,"January 3, 2016", Good but could have made it more easy to use...
5,"November 18, 2014",Very accurate. Very accurate trig func.  Tons of working options. Great layout.
5,"May 30, 2015","Awesome! Unarguably, the best calculator app."
5,"April 25, 2015",Mathapp scientific calculator Best for everyday use
5,"December 29, 2015",5 stars Awesome app! Thanks for app!
5,"August 29, 2014", It's very simple and useful to me
5,"September 20, 2014", Its interface is very simple and useful
5,"March 6, 2015", useful  as  both  ordinary  and  scientific  calculator
4,"May 5, 2014",Too good Best so far
5,"April 8, 2016",Powerful Maximum calculation all the way
5,"October 25, 2017", Best calculator app hands down
5,"February 7, 2015", COOL AND FUNCTIONAL APP!
4,"February 16, 2015", I like it
3,"August 25, 2014",good it seem to be good but copying functionality
5,"July 30, 2014"," Lovely, need to be more customisable"
4,"November 2, 2017", The best scientific calculator.
5,"December 20, 2017"," Use it all the time, love it"
5,"July 1, 2015", No ads. The best
5,"November 19, 2015",Good ! Simple and useful
5,"August 4, 2015", 2 thumbs up!
5,"February 1, 2016", its great i use this in school
5,"February 6, 2016",The best Simple to use
5,"June 27, 2017", Best calculator ever!!!
4,"May 11, 2014",Good It helps me..
5,"December 29, 2016", Superb app!
5,"February 12, 2016",Fs REALLY GOOOOOOD
5,"April 18, 2014",Niceeeeee Briallant app
5,"October 15, 2017", Very good tool
5,"April 16, 2015", Super
4,"March 28, 2015", great app.
5,"October 19, 2014", Excellent!
5,"August 14, 2014", Usefull !!
5,"September 10, 2014", Great!!!
4,"September 1, 2014", Not bad
5,"May 18, 2015", Nice App
4,"May 19, 2014", Doing well
5,"May 2, 2018", very useful
5,"September 5, 2014",Good Good good good
5,"August 21, 2017", Wonderful......!!!
5,"April 27, 2014", Good
5,"April 22, 2015", Awsome
5,"April 24, 2017", Love it
5,"March 19, 2014",Best free scientific calculator Before this calculator I install 5 or 6 apps but all of them can't compare with this. Thank you!
5,"February 11, 2014","Awesome Runs smooth and fast. Others will charge after so long, not this one. Perfect for what u use it for."
5,"April 6, 2014","Best scientific calculator on the market No add, runs smooth, bottoms are small but nothing to complain"
5,"March 7, 2014","Good No ads, has all the functions I could possibly want from a free calculator."
5,"February 14, 2014",Substitute for my calci I found this satisfying me to a great height.
5,"February 8, 2014","GREAT Beautiful , works great, just what I need"
3,"February 18, 2014",Just what I needed It's kool
5,"March 20, 2014",Best........ This is the greatest hits  and the best of the greatest calculator ever...... love it.....
5,"March 14, 2014",Nice and very helpful Great app
5,"February 21, 2014",good i know it will be useful .
5,"February 12, 2014",Best calculator ever! Best calculator ever!
3,"March 4, 2014",Easy to use. Nice
5,"March 6, 2014",Excellent Gud job
5,"April 1, 2014", An excellent calculator
5,"March 9, 2014",Wow 
5,"February 16, 2014",Great app 
5,"February 19, 2014",Great app :) it would have been better if the buttons were slightly bigger though. 
5,"February 9, 2014","Best Calc Excellent. Not only looks good, but also if has everything I could wish in a calculator.  Even if i don't need graphing (anymore) I might consider getting the complete package.  From a basic engineering perspective it is - THE CALC -."
5,"February 5, 2014",better great calc for everyone engineers to junior high... better than handyCalc because it shows the calculation history as you execute instead of having to scroll through pages.  blows HF calc out of the water of course.  just wish you could change the size of the buttons larger.
4,"December 25, 2013","Excellent calculator. Only one small problem. On my Pantech Element tablet, the output window only auto scrolls every two calculations. So, when the screen is full, I won't be able to see the next calculation output. I'd either scroll manually or do another calculation and then the output window will scroll to the bottom...Full ReviewOnly one small problem. On my Pantech Element tablet, the output window only auto scrolls every two calculations. So, when the screen is full, I won't be able to see the next calculation output. I'd either scroll manually or do another calculation and then the output window will scroll to the bottom. I don't know why I get this problem on my tablet. The app runs on my Nexus 5 phone flawlessly and auto scroll works well. BTW, my tablet is a 8 inch display and runs Android 4.0.4. Thanks."
5,"September 26, 2013",Wow.. Simply the best. I have used so many calculators. The output saver of this one made me come here and thank these developers. Good work guys. Thanks from India.
5,"December 9, 2013",Does what it says on the tin Perfect app. No annoying ads or strange permissions. Does exactly want you want it to do and is incredibly easy to use
5,"November 13, 2013","Finally! Used to have the TI calculator app, but I guess it got taken down... this is such a great replacement!"
4,"December 20, 2013",Nice ......okay oaky app But some changes are required !!! deg and rad options r not in calc we need 2go 2 settings and change that and size of arithmetic signs are small.....pls see thr2 that
3,"September 30, 2013",Mathematically incorrect Does not support BODMAS calculation order (Brackets Orders Multiply/devision Add Subtract) 6÷2(1+2)=1 but this app tells me its 9
5,"October 16, 2013","Good for many reasons. Love the look and interface!   This team obviously knows what they are doing. Looks good,  makes sense,  lots of options."
5,"December 28, 2013",It feels like a Computer Algebra System! Best scientific application on Android developed by the best programmers! It's an enhanced mobile version of the default Speedcrunch calculator on most LINUX systems. I love the Discrete Maths/Set Theory functions. It feels like a Computer Algebra System more than it is a scientific calculator. Flaw...Full ReviewBest scientific application on Android developed by the best programmers! It's an enhanced mobile version of the default Speedcrunch calculator on most LINUX systems. I love the Discrete Maths/Set Theory functions. It feels like a Computer Algebra System more than it is a scientific calculator. Flawless!
5,"December 7, 2013","Impressive All the functionality you might need and more. Statistical functions, extra math functions (like random()), support for lists, etc...  Plus no extra permissions required. I am impressed."
4,"October 2, 2013",I am not able to find permutation and combination function I am not able to find permutation and combination function.. can anyone help me...
5,"December 3, 2013",Bodmas?? To the person with the issue about bodmas its really multiplication or division from left to right. And parenthesis are actually correct.
5,"January 14, 2014",No ads No crap.. A must have sci cal app !
5,"December 22, 2013","Excellent app A very good app, easy to use and without all the permissions the other apps request. It has all i need for a scientific calculator app."
5,"October 19, 2013","All I need at my fingertips Basically a well designed application, sober and very useful. I can travel less loaded now."
5,"October 9, 2013","Samsung No permissions required, excellent"
4,"December 30, 2013","Good job 6/2(2+1) In Casio fx4100p, The answer is 1. Why?"
5,"January 3, 2014","finally, what i was waiting for i feel like I'm already used to it. try it! tnx dev"
5,"September 24, 2013",Excellent on Samsung Tab3! Thanks to you all!
4,"January 18, 2014",cannot convert from decimal to bin where is dec subscript?
3,"September 23, 2013",too complicated :/
5,"November 15, 2013",Best calculator I have tried a variety of scientific calculator apps and I have to say that MathsApp is the best
5,"November 7, 2013",excellent.app thanks for your dedication and making the Android platform more appealing
5,"December 19, 2013","Great Works well,  pretty helpfully n easy interface"
4,"January 15, 2014",Best It realy help me a lot Nice app.
3,"January 31, 2014","Its good I install it,its good,a useful app"
5,"December 15, 2013",Excellent. Exactly what I was looking for. Great job.
5,"January 26, 2014", Excellent app I love it
5,"February 3, 2014", Way better than the others
5,"December 18, 2013", Amasing better that i expected
5,"January 9, 2014", Best with no ads
5,"October 29, 2013", Perfect calculator
5,"October 14, 2013",Good Oooooooo......
5,"November 19, 2013", Good
5,"February 4, 2014",Does what it should. Perfect 
5,"April 11, 2013","Excellent calculator. My only gripe is that the screen uses my phone's system timeout, so an option to keep the screen on while the calculator is in use would be nice. Otherwise, this calculator is the best one I've ever used."
5,"May 24, 2013", I like it look professional and the template with feature is very useful and complete. With many options can choose. Great in android app of every calculator.	Good
5,"June 18, 2013",Can't Believe It's Free..... Superb calculator with all possible calculation parameters....My salute to the Dev for keeping this great app free...!!!
5,"May 5, 2013",Good scientific calc. Nice app. Turns ur mobile into a quite useful scientific calc.
5,"September 4, 2013", This is cool calculate it give me some fun it look to ti 89 but look cool tech
5,"August 7, 2013",Very good app Nice scientific calculator
5,"August 17, 2013",Gr8 Can be made more handy !!
5,"August 9, 2013",Great App! Very useful in class..
5,"August 16, 2013",Great Many functions that are useful
5,"August 25, 2013",Cool This calc is fast nd cool...
5,"August 1, 2013",Awsome Its Gud aap..
5,"May 11, 2013",Gr8 Its awesome
5,"July 15, 2013",Excellent Really good
5,"April 28, 2013",Thong Very good
5,"July 18, 2013",Like I love it
5,"August 21, 2013",Nitin Nice
5,"August 27, 2013", Great
4,"March 16, 2013","Great app.. but does need refinement.. Gotta admit it, great app.. for the first time dint have pblm wid negative exponentials.. one pblm though, does not seem to have Engineering output format.. it might not be a big thing for most bt definitely a must for me.."
5,"March 29, 2013","Simple, elegant Clean interface takes advantage of tablet touch screen and resolution.  The author obviously cares about both practicality AND presentation.  Love the tap history input.   THANK YOU!  Also thank you for not trying to copy some 30 year old calc.  Great in there time, let's move forward!"
5,"February 4, 2013","A superb calculator This is a superb calculator. It has many useful functions and a beautiful UI. Its list functions are particularly useful, and matrix support is planned. The ability to save variables and output is a bonus. Highly recommended."
5,"March 28, 2013",Great app I like this calculator a lot. It is the first one that I have found that let's me use numbers as small as 10^-18. And I really like the user interface!
3,"November 16, 2012",Ok Wouldn't solve my problem. It just kept saying value expected but wouldn't portray the value.
5,"January 1, 2013",Does the job Bigger buttons maybe
5,"September 16, 2012","Awesome. Works very well, also love the fact that it's free."
5,"July 3, 2012","MATHS APP - GREAT APP "" why the you the no clap is the ; here comes maths app is the . "" oh i love it"
5,"June 6, 2012","Smooth and complete Works smooth on Desire Z, very usefull and complete. No need to drag arround an heavy calculator anymore!"
5,"June 6, 2012", Pretty cool app
5,"July 14, 2012","Great calculator app, good customer support Easy interface, expressions and results are clearly seperated. 2nd and alpha funtion buttons work just like my pocket scientific calculator. Dev was quick in responding to my questions."
1,"November 3, 2013",Wheres the fraction symbol? I dont see a fraction symbol otherwise id download in a heart beat.
5,"September 14, 2014","Very Useful Since I dont have my scientific calcu with me, Still i have this one to help for my academics.  So its a 5-star app. :)"
5,"December 10, 2014",Good app for cheat  hahaha :p Hahahaha cheat 4rever :p
1,"November 17, 2012",Poo Doesn't calculate simple algebra and have the correct symbols in order to calculate algebra
5,"March 25, 2013",Must have This free version is so intelligently designed that I had to buy the Pro version.
5,"February 2, 2013",Fourier This is good aps! I apreciated alot
5,"June 28, 2013",It is very useful for student life who wants fast in his life. Excccccccelent device
5,"May 15, 2013",Excellent The best scientific calculator I have used so far
5,"November 13, 2014",Use full app I use this calculator . Good settings and views and features.
5,"December 24, 2014",The best calculator of all time I love it very much
2,"November 11, 2014",T^T Please have a EQN mode. T^T
4,"October 7, 2014",Calcus My scientific
4,"August 16, 2015",Asus zenfone 5 Very good app
4,"September 30, 2012",Samsung s3 This is very useful
5,"September 16, 2015", Lot of help
5,"September 26, 2015",Good Help in fast calculations.
5,"October 7, 2012", Great calc!
5,"May 27, 2013",Zahoor. nice & usefull.
5,"March 29, 2013",Gud app Gr8 app
4,"February 2, 2015", Gud
1,"November 23, 2015", Sal
5,"June 18, 2015", Yahoo
5,"September 28, 2017", It's fantastic
5,"October 16, 2016", Good app
5,"August 7, 2015", Perfect app
4,"August 5, 2012",good what i needed
4,"September 24, 2014", Liked it
4,"June 14, 2015", Best
3,"January 15, 2015", Nice
