5,"February 23, 2016","Great app! I always use it if I need to calculate anything, from simple arithmetic to sofisticated equations"
4,"November 12, 2015","Good app! Better than stock calculator on my phone! Love the DEC, BIN, HEX, OCT conversion."
5,"July 16, 2016",Utiliti Superb. One can get beyond expectations. Strongly recommend .
5,"September 4, 2017", This has replaced my HP calculator and I don't miss it anymore. Great app!
5,"October 2, 2017", Realcalc scientific calculator is very good useful and easy also I using this app from last three years
4,"November 18, 2016","Good one Great app, i enjoyed unit conversion specially  while calculating from various scientific literature..."
1,"October 22, 2015",Horrible I would like this yo look a lot better. Frfr
5,"June 6, 2016"," Used for a long time, much better than the built in calculator you normally get."
5,"May 26, 2016","Mário F C da Costa Thanks, it's the only one that I like."
5,"January 23, 2018", The best calculator so far. I have a feeling that I ak using a real calculator not mobile version.
5,"December 10, 2016",All I Need in a Calculator The familiar interface and simplicity are what keep me coming back to this app.
5,"November 25, 2015",Perfect It has everything from a scientific calculator....and makes no mistakes. Doesn't need any permision (of course !) and has no ads !!!!!!
5,"August 5, 2017", It's a nice  app. I have been using it for over 2 years. Excellent work by the originator of this app
5,"October 27, 2015",Engineer Did  a lot of civil calculations  and it performed great.
5,"May 13, 2018"," I love that this app *actually* looks and functions like a pocket 
calculator. No advertisements! Small footprint."
5,"May 6, 2017", Absolutely brilliant! Looks and operates just like a real scientific calculator. Everyone that sees it is impressed
5,"November 22, 2015", Used it for years so I purchased the pro version to show my support
5,"September 23, 2016",The only scientific calculator you'll need! It is the best there. Very easy to use.
5,"September 7, 2016","It does what I needed Free version works so fine that I want to buy the ""full"" version to contribute."
5,"November 2, 2015",Yes I'm so glad I don't have to buy a 40 dollar calculator
5,"March 6, 2016","The only calc I use It has everything I need. Resembles the physical one, closely."
5,"October 6, 2016","Samsung Galaxy S4 Cool app, I like the conversation into different types of measurements."
5,"November 24, 2015",The Best. Best calculator app that i ever had. Easy and practical to use. Well done provider (Y)
4,"August 29, 2016","Cool look! This app is great, better than any other calculator I've used!"
5,"April 3, 2017"," Amazing in use, optimized and super-lightweight. Shining example of how a well-developed application should look."
5,"December 5, 2016",Scientific Calculator Third time downloading on three different phones. Love this calculator very helpful. Thanks
5,"January 16, 2016",Just like my casio calculator Have everything i need and works really really great...... Thank you for making this....
4,"November 14, 2015", Nice one but I hate the layout
5,"May 4, 2018", При переключении в полный экран кнопки внизу экрана остаются.
5,"October 16, 2015"," Handy, useful for instant access to the basic design."
5,"June 10, 2016", A bit confusing although
3,"February 6, 2017", log function is a bit problematic
5,"January 26, 2017", The worst ever seen
5,"January 26, 2017","Perfect. I can use this for my physics, chemistry and maths homework.. Just perfect BBG."
4,"February 18, 2016",Error Sin 40 is wrong
1,"March 18, 2016", Cos for trigonometry no work
5,"August 8, 2016",Best Calculator I have been using it since first i know android phone ... Keep the best
5,"October 24, 2015",Great app! Using it for maths module in my degree and it's been perfect so far.
5,"October 17, 2015","Awesome Best calculator by far, great layout."
5,"January 21, 2016",Really useful The functional features available in it is really good. Its a proper calculator with a decent and good look.
5,"July 16, 2016", Has all that I need. This will be the 4th android I've installed on
5,"March 31, 2016","Perfect Unlike many apps, this does exactly what it should and doesn't bombard you with ads for doing it."
5,"May 10, 2016"," Defernately a good calculator, I needed a quick and easy one and this ticks all the boxes"
5,"October 17, 2015", First thing I install...
5,"October 9, 2016",Use it a lot. Works great.  Have had it for a few years and still think it's great. Thank you for keeping it wonderful.
5,"February 14, 2017", hi devs can you make degree/minute/second and fraction as free..please please please
5,"October 4, 2016",Useful Solving math problems use scientific calculator easy&fast
5,"March 27, 2016","Best ever ! If you are being used to scientific calculus , that's as real as it gets."
5,"February 18, 2016", An excellent compromise between a physical calculator and a touch interface.
2,"January 18, 2016", Sin doesn't work
5,"January 22, 2017"," This is an awesome calculator, I use it every day for years and I've never had a problem."
5,"January 9, 2016","Great Simple to use, stable, and looks good, thanks!"
5,"February 4, 2016",Perfect Its  good and best one yet!
5,"August 31, 2017"," Best calculation app ever seen I love it, by my views everyone must install it"
5,"October 21, 2015","This is an excellent app This is an excellent app. Well crafted and intuitive. Worth paying for. But it's free, so it's five stars."
5,"April 16, 2016",Great Helps me in my work
5,"June 4, 2017"," Works great, but I just need a cal for simple things."
5,"November 27, 2015",Good RPN calculator I use this all the time.  I like the RPN. Lots of memory slots for constants I need often.
5,"March 19, 2016",Very nice There's a reason this app has over 10 million downloads... It's great!
5,"February 29, 2016",Love it. Exceptional and powerful tool. And it's so small compared to others. Keep the good work!
5,"May 12, 2016","Small size big function Best scientific calculator for android, small size with great function :thumbs up:"
1,"December 5, 2017", Can't tell what I've selected
1,"April 13, 2016", cacad nian eh asli parah cos nyo ccd
5,"August 20, 2016",The only one I depend on RPN Chemist and Stats.
5,"November 5, 2015",About to go paid version That's how much I like it.
1,"February 8, 2017", This app sucks balls the tangent doesn't work nothing works it is just horrible
5,"March 19, 2017", Best calculator for Android I've seen so far. Excellent and very highly recommended
3,"February 11, 2016", Good but no graphing function most scientific calculators have it
5,"October 31, 2015", Really useful! Just like the real one. Deserve 5 star! Keep the progress~
4,"May 22, 2017", The best calculator app if you want quick and complex calculations at your fingertips..
5,"May 3, 2016","Small size, complete, add-free Using it since last yr. Quite helpful :)"
1,"November 3, 2015",Hate this Doesn't work
5,"November 1, 2015",Perfect I loved it because it wasn't complicated to use and everything you need is right there..
5,"November 6, 2015",Its cool. Reminds me ov ma high school calculator..  the display  is wow.  Thnx
3,"November 7, 2015", How to calculate fractions?
4,"September 7, 2016", How can I check the history of my calculation please ?
5,"December 3, 2016",Excellent One of the best calculator apps out there. It is free which makes it even better.
5,"July 22, 2016",Felt right at home immediately Totally excellent. Conversions too. Keep up the good work
1,"January 24, 2016",Not complete It does not have factorial and saveral other things like power
5,"October 28, 2015",Awesome Easily the best calc app available. The developers really did an outstanding job.
5,"November 15, 2015",Best calc The one calculator I am still using since first install
3,"November 19, 2015",कमल अभी तो डाऊनलोड किया हु। देखता हु कैसा है।
1,"August 28, 2017", Dont download wast app ever this is valu for tan45= 1.619
5,"January 17, 2016",Wonderfull Great calculator aplication...i love it..thank you very much for ur work.
5,"April 9, 2016",Great app I loved it .. Its a great app to use when u dont have a scientific calc
5,"April 10, 2016", Now I can finish my math homework
1,"January 12, 2018", I NEED FRACTIONS ON FREE CALCULATOR APPS
5,"March 17, 2018", A melhor calculadora para engenheiros velha guarda 😁
5,"December 10, 2016",The one I use (RPN) Use conversions often.
5,"April 22, 2018"," Best free calculator I can find. I purchased the paid version just to 
support the developer."
4,"January 2, 2017"," Nice RPN Calculator and unit converter, just needs an option for landscape mode to improve it"
5,"April 18, 2016", Works awesome wish I had one just like it that was not on my tablet.
5,"August 26, 2016",Best calculator app I've ever seen! New themes would be great tho!
5,"November 23, 2016",going to send this man some money great calculator nice easy scientific functions.
4,"November 3, 2015",Awesome I like this app because it helps me learn math thumbs up👍
5,"August 15, 2016",Best  Android Scientific Calculator I've Seen nPr and nCr functions come in handy
5,"March 25, 2016",Presets for constants!!! We're in love. Wedding will be later in the year. Best calculator app ever.
5,"October 25, 2016"," Simple, easy to use, mimics the real-world calculator perfectly. A must have."
5,"November 30, 2015",Amazing rating all 5 stars for it It helps alot good app
5,"September 18, 2016",QUESTION: Where can I find a button for the exponent?
5,"December 2, 2016",best calculator app very helpful use it everyday going buy the calculator plus app too thanks
3,"October 31, 2015",The important thing's are missing How do i do 10 to the power of 8 and stuff its not the e^x
5,"January 4, 2017",One of the Best Great for conversions find myself using it often.
5,"July 7, 2016",Great app This calculator gives you a real view of scientific calculator. I love it
5,"April 9, 2016","Good..! Very good..! It performs all the duties ""honorably"". Very good... Easy to use, intuitive..."
5,"January 30, 2016",Good Good but how do you put in the half problems
5,"October 15, 2016",Calculator Because it helps in my maths lesson
1,"November 4, 2017",Scientific calc Casio fx 82 ms
5,"September 18, 2017", I install app Real sintific calculatrr
5,"October 12, 2017", Like the Conversation function.  Old school  segmented  digits.
5,"October 26, 2016","Original Melhor calculadora, funciona muito bem, supreendente."
5,"November 24, 2015",Too good Need I say more?
5,"November 7, 2016",Convinent Had the square root in it and that helped out
1,"April 15, 2016", Doesn't do logarithms without showing wrrors4
5,"November 19, 2015",Has a real feel to it My phone has turned into a classy calculator
5,"January 19, 2016", Like that doesn't require any special permission
5,"December 17, 2017", Best scientific calculator app available.
5,"December 11, 2015",Better than the rest I've tried a lot of calculator apps and this is the best one.
4,"December 3, 2015","Love it But need more advancement in it , that's why i give 4 stars not 5"
1,"February 9, 2016"," Terrible ""scientific"" calculator"
5,"May 30, 2016", Does everything I was hoping it would!
5,"February 22, 2018", Best calculator app ever. However it's not there on play store :(
5,"June 14, 2018", My go to tool in the lab. RPN rules!
5,"March 1, 2017", Please add payments via paytm also.
5,"July 5, 2016",Loving it Helping me alot to solve many complex degrees in trignometry
5,"November 28, 2016",Accountant My preferred go to calc!
5,"May 6, 2017", Great calculator app in a very crowded field.
5,"July 5, 2016",Really Best Calculator App This is the best app I've ever used.
4,"November 1, 2016",Fractions Would love to see them implemented. Also a number to a fraction would be amazing.
5,"January 17, 2018", Use this app as my main calculator. For years.
5,"July 12, 2017"," So good, so much for free, for so long! Thanks, it's time for me to upgrade in appreciation."
2,"November 26, 2016"," Only 1 line display, no history"
5,"September 21, 2016",Legit Saved my ass in AP Chem.
4,"June 29, 2017", Nice app. Must have been configured for unit conversion for electrical engineering also.
5,"January 15, 2016",Yep Looks just like it should. Works like it too.
3,"May 4, 2016", It is nice and all but I can't seem to find the result history.
5,"September 15, 2016",Best RPN calculator out there Comfortable to use. The conversions are really useful.
5,"July 16, 2018", Is biest. Lok laik reel kalkulat
5,"September 2, 2016",Excellente. Would be nice if Playstore featured 10 stars. No queries. The best calculator.
5,"March 24, 2016",Best calc It would be great if you will add more constants
5,"August 15, 2016",Great Scientific Calculator This has all the functions a basic calculator should have
5,"January 1, 2016", Scientific calculator is great   So easy to use even this old Grammy  can do it
5,"May 14, 2016",Real calculation This is a great calculator.  It does everything I need and more.
5,"December 11, 2015",Really amazing app Very helpful during math and physics brain eating questions
5,"June 13, 2017"," Très complète, la meilleure pour moi."
5,"June 10, 2017", This is real calculator ...thanks for this app
4,"July 24, 2017", Does this have the star symbol thingy
5,"October 30, 2015", Yohh  therefore science iz every  where
5,"May 21, 2017", this is very lite weight app with cool design and many useful features... I like this app
5,"November 21, 2017", Android magicians needing an iPhone like
5,"June 8, 2017"," very small footprint on phone memory, can convert hex - decimal."
1,"August 25, 2016",One star too many Cancer
5,"May 27, 2016","Awesome tool! Reminds you of the good old days, and works great too!"
4,"January 10, 2018", Fav calculator app but needs split screen support to be really useful!
5,"January 7, 2016", Just like the usual sci calc
5,"December 18, 2015",ماشین حساب مهندسی خیلی عالیه
5,"March 10, 2016", Calculator too OP pls nerf
5,"March 3, 2018", Hope that can convert more units
5,"November 28, 2016","Very good scientific calculator Really like this. Clear, easy to use and thorough."
5,"November 14, 2015"," A calculator with a %, marvellous!"
4,"October 3, 2017", It's good but can be made more user-friendly and interactive.
2,"May 29, 2016",No fractions No fractions then what's the point of having this ?
4,"March 28, 2016",Does conversions for me I'm always switching from metric to u.s. standard this is great
5,"October 26, 2017", Best calculator in the play store🐼.
5,"March 8, 2018"," I av been using this for awhile and so far I av no complaints, I would recommend"
5,"June 20, 2017", Great app very close to the real thing.
5,"May 7, 2016",Never had a problem Been using it for more than half an year now.
2,"September 14, 2017", The parentheses button doesn't actually insert parentheses...
4,"July 24, 2016","Great Want variable names, but otherwise it's great! Thanks."
5,"June 23, 2016",Amazing Fell in love with it on first usage
5,"October 16, 2015",Great calculator Very well done free version. And more in the pro version
5,"April 18, 2017", It's very fantastic app I used 8 years old it's very helpful to engineers ....
5,"May 15, 2016","Brilliant Everything you want, nothing more and nothing less."
5,"April 26, 2016","Perfect Easy-to-use,  does everything I need to do. Five stars."
5,"June 7, 2016",Great free calculator I'm really happy to have scientific calculator like this with free charge
5,"September 21, 2016","Excellent Very useful, is upto standards unlike other similar apps."
4,"April 3, 2018", Definitely 5-Star if the display font size is a bit bigger :)👌
3,"December 16, 2017", Doesn't show the formula on the screen
3,"March 15, 2018"," It's good as a calculator, but not for math, mainly circles and radians."
5,"May 14, 2016",Best I've found Just installed it on my third or fourth phone.
5,"February 9, 2016",Good Other than as a calculator I mostly use this calculator for conversion purpose.Its excellent.
5,"April 22, 2018"," Excellent app for simple maths and binary, octal and hexadecimal number 
maths too."
5,"January 4, 2016",Awsome IVE FINALLY FOUND AN APP WITHOUT ADS (this one)
5,"February 8, 2016",Very functional Awesome for when you don't have a calculator at hand! 👍
5,"January 31, 2016", Genuinely a good app dose exactly as it promises without adverts or any of that stuff
1,"November 16, 2015",Calculator aha E recomandat de profu de mate.....  E clar
4,"May 4, 2016",Great calculator Is the widget only available. In the paid for version?
5,"December 10, 2015"," Very useful, user friendly, every thing we need."
5,"August 30, 2016",Real calc Scientific calculator.
5,"September 23, 2016",Fine I accurate value will cms in fraction of seconds super and coooly
5,"September 9, 2016",Totally Recommend Love it. Better than the other apps. 5 stars Earned
1,"August 30, 2016",How to do e^-.78 Its not possible here to do e^-.78 here
5,"January 4, 2018", It's like a real calculator
5,"November 17, 2016", This app is insanely useful. It really helps me with my homework.
5,"May 19, 2018", खुप छान ऍप आहे.
5,"January 24, 2017", Works like a calculator should
4,"November 16, 2015", For Working land surveyor
1,"March 15, 2016", Can't even store answers
4,"October 19, 2017", Not speeder than me
4,"November 19, 2016",A nice light weight app Excellent app covering the all tour needs
5,"January 11, 2018", It does what it needs to do
5,"February 19, 2016",Only app to have Commas.
5,"April 20, 2016",Rating I like this calc
5,"December 23, 2016", Just like HP 41cx
5,"March 13, 2017", My favirute calculator app
5,"November 29, 2016", Works well on my phone.
5,"June 13, 2016", Like a true scientific calculator
5,"July 17, 2016",This shoud be the top of the list! The best calc app ever
5,"March 5, 2016",Easy to use has everything I need Best calculator I've tried.
3,"February 12, 2016",Real calc Gud app
5,"January 11, 2017",Miss Viewed calculater app
3,"February 16, 2016", Try natural scientific calculator
1,"September 19, 2016", Dose not work
4,"January 8, 2017","Retired Cabinet Maker Very good at finding angles, tangents,areas, sines,and cosines."
5,"January 29, 2016",Wow Really help!!
5,"November 9, 2016",Calculator Use it ALOT
2,"June 9, 2016", Not easy to use
1,"February 15, 2016", Doesnt work
5,"October 23, 2016",Very useful I can make everythings to calculate. thanks for this app
1,"February 15, 2017", Since when is 1+5×10=15. Or 5+1×10 =51?
5,"November 7, 2017", The best calculator for Android (or any other phone OS).
5,"November 20, 2015","Great! No permissions required and free, what more do you want??"
4,"November 5, 2016",Wow Works very well.
5,"January 7, 2018", Works great! Best calculator app I've ever used.
5,"January 4, 2016",Easy to use app I give this a 5star. The best app. Well done
3,"February 15, 2018"," Good calculator, but it does not support multi window view"
4,"November 2, 2017", Better if it included history buttons (Up/down) also
5,"May 23, 2018", The only Android calculater app you'll ever need. Perfect.
4,"July 17, 2016", Looks and also operates like the real one....
5,"September 24, 2017", Best calci app I have come across so far.
5,"September 7, 2017", The best calculator by far and it is add free - well done!
5,"August 10, 2016",Bagus Gk usah beli calc yg asli... Hihihi...#hemat
5,"November 7, 2015",Great app You don't need much more than what this app offers
2,"July 13, 2018", There should be more functions..
5,"January 28, 2016",Great app but single line Everything is working and great but it's single lined
5,"November 10, 2016",Best calculator I have used till date I loved using it.
5,"May 12, 2017", Works great on my Galaxy S4 running Android 4.4 4!
5,"February 19, 2017", In my experience; simply the best free calculator app!
4,"April 15, 2017", This app is okay!👍
4,"April 25, 2017", It's a great help for those who don't  have scientific calculator
5,"October 28, 2017", I like the RPN mode. Very well done. Great App!
5,"December 20, 2015",Awesome But need improvement please I am not insulting
4,"January 5, 2018", This could be better if you can add the pie sign on it
5,"November 30, 2017", Does what is says on the tin.
5,"April 8, 2016", Excellent application but needs some updates specially for trigonometric part
1,"June 7, 2017"," Worest  calculator,beware  of it"
5,"August 29, 2016","appropriate permissions calculator works great, but with minimal permissions. thanks"
5,"March 4, 2016", how to reset the setting and preferences?
5,"May 18, 2017"," Simple to use, feature rich...the best one I've used!"
5,"March 18, 2017", Perfect for a Chemistry class. Used this app through Chem I and II.
4,"February 25, 2016"," Useful,evrythng working."
5,"December 12, 2017", Very nice calculator. Easy to use. Nice set of functions. Does units conversion.
5,"October 7, 2016",Brilliant calculator A must have application. Well done developers.
5,"May 12, 2018", Best Calculator and most Useful App in the whole Play Store. Period.
5,"June 23, 2016", I install it on everyone of my phones always have and probably always will
5,"April 16, 2016",The best My goto calculator for android. The conversion feature is handy.
5,"August 10, 2016","#1 free calculator If you're looking for a calculator, get it."
4,"April 10, 2016", How do i use c and p. ?
5,"August 2, 2017", Exsctly what I needed.
4,"November 20, 2016",Excellent calculator Excellent calculator app. Looks like real calculator and functional keys are good
5,"March 26, 2018", No ads!
5,"September 7, 2017", The best of his kind.It helps a lot with hexadecimal checksum calculation
5,"December 7, 2016",Best calculator app Better than the standard app. Use it all the time.
5,"September 16, 2017", Very nice apps. Thanks to the developers of this apps for free.God bless the developers and their family.
5,"April 14, 2016",Ideal This calc is perfect for everyday business and science requirements.
5,"October 29, 2016","Sushil Extremely good for everyone, especially for Engineers and Engineering students"
5,"December 27, 2015","Excellent Used it since the first release, still the best calculator"
5,"November 25, 2015","No ads! Thanks for the app, really helps with homework."
5,"December 28, 2015", Πολύ καλό. Το προτείνω.
4,"March 19, 2016",Cool Apps I love this apps.Its very workable with low bug
5,"September 27, 2017", Very good calculator.  I love the RPN version.  Very sweet.  I've used it for years.
5,"November 14, 2015",Nice It's a really good application for the use of the best way
5,"July 22, 2016",Throwback Takes me back to my first scientific calculator.
5,"September 2, 2016",Galaxy Note2 Amazing .. Just like real engineering calci.
5,"January 23, 2016", It works easy to use and my college professor uses it.
5,"September 2, 2016",The best I've downloaded this calculator on every phone for years
5,"March 21, 2016",Having an HP41 in my phone is awesome! Love this Calc app!  Thanks!
5,"October 16, 2015","Real Calculator 20151016-Fr., …7-We., …: up'd. R'b'r TI SR-51?"
4,"August 3, 2016", I want fraction 💔
5,"June 26, 2017"," Nice calculator with unit conversion , which is the best part of this app."
5,"August 29, 2016","Only calculator I use! Great features, easy to use."
5,"March 25, 2016",Perfect!!! Looks exactly like the one I grew up with!
5,"March 27, 2016",Best app in playstore Guys this is amaizing app. Everyone must download
5,"January 17, 2017",It's the real deal Operates as described. Maybe even better.
5,"July 7, 2016", I can't believe
1,"April 18, 2016", Doesn't work
5,"March 23, 2016",Nice nice Very helpful. Does exactly what it's meant to do.
5,"April 20, 2018"," Excellent calculator..have used it for years and no issues..highly 
recommended"
5,"March 15, 2016",Cool calculator Thanks for your hard work! Awesome.
5,"April 7, 2017"," Loved it for years, now I switched to payed version!"
4,"April 25, 2016",Awesome The layout is great and it's super easy to use!
5,"February 27, 2016",Great scientific calculator Great scientific calculator and its free what we need . its amazing
5,"December 18, 2015","Best Calculator I've Found... ... and I've looked at many.  Fantastic job,!"
5,"September 23, 2016",Best calculation app Beat calculation app I've ever used. Best Choice.
5,"July 28, 2017"," Great app. I upgraded, and was well worth the small fee."
4,"February 26, 2018", Please remove 10^n from display. the old display was much better.
5,"March 15, 2016",Its the best user friendly app from play store Awesome
5,"February 29, 2016",Good Fungsional lebih baik dri pda calculator standart
5,"November 7, 2015",Number 1 calculator Best calc for Android ever made
5,"August 31, 2016",Great calculator Not found anything that I need missing
5,"July 24, 2017", Efficient free app without ads and with all the needed functions
5,"December 21, 2015", Its good but i wish there was an antilog option as well..
5,"June 12, 2016","Have this on all phones Great calc, love everything about it."
5,"November 24, 2015","Simple, realistic, great Quick install. No permissions required. Effective."
5,"October 31, 2015",I love it Spend all your free money on this app
5,"January 10, 2016",Absolutely great! There is nothing about this calculator that isn't good.
3,"December 18, 2016", Nice but it does not show the calc being done
5,"March 30, 2016",Best It is avey nice scientific calculater software for engineers
