5,"December 2, 2015"," Absolutely the coolest app for free. The first thing I tried with it was a complex formula I use in Excel and it smoked. This free version covers all I need, it is awesome. The paid version must be impressive, has to be impressive. Going by what the free version will do, I may buy the paid version j...Full ReviewAbsolutely the coolest app for free. The first thing I tried with it was a complex formula I use in Excel and it smoked. This free version covers all I need, it is awesome. The paid version must be impressive, has to be impressive. Going by what the free version will do, I may buy the paid version just to support the company that created this mind blowing app. 5 Stars are not given, they are totally earned. Great job Quartic Software. A+  I found this great app thanks to ""Gizmo's  Freeware"" site. I give credit to Gizmo's because without them, I may have never heard of RealCalc Scientific Calculator. It will become my all time favorite app."
5,"May 6, 2018"," I was looking for an app that behaved like my calculator, and this one fits the bill.  So many apps try to use an entry method that looks more like you'd write out the equation on paper, however for most calculations this means more keystrokes and less familiarity for those who have used a calculato...Full ReviewI was looking for an app that behaved like my calculator, and this one fits the bill.  So many apps try to use an entry method that looks more like you'd write out the equation on paper, however for most calculations this means more keystrokes and less familiarity for those who have used a calculator for years and don't want to re-learn how to use one.  My only suggestion to the developers is to use a better picture of the app on the play store to make it easier to see what you're getting.  It would have saved me a lot of search time."
4,"October 13, 2016","Great, but... The app is perfect for making just about any calculation you need, and I love that it looks like an actual calculator. However, I don't like that it doesn't display the equation you enter, it only shows the numbers, and then has top or side icons for (+ - × ÷, and brackets, powers, etc). That's the ...Full ReviewThe app is perfect for making just about any calculation you need, and I love that it looks like an actual calculator. However, I don't like that it doesn't display the equation you enter, it only shows the numbers, and then has top or side icons for (+ - × ÷, and brackets, powers, etc). That's the part that I dislike very much. I prefer seeing the whole equation that I'm typing in, not in parts."
4,"April 30, 2016",Not your everyday calculator I downloaded this for school and I have another one for those quick little things. This one is super powerful has all the features I need but my only complaint is how it keeps the decimal as far to the left as possible. I would prefer it to leave it out when there is no decimal (12 is shown as 12.00...Full ReviewI downloaded this for school and I have another one for those quick little things. This one is super powerful has all the features I need but my only complaint is how it keeps the decimal as far to the left as possible. I would prefer it to leave it out when there is no decimal (12 is shown as 12.000000000 which makes it a little messy) and keep is as far right as possible. Otherwise I love this one and recommend it.
4,"November 2, 2017"," BEST CALCULATOR APP  This app helps me perform all the calculations I make. But the only problem is that I can't find antilog of a number using this app; so I have to go on to use another source. ""Adding the antilog function"" would turn my rating to five stars. Otherwise, it is quite convenient to u...Full ReviewBEST CALCULATOR APP  This app helps me perform all the calculations I make. But the only problem is that I can't find antilog of a number using this app; so I have to go on to use another source. ""Adding the antilog function"" would turn my rating to five stars. Otherwise, it is quite convenient to use, so a huge thumbs up :D"
3,"July 30, 2016","Was great, no split screen = uninstall This was my go-to calc app & suddenly it refuses to work with the android split screen. It was able to, & was very handy; now unable to = uninstall. Pro-tip: don't refuse what the end user wants to do if you want to stay relevant."
5,"December 15, 2015",The best calculator app out there This has to be one of my favourite apps on the play store. Very reminiscent of my college days. Other calc apps are trying too hard by adding too many features or by using screen real estate unnecessarily. This one's the mama bear of calculators. Hats off to Quartic software for creating one that do...Full ReviewThis has to be one of my favourite apps on the play store. Very reminiscent of my college days. Other calc apps are trying too hard by adding too many features or by using screen real estate unnecessarily. This one's the mama bear of calculators. Hats off to Quartic software for creating one that doesn't require ANY special permissions.
5,"April 5, 2016","RPN capable -- works well As good as any of my favorite HP calculators, and that's saying a lot.  Might like to customize some colors and locations and sizings one day, but this one does so much I give the free version 5 stars in the"
5,"October 3, 2016"," A long time ago, I knew somebody that had a hundred dollar calculator. I honestly have absolutely no idea how to use this calculator. But I know Walmart has one just like this app, but for a hundred dollars. So, I installed this app. Just for that reason. Its just a smart thing to do I guess. Ill ad...Full ReviewA long time ago, I knew somebody that had a hundred dollar calculator. I honestly have absolutely no idea how to use this calculator. But I know Walmart has one just like this app, but for a hundred dollars. So, I installed this app. Just for that reason. Its just a smart thing to do I guess. Ill add stuff up later..."
5,"May 11, 2016","Great RPN Calculator In college I used a Hewlett-Packard 42S calculator that I still have on my desk at work. This doesn't have the tactile feel of those old school devices,  but it's a great app  if you're used to using RPN. I highly recommend it.  Better yet - it's free and doesn't have annoying ads."
5,"April 15, 2016","Very good Calculator App~ For some reason I find myself coming back to use this app over & over across all my devices, I think the UI is sleek & very easy to use. Even if you dont use all the features I still recommend this app!"
4,"June 6, 2017"," Sometimes it's a bit confusing when the previous number is not shown when entering a new number after an operator. I think the key pads can be made smaller to make room for two rows that show previous and current numbers entered. This could be optional feature.  Another optional feature I think woul...Full ReviewSometimes it's a bit confusing when the previous number is not shown when entering a new number after an operator. I think the key pads can be made smaller to make room for two rows that show previous and current numbers entered. This could be optional feature.  Another optional feature I think would be helpful is immediate execution mode. For example, when you enter 9-3*2, you get 12."
5,"August 29, 2016","Perfect calculator app I've been using this for years now and have finally upgraded to the pro version because although it's not something I use daily, it works perfectly and looks beautiful. It would be one of the first apps I'd install on a new phone and it's been off great use to me time and again. Thanks for a fantast...Full ReviewI've been using this for years now and have finally upgraded to the pro version because although it's not something I use daily, it works perfectly and looks beautiful. It would be one of the first apps I'd install on a new phone and it's been off great use to me time and again. Thanks for a fantastic app."
5,"April 29, 2016","like my old friend In 1976 I went to the college bookstore and plunked down close to a month's rent for a Sharp ""Electronic Slide Rule.""  Back in the day, that's what we called it if it could do trig functions and logs.  I loved it!  And Real Calc has the same persona. Everything is so natural.  It is more powerful th...Full ReviewIn 1976 I went to the college bookstore and plunked down close to a month's rent for a Sharp ""Electronic Slide Rule.""  Back in the day, that's what we called it if it could do trig functions and logs.  I loved it!  And Real Calc has the same persona. Everything is so natural.  It is more powerful than my old friend but that is acceptable.  I have the paid version."
5,"March 20, 2016",Great app One of my essential applications; one of the first I download on any new device. I'm just having difficulty getting to get the -log of a number. It seems to just return an error message as you have to input a value before you can press the log button. (Never mind. I just had to put the log of the re...Full ReviewOne of my essential applications; one of the first I download on any new device. I'm just having difficulty getting to get the -log of a number. It seems to just return an error message as you have to input a value before you can press the log button. (Never mind. I just had to put the log of the reciprocal. I feel dumb)
4,"March 9, 2018", Absolutely love it been using ever since was 1st released! Please add auto rotation. I use it landscape mode & have to use separate app that turns everything any direction but then I have to go and turn it off when I'm done using your app
5,"February 15, 2017"," Great! Looks and works just like a dedicated, stand alone, traditional calculator.  Has all the functions anyone could need.  More intuitive than others I have tried - especially the default Android app which is awful - I instantly felt able to use it.  Well done, Quartic."
2,"January 10, 2017","There are so many better ones I'm doing an strophysics degree so having a good calculator on my phone is pretty important. This is not it. You are unable to see the formula you're typing in which makes it IMPOSSIBLE to find a mistake. Also the sin function is no longer accurate at 0.001 rad (pathetic) I'm actually surprised that...Full ReviewI'm doing an strophysics degree so having a good calculator on my phone is pretty important. This is not it. You are unable to see the formula you're typing in which makes it IMPOSSIBLE to find a mistake. Also the sin function is no longer accurate at 0.001 rad (pathetic) I'm actually surprised that finding the square root of a number and then squaring it back gives the correct answer. If you need a scientific calc, get something esle. If you want a simple calculator, there are still better options."
5,"November 24, 2015","Best calculator app available. A seriously customizable, easy to use and understand, free calculator. What is not to love? This calculator gives one the ability to use the harder functions without becoming too complex for simple users. Great app!"
2,"February 9, 2016", The layout was disgusting. It tok me 10 minutes to make sure there wasn't a fraction button. I would strongly advise you find a different app or buy a real calculator...
5,"June 4, 2017"," This is the best Android calculator. I'm an engineer and have been using it for 5 years. I've periodically gone back and tried others on the play store, but none can match. I like the addition of RPN."
5,"November 11, 2017"," Great classic-style scientific calculator app. If you're looking for a good scientific calculator and are overwhelmed by the sheer number of awful calculator apps, you've come to the right place. This calculator does exactly what it says it does, and it does it well. It is also very tasteful in aski...Full ReviewGreat classic-style scientific calculator app. If you're looking for a good scientific calculator and are overwhelmed by the sheer number of awful calculator apps, you've come to the right place. This calculator does exactly what it says it does, and it does it well. It is also very tasteful in asking you to buy the pro version, kudos to developer(s)."
4,"June 23, 2016","Good app. But one annoying little gobbledygook. . So far, very good app. My only complaint is the decimal point key is to the right of the +/- key so that it is not next to the numbers with the +/- key in the middle.  How many times do I hit the +/- key when I want to type a number with a decimal...? I need a calculator to compute that! Especially ...Full ReviewSo far, very good app. My only complaint is the decimal point key is to the right of the +/- key so that it is not next to the numbers with the +/- key in the middle.  How many times do I hit the +/- key when I want to type a number with a decimal...? I need a calculator to compute that! Especially problematic when typing quickly. Very annoying. Can you just swap places between the decimal point and the +/- key? A simple thing like that would make this a 5 star app!"
4,"June 6, 2018"," A good calculator. Finally I can stop buying faulty 30yr old calcs from eBay since this one works the right way round. By which I mean ""4 sqrt"" doesn't error as it will on most of today's calculators!  Only four stars though because I do find it irritating that ""Pi"" is behind the shift key. Somethin...Full ReviewA good calculator. Finally I can stop buying faulty 30yr old calcs from eBay since this one works the right way round. By which I mean ""4 sqrt"" doesn't error as it will on most of today's calculators!  Only four stars though because I do find it irritating that ""Pi"" is behind the shift key. Something so essential and often used should have a better location. I would love the rather useless ""Percentage"" key which occupies prime location (useful for - er,.. who exactly?) to be replaced with ""PI""."
3,"June 6, 2017"," Good, but what a shame its button layout can't be made the same as a Casio! If only it could simulate a modern fx-82 or an older classic Casio I'd buy the Plus version immediately..."
5,"August 26, 2017"," Great calculator app for sure, but $3.49 is way to much. I'm a buyer at 99 cents. Wish it was named ""Calculator"" so it's easier to find/remember too! I hate hunting through my apps to find it."
5,"September 26, 2017", I got Realcalc because I wanted a good RPN calculator. How good is it? I have an iPhone 7 but will drag my old android phone with just for Realcalc. Better than as ny HP calculator I've had.
5,"September 17, 2016","Exactly what you'd expect This calculator does exactly what it's supposed to do. It resembles a real (Texas Instruments) calculator as closely as it possibly could. I love how clean and organize the interface is - just like a real calculator's look and feel. No nonsense, no ads, but all the functionality that can be expected...Full ReviewThis calculator does exactly what it's supposed to do. It resembles a real (Texas Instruments) calculator as closely as it possibly could. I love how clean and organize the interface is - just like a real calculator's look and feel. No nonsense, no ads, but all the functionality that can be expected from a calculator. I love it!"
5,"December 11, 2017"," Look no further, this is the best calculator on the market. I have had this calculator app since I bought my Droid Eris in early 2010. I've used this app on every phone I have had since then."
5,"October 19, 2015","Love it! Excellent full function scientific calculator. Meets all my needs, and best of all - it's free! What is there to possibly complain about? This is a perfect app for all my needs. A1÷"
5,"September 15, 2016","Realistic The closest to a real scientific calculator you'll ever get, probably even better. Would like to have statistical functions (average, deviation, etc.) as well. An option for financial calculator would be nice too."
5,"October 31, 2015","Awesome This is a very useful app. Instead of wondering if I have my calculator on me, I can just pull out my phone. It works just like a sole-purpose scientific calculator."
5,"October 18, 2016","intuitive Ui I'm waiting for the other shoe to drop, like so many perfect apps which developers feel the urge to wreck by making unnecessary changes!  Dev, you've done a great job please work on something else!"
5,"October 15, 2016","Old School ! Takes a little getting used to because of its extensive features. (It's been a while since college when I last used one of these in real life, lol). But it has a good help function. Every function you can think of, and then some."
5,"January 30, 2016","Awesome app, can get even better. Finally I found the app which I needed the most. Its working fine for me and I consider myself lucky to have found this app. But I believe it can get even better if there is an addition of mode button to change the calculator's mode like in a real scientific calculator.."
1,"February 12, 2016",Shows spam ads as notifications In notifications bar ads constantly show for calculators. A calculator app shouldn't show notifications in the first place let alone spam.
5,"January 5, 2016","Great and very useful! Just like a manual calculator,even easier to use.The thing that I find distracting at times is the vibrate feature upon tapping a certain key."
5,"January 21, 2016","Exactly what it says on the tin It's simply a classic, nice-looking, easy to use scientific calculator. Does what it says, doesn't try to be overly fancy or have unnecessary features. It's what I would expect out of a nice scientific calculator I'd buy at a store."
4,"February 22, 2018"," Nice layout and free, but not worth paying for the pro version 'to support further development' as last update was October 2015. Shame as a lot of comments give good suggestions for improvements but I guess this is a dead product now ?"
5,"March 28, 2016","Pretty great! So the fact that you can't see your full equation is a little annoying, but no big deal, but this app has no extra permissions (as any simple calculator should) and therefore, no usless caller ID! You might ask yourself, why would a calculator have caller ID??? Tbh im just as confused as you are, bu...Full ReviewSo the fact that you can't see your full equation is a little annoying, but no big deal, but this app has no extra permissions (as any simple calculator should) and therefore, no usless caller ID! You might ask yourself, why would a calculator have caller ID??? Tbh im just as confused as you are, but you'd be surprised to find that that exists. It's dumb I know. But this app isn't like that! It's actually good! You need a free calculator app? Get this one. Trust me."
3,"April 10, 2016","Great calculator, annoying upgrade notices It's a good calculator, and ad-free, which is good.  But the constant (literally every time I start the app) nags to upgrade to the paid app made me find an alternative."
3,"April 8, 2016","Was a 5-star app Real calc look, no fishy permission requirements. Implementing ads and nagging dropped rating to 3."
5,"November 27, 2016","Good scientific calculator It's exactly what it's advertised to be - a scientific calculator. All the needed functions, no ads, even a history feature which is very practical. It's the only calculator I use now."
4,"December 1, 2017"," I've been using this app since the days of Android 1.6 (Doughnut).   It's always worked great for me, but it seems the developer has quit updating it, as the last version is from 2015 (it's almost 2018 rn). For that reason alone I take off two stars."
2,"October 28, 2016","It's cool but Please add negative sign please, I need negative sign, you will be the first phone calculator to have negative sign, please add it then i will rate 5, and thanks if you did add negative sign."
5,"December 16, 2016","Best Calculator! Highly recommended! I tried several calculators and this one is the best. Does everything I need with absolute ease. Yes, offers much more I don't use but still the best."
5,"September 6, 2016",Best Calculator App! Thank you! Very useful! Reminds me of my scientific calc when i was in college. And the most important thing is it's completely ad-free!
5,"July 15, 2016","Smart calculator! My HUAWEI smartphone is truly ""smart"" with RealCalc Scientific Calculator. The app has such a perfect UI design and feel of a standalone scientific calculator I feel like a college student all over again carrying my phone..."
1,"September 12, 2017", Was an amazing app at one point but now half of my buttons are greyed out and I can't select them anymore. Very disappointing.
5,"August 24, 2016",Best ever apps. This is a best apps since I bought my first Android phone I have installed and using there is no error and about the calculator it's awesome !!!!!!! It's having internal unit convertor which is useful for engineers person.  Thanks for your app.
4,"January 29, 2016"," One of the best couple of calculators after trying few dozen. I'm hesitating to purchase only because I need a way to be able to view and edit the whole expression with parentheses, operators etc. which is invaluable feature in many other calculators for even the simplest calculation."
4,"May 2, 2017", So far has been the best scientific calculator I've found here.   The pro version is overpriced.
5,"April 15, 2016","Great, esp if you like RPN This is a really nice Android scientific calculator. If you liked the HP-15c, you'll love this, which allows 4 levels of stack visible at once. Suggestion: touch-drag keys to get alt function, this is faster than long-press, and long-press could open other funcs , eg sin,asin,sinh,asinh, sec,asec,si...Full ReviewThis is a really nice Android scientific calculator. If you liked the HP-15c, you'll love this, which allows 4 levels of stack visible at once. Suggestion: touch-drag keys to get alt function, this is faster than long-press, and long-press could open other funcs , eg sin,asin,sinh,asinh, sec,asec,sinc all on one key with no 'hyp' or 'shift' needed. Also, would love to see a 'complex' mode (an HP15c feature) as part of the upgrade."
5,"July 13, 2016",Machine shop use Great little calculator app to have at work. Now I have an excuse to keep the cell phone on me at all times. Lol
5,"September 28, 2016",No unnecessary permissions Does what it is supposed to do very well without asking for access to any private unnecessary information on your phone. Keep it up!
5,"May 3, 2017"," Extremely responsive functionality shifting rapidly between binary, octal, and hex calculations.   An extremely short learning curve to figure out how to activate these important functions( Settings( 3 dotted button above the Shift key & tick the box entitled "" Radix Modes "" to enable these function...Full ReviewExtremely responsive functionality shifting rapidly between binary, octal, and hex calculations.   An extremely short learning curve to figure out how to activate these important functions( Settings( 3 dotted button above the Shift key & tick the box entitled "" Radix Modes "" to enable these functions ).   Nonetheless, OUTSTANDING APP!!! Great work!!! Well deserved 5-Star rating.  I appreciate the app a bundle."
2,"March 30, 2016",Could be better Not as good as other free calculators because you only get DMS and fraction functions on the paid pro version so only a 2 star!
5,"July 14, 2017", There isn't any better!  I have been using the free version for several years and that is better than any other calculator.  I've upgraded to the paid version and the BEST just got better!
4,"November 11, 2015"," This is precicely what I need, and works absolutely brilliant, the only comment to make, is that it is sometimes frustrating that this doesn't keep a record of your calculations on the free version of this app, but otherwise, this app is better than other apps, to the point that this is my second ph...Full ReviewThis is precicely what I need, and works absolutely brilliant, the only comment to make, is that it is sometimes frustrating that this doesn't keep a record of your calculations on the free version of this app, but otherwise, this app is better than other apps, to the point that this is my second phone I'm installing it in."
5,"March 26, 2016",Really good and ad free calc Very good and easy to use. Don't need any extra suspicious permissions like others. Most of all ad free. It does the job what I need it for and I don't need any extra pro features but I will buy the pro to support the devs. Keep up the good work. Definitely recommended to my friends and family.
4,"February 25, 2016",It looks cool and is efficient but.. It all great except one tiny thing. I wish the calc. would show the equation when you're typing instead of just giving you the answer
5,"August 23, 2017"," My wife keeps a calculator in the cabinet, but I couldn't even find ""pi"" on that one.  Now I always have a killer scientific calculator with me on my phone.  Much like a knife, the most important thing about a calculator is having it with you when you need it."
5,"January 26, 2017", I like the big buttons and clean look of this calculator.  It uses proper operator precedence for calculations.  I like it very much even though I've only had it for less than half an hour.
5,"June 27, 2016","Outstanding calculator app Full featured, nice memory storage (would be nicer if the rcl and sto were top keys instead of second functions though). Conversions very useful, programmer digital calculations handy. Like being able to copy and paste values with the high precision internal values instead of just the display precis...Full ReviewFull featured, nice memory storage (would be nicer if the rcl and sto were top keys instead of second functions though). Conversions very useful, programmer digital calculations handy. Like being able to copy and paste values with the high precision internal values instead of just the display precision. A must-have app!"
