5,"August 20, 2017", Excellent. My only problem is I can not upgrade to the pro version as you have to pay through your android with its joke security and googles everpresent eyes.
3,"September 8, 2016","Good calculator, but untrustworthy. Try cos (pi). Surprised it wasn't -1? I was too, and it makes me worry that the algorithms used for trigonometric solves in this don't adequately account for all the edge cases. It's one thing if Flappy Bird has round off errors, but a calculator shouldn't. Please look into the edge cases of all you...Full ReviewTry cos (pi). Surprised it wasn't -1? I was too, and it makes me worry that the algorithms used for trigonometric solves in this don't adequately account for all the edge cases. It's one thing if Flappy Bird has round off errors, but a calculator shouldn't. Please look into the edge cases of all your functions a bit deeper. There's a lot of literature out there on catching them. Also check out test based development if you haven't already. A good unit test would have caught this."
5,"February 17, 2016","Functional, add free & no permissions required From my yet limited experience andwhat I could read in the comments, it is exactly what every app should be; functional, add free and without any permission needed. I am buying the payed version for the sole purpose of supporting dev-team and as a recognition for a job well done. Great work! Keep yo...Full ReviewFrom my yet limited experience andwhat I could read in the comments, it is exactly what every app should be; functional, add free and without any permission needed. I am buying the payed version for the sole purpose of supporting dev-team and as a recognition for a job well done. Great work! Keep your coolness up."
1,"September 9, 2016", Not even an e function for 200e6 to represent 200*10^6. And no line of calculation so you better hope you're only doing simple multiplication... Not for big formulas
1,"February 26, 2016",Good calc... but During the month i had it installed it used up like 1.3 gb of my internet data... anyone care to explain why?
5,"January 12, 2016",The best on Android! Hands down! I've used this calculator for tasks spanning from physics and high level math to accounting and everyday arithmetic. It has replaced my stock android calc. I use it primarily in RPN mode. I have tried many other 3rd party calcs...none come close to RealCalc's UI and performance. It's the best calc o...Full ReviewI've used this calculator for tasks spanning from physics and high level math to accounting and everyday arithmetic. It has replaced my stock android calc. I use it primarily in RPN mode. I have tried many other 3rd party calcs...none come close to RealCalc's UI and performance. It's the best calc out there! And there are no ads!
2,"December 4, 2015",What happened to thus app? Was perfect. Now i can't enter formulae as it does each calculation immediately like a regular calculator with fancy buttons. 👎                                  check out scientific calculator app to see how a real scientific calculator works.
2,"March 31, 2016",No display It does all the calculations but I cannot see what I am doing making it hard when doing trigonometry.  Stupid idea
5,"March 22, 2017", The best scintific calculator as app ever. I have tried a lot of math calculators and none of them are this light weight working pefectly on any phone and with a cool realistic fesign and pefectly acurate calculations. I have used this app for 4 years now and both the old and the new vesion is great...Full ReviewThe best scintific calculator as app ever. I have tried a lot of math calculators and none of them are this light weight working pefectly on any phone and with a cool realistic fesign and pefectly acurate calculations. I have used this app for 4 years now and both the old and the new vesion is great. Fast relaiable and good. GREAT JOB GUYS your app should be higher listed in the math app lists.
5,"October 13, 2016","RPN + no ads + haptic + reliable + attractive = good! I'm using RealCalc on an LG Tribute (4.5"" screen, Kitkat) and am very happy.  The more I use RealCalc the more I like it!  Be sure to visit Quartic's website for a TON of support info.  I suspect I will be purchasing   RealCalc Plus soon.  Suspect hiding the navigation bar (aka ""immersive mode"") wou...Full ReviewI'm using RealCalc on an LG Tribute (4.5"" screen, Kitkat) and am very happy.  The more I use RealCalc the more I like it!  Be sure to visit Quartic's website for a TON of support info.  I suspect I will be purchasing   RealCalc Plus soon.  Suspect hiding the navigation bar (aka ""immersive mode"") would  be an improvement."
5,"September 3, 2016","Superb calculator! I tried a few free calculator apps and this was BY FAR the best. It starts instantly, looks realistic, it has lots of built-in functions and features including OCT BIN HEX conversion, but is also straightforward to use for more common operations. Also built-in is a comprehensive help guide, FAQs, re...Full ReviewI tried a few free calculator apps and this was BY FAR the best. It starts instantly, looks realistic, it has lots of built-in functions and features including OCT BIN HEX conversion, but is also straightforward to use for more common operations. Also built-in is a comprehensive help guide, FAQs, release notes for each version and it has a few configuration options including digit display type. There are no ads. If you want an intuitive non-programmable, non-graphing calculator, get this one!"
4,"April 3, 2017", Ans x (-1) = gives syntax error. This is true for all such equations. Kindly upadate otherwise superb app
4,"December 21, 2015","Holidays sale? Hey, drop the cost of your pro app for the Holidays and I'll definitely buy it! I don't need the extra stuff, but I'll feel good contributing to your dev efforts — and there's no better feeling than getting ""a deal""!"
5,"October 29, 2016","LG V20 this is by far THE BEST calculator here. This calculator not only does complicated equations, it also makes everyday ones easy. Especially doing % All I have to do as an example 100.00-20%= BOOM got the amount taken off and the amount you pay."
5,"August 15, 2017", Thanks for the free RPN and compute friendly calculator without ads or excessive permissions.  It not emulating something else is a great feature.
5,"March 16, 2016",A Must Have This is a Calculator that works with you. I love the Storage and History of results. Oh and all tgese features for The Best Free Calc on Android with no ads. Big Thanks to the Developers
5,"January 12, 2016",The best scientific calculator It really looks and feels like the calculators I used to use in the past. Great UI!
1,"August 3, 2016",Nope Dont have a degree minute second button like in a real casio calc. Fx hard to use
5,"April 29, 2017", BETTER then the real thing. No wonder I cannot find any physical ones in the store. This has taken it's spot!
5,"November 24, 2015",So great!!!! Has a great feature were you can stop the screen from turning off!!!! I love it!!! The only thing I would change is to add a feature were you can work with fractions. You currently have to convert them to decimals before working with them. But it really is a great app!!!!!
5,"October 29, 2015","SUPERB This is amazing! I like it more than these physical calculators. The other best thing is that it has no adverts. Great, big up guys."
3,"March 18, 2017", Does the math accurately but can be tedious to use without being able to see what you've already typed in your function like you can in every Texas Instruments I've ever used.
5,"February 26, 2016","IRONIC FOR AN OLD MAN I honestly don't know whether to laugh or cry. Back in 1984 when I was in college, I spent nearly $200 for a Texas Instruments calculator that all these functions for my civil engineering classes.  Now, three decades later, I'm retired from that line of work and I'm able to download that same calcul...Full ReviewI honestly don't know whether to laugh or cry. Back in 1984 when I was in college, I spent nearly $200 for a Texas Instruments calculator that all these functions for my civil engineering classes.  Now, three decades later, I'm retired from that line of work and I'm able to download that same calculator FOR FREE to my smartphone which cost me $200.  The smartphone does things people my age would never have dreamed of let alone believed."
5,"January 17, 2016","Just right Has all the functions I need, without being too complicated or fussy. Good clean user interface. Recommended."
5,"January 2, 2018"," It's a calculator, it does all the things you expect a calculator to do. Other than a real calculator with real buttons it can't be beaten."
4,"October 23, 2015",Will give 5 star if I couldn't find how to calculate  power of 10   if it is more than two like 10 to the power -19 ...hope u will undrstnd n pls tell me asap...thnq
5,"February 25, 2016","Good radix support Very easy to use for computer and hardware engineers. After a small learning curve the hex, binary modes are very convenient. I like the long key press feature, and the logical operators. Also the conversion feature is very nice."
5,"June 11, 2016","Just Plain The Best This is the first calculator app that I've ever used that does what I need. But more than that, it does it superbly well and is incredibly easy to use. It does what I've always measured computer programs by, it gives me the confidence to know that it will do what I need it to do. Fantastic tool!"
5,"November 21, 2015","Pocket Calculator My calculator runs out of battery quite often, so having this app is really handy! Works smooth, very light, and ad free! Perfection."
5,"February 26, 2016","Those guys are so crash No ads, and it's BIG and beautiful. Has ""-tan"" function... but not ""cot"", unfortunately."
3,"March 4, 2016","Not ergonomic ...due to this mimicking of an old 90s calculator. There should be more intuitive and straightforward ways to make the interface. However, it works fine."
5,"December 27, 2016",One of the best free apps This calculator emulates the real thing. So going from a cell phone to a real scientific calculator is not an issue or vice versa.
5,"November 15, 2015",Works just like the real thing. A great app. I don't miss my calculator except for bigger jobs.
3,"October 6, 2016"," I only downloaded it because i want to calc some numbers with minus exp but it doesn't accept any minus exponent so yeah thanks for wasting my time for a very simple feature.EDIT:thanks for the FAST RESPONSE,btw is there by any chance that you will start supporting more operation in one single time ...Full ReviewI only downloaded it because i want to calc some numbers with minus exp but it doesn't accept any minus exponent so yeah thanks for wasting my time for a very simple feature.EDIT:thanks for the FAST RESPONSE,btw is there by any chance that you will start supporting more operation in one single time like what MalMath app does..thanks anyway"
5,"November 6, 2015",I swear by it! With this app I don't need to carry another calculator. This application does all I ever need.
5,"July 27, 2017"," After  two decades of HP calculators , for me RPN seems simpler than the other way. There were other apps, but I,ve taken REALCALC from mobile to mobile. This app has practically all functionality of RPN calculation + the advantage of Touch input. Those who have calculation in part of their everyday...Full ReviewAfter  two decades of HP calculators , for me RPN seems simpler than the other way. There were other apps, but I,ve taken REALCALC from mobile to mobile. This app has practically all functionality of RPN calculation + the advantage of Touch input. Those who have calculation in part of their everyday life and need a  powerful, reliable and handy application at their service, really don't bargain REALCAL - nobody does once they found the best."
5,"February 8, 2016"," It stood by its name.   The app can change from the traditional scientific calc to RPN mode(the two values are to be entered before their operation).  The clipboard, unit converter, universal constants are more useful to engineers and students.  A great app though have high contrast color popup menu...Full ReviewIt stood by its name.   The app can change from the traditional scientific calc to RPN mode(the two values are to be entered before their operation).  The clipboard, unit converter, universal constants are more useful to engineers and students.  A great app though have high contrast color popup menus. But without any ads is appreciable."
2,"March 12, 2018"," Used to be really good, changed layout now rubbish. Just deleted it guess I'll have to find another."
5,"September 26, 2016",My most used app. Love it But how do I see my previous 50 calculations without copying to my clipboard? I may have something important already in my clipboard and want to see with a simple pop-up message box thingy what my history looks like. We are end users and we want the world in a bow tie.
5,"December 8, 2015","Just great No ads, rare nag screens, good keyboard layout, good choice of functions provided. Best RPN calculator I've found."
5,"October 22, 2016","BEST, FREE, MUST HAVE CALCULATOR IN THE STORE!!! I have purchased a $115.00 Texas Instruments (R) scientific calculators in the past, and for 100% less (I checked the math using this calculator to make certain I had the right percentage LOL and this calculator has done EVERYTHING I have ever needed it to do. So glad I found it!!"
5,"June 10, 2018"," Great app but it does not appear to calculate modulo's correctly for decimals.    For example, it shows 0.2 mod 7 as 0.2 when the correct answer is 3.  The way to derive the correct answer: 0.2 = 1/5 = 5 ^ -1  By Fermat's Little Theorem: 5^-1 mod 7 = 5^5 mod 7 = 3125 mod 7 = 3  The correct answer is...Full ReviewGreat app but it does not appear to calculate modulo's correctly for decimals.    For example, it shows 0.2 mod 7 as 0.2 when the correct answer is 3.  The way to derive the correct answer: 0.2 = 1/5 = 5 ^ -1  By Fermat's Little Theorem: 5^-1 mod 7 = 5^5 mod 7 = 3125 mod 7 = 3  The correct answer is 3."
5,"August 12, 2017"," 6÷2(2+1) needs to be entered as 6÷(2x(2+1)) Also, I haven't found global reset(memory too) [edit: RCL to retrieve&reset]  Nor can I get it OUT of ENG notation 1.00000000E00 is an absurd way to display 1[EDIT:FSE toggles Fix/Sci/Eng notation] (when active, TAB sets sig. Digits)  Back to 5⭐"
5,"May 26, 2016", The interface is good (just like the real thing?) and I am very partial to the look.  I much prefer this to my phone's default calculator.
4,"July 11, 2017"," Great calculator with nice extras, such as unit converters and constants. I also like the hex, bin, octal conversions. Only thing missing is a currency converter, that would make it perfect ☺"
5,"August 10, 2016","Tried the Rest & THIS Is Best Especially appreciate the multi- MR listing feature that stores up to 10 MR totals or ""clear all"" for simple calculator fumctions. Best feature is no screen clogging and RAM eating ads or popover's! Only topped by being FREE! Well done!"
5,"January 18, 2016", It is really convenient to use. I felt like I am using a real calculator just like its name. I like it.
5,"August 30, 2016","Wonderful I am in my second year of middle school and this, helps me so much. To correct mistakes,check homework, etc. This is Awesome!!!"
5,"February 16, 2017"," The app keeps asking me to rate it every time I open it, even though I already have. I usually just ignore it by selecting a declining option, but afterwhile it gets kind of annoying. Please fix. Thank you."
4,"August 30, 2016","Best i have used Can you pls add a X to Y button too? It exchanges x with y. eg. 10 ÷ 3, After pressing X&lt;&gt;Y it gives 3/10=0.3 Result. This used to be there in my casio scientific calculator."
1,"February 4, 2016","For kiddies No ads or spy ware , but old fashioned. E.g. have to type number then, say, square root button. I had a calculator in 1989 that allowed you to type out the whole equation before calculating. This is shite for any real student needing a scientific calculator."
5,"December 10, 2015", Its really good that i ve got real calc app on my tab. I hope it will work for me very well. I really needed it.
5,"June 30, 2017"," Real Calc's RPN mode has made all other calculators unusable for me. When I'm working at my computer and need a calculator, I won't use calc.exe and I won't use Google; I pull my phone out and use Real Calc."
3,"December 8, 2015","doesn't display the input this app has many functions but it doesn't display what I'm typing. It displays only the answer. If I make a mistake while giving input, how am I supposed to edit that if I can't even see that."
2,"September 25, 2017"," Not accurate. I've used it for a while with normal calculations but when it came to trig and geometry functions: sin, cos and tan and their -1 (oppesites) were way off so I switched."
4,"July 7, 2016",Great! My go-to calculator. I really like the way unit conversion is integrated. Would love it you could add ft-lbs to energy units!
5,"December 13, 2016","FEELS LIKE ORIGINAL ONE Feels like using the original scientific calculator. So easy, full with keys and numeric, and very useful. The best calculator so far. Thank you!"
3,"September 21, 2017"," There is a glitch?. BODMAS does not work as intended. Try calculating 6÷ 2(2+1) =1 not 9. BODMAS order of operation is to perform each bracketed calculation to leave you with a single number, allowing that set of brackets to be removed."
5,"November 19, 2015",RP Rules I can't  seem to use a regular calculator.  If it has a plus sign - I end up writing values on paper. This is a Brilliant App.
5,"January 2, 2016",Perfect Couldn't have asked for a better calculator app.  Works perfectly and very nice interface.  Highly recommend.
5,"November 6, 2016","Useful on my own If you require a scientific calculator while your out this is a good, retro styled version. The size of buttons on my small smartphone is useful. You can't use this in a formal examination however. The accuracy is good too."
1,"December 5, 2016",Sucks Thus app sucks sooooo bad ....-2X-2 does not equal negative four!hold the crap you can't even do simple math calculations it sucks soooo bad
5,"December 1, 2015","Best Calculator App Been using it for years. Simple interface. No pesky ads, and I have yet to have any problems."
1,"June 3, 2018"," Features of the free version got retracted during an update. There are no 
fractions and no constants anymore. After using this app for years, I habe 
stopped now. Sorry."
1,"August 24, 2016","Not good Has no fractions, what's the point of a scientific calculator without fractions"
5,"October 17, 2015","Impressed This calculator is well thought out and works well. The help, conversions and physical constants are very useful."
5,"November 3, 2016","Perfect Hi 2 your PROFESSIONAL group.I wish I could access to the full version in a free way because of this: mathematics must be developed. Thank you very much & with the best wishes, hopes and regards."
2,"June 4, 2016","Not great If youre not picky its fine, but there are much better calculator apps"
4,"September 29, 2017"," Sir please add D°M'S"" and power (^) function to solve several calculation, basically we need those function! Hope you are adding soon, then I'll give you 5 star! Thanking you!"
5,"June 15, 2017", This app saved my money from buying the real expensive scientific calculator and it do works as excellent as the real one. THANKS A LOT!
2,"May 26, 2018"," This app doesnt show your total equation input like other scientific 
calculators. I will try another one."
5,"January 2, 2017",Simple but powerful Great calculator! Wish it would let me get pro in my country.
1,"April 22, 2018"," It's impossible to do any sort of chained equation. Square roots are 
limited to individual numbers as well, making it next to useless."
5,"July 4, 2018"," Perfect, a free calculator with no ads. Needed something that switches 
between hex, binary and decimal. Gives you a little nudge toward the pro 
version but that's it. No here try our pro version for free and pay later. 
Top job guys."
5,"May 12, 2018"," It's my go-to calculator. It looks and works like real one. Plus some extra 
little things. Haven't tried plus upgrade yet."
5,"July 9, 2016","The best calculator app Easily the best available for serious calculating, very much like my old HP11C, which I love . Great thing is you take this app every where!"
1,"September 4, 2017","The worst app ever Every time I want to type something say for instans  I type 762+2 Then it says  8,00000000000"
5,"November 13, 2015","Excellent calc This is a great calculator with everything I need, especially RPN and conversions. Works like a dream, fast and easy to read the results."
4,"May 1, 2017", After using for a long time I just discovered the Arctan function is faulty.  The Arctan of -1 is -45 but this app returns -50. :(
4,"June 30, 2017"," Best FREE calculator app by far. No annoying ads, specialised functions, authentic & slick presentation."
4,"August 25, 2016","Sentinel Nicely done application :-) I am concerned about the paid vershion application permissions ... why would you wont access too my media file's, protected files, usb, etc ?? Worryingly & disturbing , can you give me an explanation for this ?? Regards Sentinel"
5,"January 29, 2018"," I have always used this app since day one. Amazing, accurate and comes complete with conversion feature for scientific units. Thanks so much.. Still using this great app in 2018... A***"
5,"November 15, 2015",Solid look and feel Like having a regular  calculator in your hands; I sometimes forget it's actually my smart phone.
5,"December 11, 2015","VERY EFFECTIVE CALC Y Don't worry install without hesitating it is very good app , easy-to-use , no adds, what you need in calc you get here MARVELOUS !"
5,"March 10, 2016",It Awesome Its like am handling a real scintific calculator in my hands .. I like the digital numbers and the big buttons with full screen .. And it startup quick nothing to load ... Its just perfect!
5,"March 6, 2016",I loved it Help me solve my problem
5,"June 3, 2016",แอปยอดเยี่ยม สำหรับการคำนวณเลย ขนาดเล็ก แต่ความสามารถครบถ้วน Best cal. App for me.
5,"November 6, 2015","Does exactly what it's meant to Free, no permissions needed, just a scientific calculator on your phone. Great work, devs."
3,"December 30, 2016",problem you can not calculate ( 2 root 5) in it.it shows calculation in single line only.
3,"June 1, 2017"," Couldn't figure out how to do a simple, 100x10^6 calculation"
5,"April 24, 2016",A Display I Can Read! I needed a magnifying glass to see the text on most of the other free -- and ad-free -- scientific calculators.
1,"May 16, 2017"," It doesn't even properly solve 6÷2(2+1), how can I trust it with complex calculations?"
2,"May 6, 2018"," I'd pay 10 GBP for ad free version. Having obtrusive ads in a calculator is 
no go !"
5,"April 4, 2018", Definately the best calculator of those I have tried. I love the fact that it keeps the screen on when doing calculations(if you set it in settings) and the fact it is easy to use. Will definately cobsider the pro version.
4,"November 30, 2016","Excellent, but This application is best in the market, but one thing needs to be add in conversion section, that is only ""Currency Converter"". after that, 5 stars."
5,"December 14, 2015","Best one No issues about this application, it is easy to use, smart looking, every thing is inside. I love this app"
1,"May 6, 2016",Errors Trying to calculate pH for chemistry and it won't let me you're in -log without an error
5,"January 26, 2016",THIS IS AMAZING It works so well and is super easy to download and use! It helps me with complicated homework and works a charm!
2,"February 1, 2017"," Its interface sucks, and the order of operations as far as entering commands goes is really inconvenient, even cumbersome."
5,"October 20, 2015","Perfect Love this calculator! Opens lightning fast (faster than stock Samsung calc),  looks awesome and has great features. I use it every day at work."
5,"October 24, 2015","Way better than stock calculator! This calculator has way more features than the stock calculator, and when looks like an old-school scientific calculator to boot. Conversions of units, trigonometric functions, basically what you'd expect a scientific calculator to do."
1,"October 30, 2017", Pathetic. Shift button doesn't even work u can only use this in addition and subtraction
5,"December 26, 2015","Perfect calculator - no privacy traps This ia a grat calculator with all the scientific features you want and it doesn't ask to access your identity, your location or camera, etc.  Pertect."
5,"November 3, 2015",Exactly what I need Easy to use and feels like my old calculator. The buttons are almost in  the same positions. Thanks!
5,"June 26, 2017", Best scientific calculator app. Used this for years and upgraded to pro. No intrusive ads and feels like real thing
4,"May 7, 2016",3D graphing feature I liked it but wish it had more features like a graph matrix and more support for longer (22-digit) octal strings (like most professional programmers need)
5,"February 14, 2017"," I searched for a calculator like this for a long time. I've now used it for years, and I've stopped looking.  Just thought it was time that I rated it."
5,"January 29, 2016",Does the lot everyone needs a scientific calculator... Vanished.... so I got it again... OK I probably switched SD cards... my bad
